A boy found the donut beside boxes that was hunted .	What is the theme of hunted ?	the donut beside boxes	cogs_qa	( ( ( A ) ( boy ) ) ( ( found ) ( ( ( ( the ) ( donut ) ) ( ( beside ) ( ( boxes ) ) ) ) ( ( that ) ( was ) ( hunted ) ) ) ) )
Emma crumpled a girl beside the hats that was drawn .	What is the theme of drawn ?	a girl beside the hats	cogs_qa	( ( ( Emma ) ) ( ( crumpled ) ( ( ( ( a ) ( girl ) ) ( ( beside ) ( ( the ) ( hats ) ) ) ) ( ( that ) ( was ) ( drawn ) ) ) ) )
Isabella slid a rose beside buckets that was cleaned .	What is the theme of cleaned ?	a rose beside buckets	cogs_qa	( ( ( Isabella ) ) ( ( slid ) ( ( ( ( a ) ( rose ) ) ( ( beside ) ( ( buckets ) ) ) ) ( ( that ) ( was ) ( cleaned ) ) ) ) )
Emma rolled the girl beside students that was eaten .	What is the theme of eaten ?	the girl beside students	cogs_qa	( ( ( Emma ) ) ( ( rolled ) ( ( ( ( the ) ( girl ) ) ( ( beside ) ( ( students ) ) ) ) ( ( that ) ( was ) ( eaten ) ) ) ) )
A creature improved a sailor beside boxes that was painted .	What is the theme of painted ?	a sailor beside boxes	cogs_qa	( ( ( A ) ( creature ) ) ( ( improved ) ( ( ( ( a ) ( sailor ) ) ( ( beside ) ( ( boxes ) ) ) ) ( ( that ) ( was ) ( painted ) ) ) ) )
Liam shortened the baby beside cakes that was painted .	What is the theme of painted ?	the baby beside cakes	cogs_qa	( ( ( Liam ) ) ( ( shortened ) ( ( ( ( the ) ( baby ) ) ( ( beside ) ( ( cakes ) ) ) ) ( ( that ) ( was ) ( painted ) ) ) ) )
Ethan improved the girl beside blocks that was cleaned .	What is the theme of cleaned ?	the girl beside blocks	cogs_qa	( ( ( Ethan ) ) ( ( improved ) ( ( ( ( the ) ( girl ) ) ( ( beside ) ( ( blocks ) ) ) ) ( ( that ) ( was ) ( cleaned ) ) ) ) )
The girl rolled a donut beside the children that was observed .	What is the theme of observed ?	a donut beside the children	cogs_qa	( ( ( The ) ( girl ) ) ( ( rolled ) ( ( ( ( a ) ( donut ) ) ( ( beside ) ( ( the ) ( children ) ) ) ) ( ( that ) ( was ) ( observed ) ) ) ) )
A scientist discovered the present beside frogs that was eaten .	What is the theme of eaten ?	the present beside frogs	cogs_qa	( ( ( A ) ( scientist ) ) ( ( discovered ) ( ( ( ( the ) ( present ) ) ( ( beside ) ( ( frogs ) ) ) ) ( ( that ) ( was ) ( eaten ) ) ) ) )
The boy floated the girl beside the roses that was eaten .	What is the theme of eaten ?	the girl beside the roses	cogs_qa	( ( ( The ) ( boy ) ) ( ( floated ) ( ( ( ( the ) ( girl ) ) ( ( beside ) ( ( the ) ( roses ) ) ) ) ( ( that ) ( was ) ( eaten ) ) ) ) )
Andrew burned the girl beside cakes that was known .	What is the theme of known ?	the girl beside cakes	cogs_qa	( ( ( Andrew ) ) ( ( burned ) ( ( ( ( the ) ( girl ) ) ( ( beside ) ( ( cakes ) ) ) ) ( ( that ) ( was ) ( known ) ) ) ) )
A mouse nursed the dog beside girls that was hunted .	What is the theme of hunted ?	the dog beside girls	cogs_qa	( ( ( A ) ( mouse ) ) ( ( nursed ) ( ( ( ( the ) ( dog ) ) ( ( beside ) ( ( girls ) ) ) ) ( ( that ) ( was ) ( hunted ) ) ) ) )
A girl found the cake beside donuts that was eaten .	What is the theme of eaten ?	the cake beside donuts	cogs_qa	( ( ( A ) ( girl ) ) ( ( found ) ( ( ( ( the ) ( cake ) ) ( ( beside ) ( ( donuts ) ) ) ) ( ( that ) ( was ) ( eaten ) ) ) ) )
A student discovered a block beside girls that was eaten .	What is the theme of eaten ?	a block beside girls	cogs_qa	( ( ( A ) ( student ) ) ( ( discovered ) ( ( ( ( a ) ( block ) ) ( ( beside ) ( ( girls ) ) ) ) ( ( that ) ( was ) ( eaten ) ) ) ) )
Amelia drew a jacket beside the cows that was seen .	What is the theme of seen ?	a jacket beside the cows	cogs_qa	( ( ( Amelia ) ) ( ( drew ) ( ( ( ( a ) ( jacket ) ) ( ( beside ) ( ( the ) ( cows ) ) ) ) ( ( that ) ( was ) ( seen ) ) ) ) )
The baby burned the hero beside cakes that was nursed .	What is the theme of nursed ?	the hero beside cakes	cogs_qa	( ( ( The ) ( baby ) ) ( ( burned ) ( ( ( ( the ) ( hero ) ) ( ( beside ) ( ( cakes ) ) ) ) ( ( that ) ( was ) ( nursed ) ) ) ) )
Emma painted a cake beside girls that was eaten .	What is the theme of eaten ?	a cake beside girls	cogs_qa	( ( ( Emma ) ) ( ( painted ) ( ( ( ( a ) ( cake ) ) ( ( beside ) ( ( girls ) ) ) ) ( ( that ) ( was ) ( eaten ) ) ) ) )
A boy rolled a girl beside children that was eaten .	What is the theme of eaten ?	a girl beside children	cogs_qa	( ( ( A ) ( boy ) ) ( ( rolled ) ( ( ( ( a ) ( girl ) ) ( ( beside ) ( ( children ) ) ) ) ( ( that ) ( was ) ( eaten ) ) ) ) )
Thomas cleaned the child beside cakes that was observed .	What is the theme of observed ?	the child beside cakes	cogs_qa	( ( ( Thomas ) ) ( ( cleaned ) ( ( ( ( the ) ( child ) ) ( ( beside ) ( ( cakes ) ) ) ) ( ( that ) ( was ) ( observed ) ) ) ) )
Thomas liked a book beside priests that was painted .	What is the theme of painted ?	a book beside priests	cogs_qa	( ( ( Thomas ) ) ( ( liked ) ( ( ( ( a ) ( book ) ) ( ( beside ) ( ( priests ) ) ) ) ( ( that ) ( was ) ( painted ) ) ) ) )
A cat drew a donut beside the boys that was called .	What is the theme of called ?	a donut beside the boys	cogs_qa	( ( ( A ) ( cat ) ) ( ( drew ) ( ( ( ( a ) ( donut ) ) ( ( beside ) ( ( the ) ( boys ) ) ) ) ( ( that ) ( was ) ( called ) ) ) ) )
The hen doubled the girl beside the cookies that was painted .	What is the theme of painted ?	the girl beside the cookies	cogs_qa	( ( ( The ) ( hen ) ) ( ( doubled ) ( ( ( ( the ) ( girl ) ) ( ( beside ) ( ( the ) ( cookies ) ) ) ) ( ( that ) ( was ) ( painted ) ) ) ) )
The donkey collapsed the box beside girls that was eaten .	What is the theme of eaten ?	the box beside girls	cogs_qa	( ( ( The ) ( donkey ) ) ( ( collapsed ) ( ( ( ( the ) ( box ) ) ( ( beside ) ( ( girls ) ) ) ) ( ( that ) ( was ) ( eaten ) ) ) ) )
The teacher liked a kid beside butterflies that was dusted .	What is the theme of dusted ?	a kid beside butterflies	cogs_qa	( ( ( The ) ( teacher ) ) ( ( liked ) ( ( ( ( a ) ( kid ) ) ( ( beside ) ( ( butterflies ) ) ) ) ( ( that ) ( was ) ( dusted ) ) ) ) )
The boy drew the prisoner beside the drinks that was painted .	What is the theme of painted ?	the prisoner beside the drinks	cogs_qa	( ( ( The ) ( boy ) ) ( ( drew ) ( ( ( ( the ) ( prisoner ) ) ( ( beside ) ( ( the ) ( drinks ) ) ) ) ( ( that ) ( was ) ( painted ) ) ) ) )
Lincoln knew a monkey beside the girls that was heard .	What is the theme of heard ?	a monkey beside the girls	cogs_qa	( ( ( Lincoln ) ) ( ( knew ) ( ( ( ( a ) ( monkey ) ) ( ( beside ) ( ( the ) ( girls ) ) ) ) ( ( that ) ( was ) ( heard ) ) ) ) )
Liam nursed the raisin beside blocks that was eaten .	What is the theme of eaten ?	the raisin beside blocks	cogs_qa	( ( ( Liam ) ) ( ( nursed ) ( ( ( ( the ) ( raisin ) ) ( ( beside ) ( ( blocks ) ) ) ) ( ( that ) ( was ) ( eaten ) ) ) ) )
The girl inflated the baby beside the cakes that was painted .	What is the theme of painted ?	the baby beside the cakes	cogs_qa	( ( ( The ) ( girl ) ) ( ( inflated ) ( ( ( ( the ) ( baby ) ) ( ( beside ) ( ( the ) ( cakes ) ) ) ) ( ( that ) ( was ) ( painted ) ) ) ) )
A child froze a girl beside the cats that was eaten .	What is the theme of eaten ?	a girl beside the cats	cogs_qa	( ( ( A ) ( child ) ) ( ( froze ) ( ( ( ( a ) ( girl ) ) ( ( beside ) ( ( the ) ( cats ) ) ) ) ( ( that ) ( was ) ( eaten ) ) ) ) )
A donkey rolled a cake beside biscuits that was noticed .	What is the theme of noticed ?	a cake beside biscuits	cogs_qa	( ( ( A ) ( donkey ) ) ( ( rolled ) ( ( ( ( a ) ( cake ) ) ( ( beside ) ( ( biscuits ) ) ) ) ( ( that ) ( was ) ( noticed ) ) ) ) )
A girl helped the pillow beside pupils that was eaten .	What is the theme of eaten ?	the pillow beside pupils	cogs_qa	( ( ( A ) ( girl ) ) ( ( helped ) ( ( ( ( the ) ( pillow ) ) ( ( beside ) ( ( pupils ) ) ) ) ( ( that ) ( was ) ( eaten ) ) ) ) )
Olivia rolled a mouse beside lions that was painted .	What is the theme of painted ?	a mouse beside lions	cogs_qa	( ( ( Olivia ) ) ( ( rolled ) ( ( ( ( a ) ( mouse ) ) ( ( beside ) ( ( lions ) ) ) ) ( ( that ) ( was ) ( painted ) ) ) ) )
The girl missed a driver beside the cookies that was seen .	What is the theme of seen ?	a driver beside the cookies	cogs_qa	( ( ( The ) ( girl ) ) ( ( missed ) ( ( ( ( a ) ( driver ) ) ( ( beside ) ( ( the ) ( cookies ) ) ) ) ( ( that ) ( was ) ( seen ) ) ) ) )
Emma pierced the cookie beside cakes that was eaten .	What is the theme of eaten ?	the cookie beside cakes	cogs_qa	( ( ( Emma ) ) ( ( pierced ) ( ( ( ( the ) ( cookie ) ) ( ( beside ) ( ( cakes ) ) ) ) ( ( that ) ( was ) ( eaten ) ) ) ) )
Olivia painted a girl beside melons that was investigated .	What is the theme of investigated ?	a girl beside melons	cogs_qa	( ( ( Olivia ) ) ( ( painted ) ( ( ( ( a ) ( girl ) ) ( ( beside ) ( ( melons ) ) ) ) ( ( that ) ( was ) ( investigated ) ) ) ) )
A manager ate the ball beside girls that was cooked .	What is the theme of cooked ?	the ball beside girls	cogs_qa	( ( ( A ) ( manager ) ) ( ( ate ) ( ( ( ( the ) ( ball ) ) ( ( beside ) ( ( girls ) ) ) ) ( ( that ) ( was ) ( cooked ) ) ) ) )
Ethan drew a cake beside the cats that was studied .	What is the theme of studied ?	a cake beside the cats	cogs_qa	( ( ( Ethan ) ) ( ( drew ) ( ( ( ( a ) ( cake ) ) ( ( beside ) ( ( the ) ( cats ) ) ) ) ( ( that ) ( was ) ( studied ) ) ) ) )
Carter painted a girl beside the cakes that was studied .	What is the theme of studied ?	a girl beside the cakes	cogs_qa	( ( ( Carter ) ) ( ( painted ) ( ( ( ( a ) ( girl ) ) ( ( beside ) ( ( the ) ( cakes ) ) ) ) ( ( that ) ( was ) ( studied ) ) ) ) )
Emma dusted a donut beside teachers that was heard .	What is the theme of heard ?	a donut beside teachers	cogs_qa	( ( ( Emma ) ) ( ( dusted ) ( ( ( ( a ) ( donut ) ) ( ( beside ) ( ( teachers ) ) ) ) ( ( that ) ( was ) ( heard ) ) ) ) )
Emma froze a drink beside lions that was hunted .	What is the theme of hunted ?	a drink beside lions	cogs_qa	( ( ( Emma ) ) ( ( froze ) ( ( ( ( a ) ( drink ) ) ( ( beside ) ( ( lions ) ) ) ) ( ( that ) ( was ) ( hunted ) ) ) ) )
Ella reddened a cake beside the kids that was nursed .	What is the theme of nursed ?	a cake beside the kids	cogs_qa	( ( ( Ella ) ) ( ( reddened ) ( ( ( ( a ) ( cake ) ) ( ( beside ) ( ( the ) ( kids ) ) ) ) ( ( that ) ( was ) ( nursed ) ) ) ) )
Henry dusted a landlord beside the buttons that was eaten .	What is the theme of eaten ?	a landlord beside the buttons	cogs_qa	( ( ( Henry ) ) ( ( dusted ) ( ( ( ( a ) ( landlord ) ) ( ( beside ) ( ( the ) ( buttons ) ) ) ) ( ( that ) ( was ) ( eaten ) ) ) ) )
Emma liked a poet beside the chalks that was painted .	What is the theme of painted ?	a poet beside the chalks	cogs_qa	( ( ( Emma ) ) ( ( liked ) ( ( ( ( a ) ( poet ) ) ( ( beside ) ( ( the ) ( chalks ) ) ) ) ( ( that ) ( was ) ( painted ) ) ) ) )
Liam liked a cake beside boys that was eaten .	What is the theme of eaten ?	a cake beside boys	cogs_qa	( ( ( Liam ) ) ( ( liked ) ( ( ( ( a ) ( cake ) ) ( ( beside ) ( ( boys ) ) ) ) ( ( that ) ( was ) ( eaten ) ) ) ) )
Emma loved a girl beside cats that was drawn .	What is the theme of drawn ?	a girl beside cats	cogs_qa	( ( ( Emma ) ) ( ( loved ) ( ( ( ( a ) ( girl ) ) ( ( beside ) ( ( cats ) ) ) ) ( ( that ) ( was ) ( drawn ) ) ) ) )
Mila burned a cookie beside cakes that was dusted .	What is the theme of dusted ?	a cookie beside cakes	cogs_qa	( ( ( Mila ) ) ( ( burned ) ( ( ( ( a ) ( cookie ) ) ( ( beside ) ( ( cakes ) ) ) ) ( ( that ) ( was ) ( dusted ) ) ) ) )
The penguin observed a captain beside the lawyers that was dusted .	What is the theme of dusted ?	a captain beside the lawyers	cogs_qa	( ( ( The ) ( penguin ) ) ( ( observed ) ( ( ( ( a ) ( captain ) ) ( ( beside ) ( ( the ) ( lawyers ) ) ) ) ( ( that ) ( was ) ( dusted ) ) ) ) )
The dog rolled a girl beside buyers that was called .	What is the theme of called ?	a girl beside buyers	cogs_qa	( ( ( The ) ( dog ) ) ( ( rolled ) ( ( ( ( a ) ( girl ) ) ( ( beside ) ( ( buyers ) ) ) ) ( ( that ) ( was ) ( called ) ) ) ) )
Olivia rolled the glue beside girls that was eaten .	What is the theme of eaten ?	the glue beside girls	cogs_qa	( ( ( Olivia ) ) ( ( rolled ) ( ( ( ( the ) ( glue ) ) ( ( beside ) ( ( girls ) ) ) ) ( ( that ) ( was ) ( eaten ) ) ) ) )
Liam rolled a pizza beside donuts that was hunted .	What is the theme of hunted ?	a pizza beside donuts	cogs_qa	( ( ( Liam ) ) ( ( rolled ) ( ( ( ( a ) ( pizza ) ) ( ( beside ) ( ( donuts ) ) ) ) ( ( that ) ( was ) ( hunted ) ) ) ) )
The boy touched the frog beside the queens that was nursed .	What is the theme of nursed ?	the frog beside the queens	cogs_qa	( ( ( The ) ( boy ) ) ( ( touched ) ( ( ( ( the ) ( frog ) ) ( ( beside ) ( ( the ) ( queens ) ) ) ) ( ( that ) ( was ) ( nursed ) ) ) ) )
The teacher discovered a chalk beside the cakes that was drawn .	What is the theme of drawn ?	a chalk beside the cakes	cogs_qa	( ( ( The ) ( teacher ) ) ( ( discovered ) ( ( ( ( a ) ( chalk ) ) ( ( beside ) ( ( the ) ( cakes ) ) ) ) ( ( that ) ( was ) ( drawn ) ) ) ) )
The girl broke the teacher beside the cakes that was dusted .	What is the theme of dusted ?	the teacher beside the cakes	cogs_qa	( ( ( The ) ( girl ) ) ( ( broke ) ( ( ( ( the ) ( teacher ) ) ( ( beside ) ( ( the ) ( cakes ) ) ) ) ( ( that ) ( was ) ( dusted ) ) ) ) )
Emma poked a bat beside the mirrors that was dusted .	What is the theme of dusted ?	a bat beside the mirrors	cogs_qa	( ( ( Emma ) ) ( ( poked ) ( ( ( ( a ) ( bat ) ) ( ( beside ) ( ( the ) ( mirrors ) ) ) ) ( ( that ) ( was ) ( dusted ) ) ) ) )
The child snapped a cake beside the lollipops that was hunted .	What is the theme of hunted ?	a cake beside the lollipops	cogs_qa	( ( ( The ) ( child ) ) ( ( snapped ) ( ( ( ( a ) ( cake ) ) ( ( beside ) ( ( the ) ( lollipops ) ) ) ) ( ( that ) ( was ) ( hunted ) ) ) ) )
Emma held the girl beside strawberries that was painted .	What is the theme of painted ?	the girl beside strawberries	cogs_qa	( ( ( Emma ) ) ( ( held ) ( ( ( ( the ) ( girl ) ) ( ( beside ) ( ( strawberries ) ) ) ) ( ( that ) ( was ) ( painted ) ) ) ) )
The girl froze the penguin beside the livers that was called .	What is the theme of called ?	the penguin beside the livers	cogs_qa	( ( ( The ) ( girl ) ) ( ( froze ) ( ( ( ( the ) ( penguin ) ) ( ( beside ) ( ( the ) ( livers ) ) ) ) ( ( that ) ( was ) ( called ) ) ) ) )
A girl froze the scientist beside cakes that was dusted .	What is the theme of dusted ?	the scientist beside cakes	cogs_qa	( ( ( A ) ( girl ) ) ( ( froze ) ( ( ( ( the ) ( scientist ) ) ( ( beside ) ( ( cakes ) ) ) ) ( ( that ) ( was ) ( dusted ) ) ) ) )
A boy reddened the girl beside the children that was eaten .	What is the theme of eaten ?	the girl beside the children	cogs_qa	( ( ( A ) ( boy ) ) ( ( reddened ) ( ( ( ( the ) ( girl ) ) ( ( beside ) ( ( the ) ( children ) ) ) ) ( ( that ) ( was ) ( eaten ) ) ) ) )
The boy missed the journalist beside the bats that was dusted .	What is the theme of dusted ?	the journalist beside the bats	cogs_qa	( ( ( The ) ( boy ) ) ( ( missed ) ( ( ( ( the ) ( journalist ) ) ( ( beside ) ( ( the ) ( bats ) ) ) ) ( ( that ) ( was ) ( dusted ) ) ) ) )
James appreciated a cake beside the teachers that was called .	What is the theme of called ?	a cake beside the teachers	cogs_qa	( ( ( James ) ) ( ( appreciated ) ( ( ( ( a ) ( cake ) ) ( ( beside ) ( ( the ) ( teachers ) ) ) ) ( ( that ) ( was ) ( called ) ) ) ) )
William slid a rose beside cakes that was eaten .	What is the theme of eaten ?	a rose beside cakes	cogs_qa	( ( ( William ) ) ( ( slid ) ( ( ( ( a ) ( rose ) ) ( ( beside ) ( ( cakes ) ) ) ) ( ( that ) ( was ) ( eaten ) ) ) ) )
Theodore juggled a penguin beside strawberries that was eaten .	What is the theme of eaten ?	a penguin beside strawberries	cogs_qa	( ( ( Theodore ) ) ( ( juggled ) ( ( ( ( a ) ( penguin ) ) ( ( beside ) ( ( strawberries ) ) ) ) ( ( that ) ( was ) ( eaten ) ) ) ) )
The girl adored the monster beside boys that was packed .	What is the theme of packed ?	the monster beside boys	cogs_qa	( ( ( The ) ( girl ) ) ( ( adored ) ( ( ( ( the ) ( monster ) ) ( ( beside ) ( ( boys ) ) ) ) ( ( that ) ( was ) ( packed ) ) ) ) )
Emma painted the lawyer beside drinks that was called .	What is the theme of called ?	the lawyer beside drinks	cogs_qa	( ( ( Emma ) ) ( ( painted ) ( ( ( ( the ) ( lawyer ) ) ( ( beside ) ( ( drinks ) ) ) ) ( ( that ) ( was ) ( called ) ) ) ) )
Sophia helped a pencil beside the horses that was dusted .	What is the theme of dusted ?	a pencil beside the horses	cogs_qa	( ( ( Sophia ) ) ( ( helped ) ( ( ( ( a ) ( pencil ) ) ( ( beside ) ( ( the ) ( horses ) ) ) ) ( ( that ) ( was ) ( dusted ) ) ) ) )
Zoe admired a dog beside donuts that was eaten .	What is the theme of eaten ?	a dog beside donuts	cogs_qa	( ( ( Zoe ) ) ( ( admired ) ( ( ( ( a ) ( dog ) ) ( ( beside ) ( ( donuts ) ) ) ) ( ( that ) ( was ) ( eaten ) ) ) ) )
Emma nursed a rose beside the cakes that was painted .	What is the theme of painted ?	a rose beside the cakes	cogs_qa	( ( ( Emma ) ) ( ( nursed ) ( ( ( ( a ) ( rose ) ) ( ( beside ) ( ( the ) ( cakes ) ) ) ) ( ( that ) ( was ) ( painted ) ) ) ) )
A director found a drink beside the girls that was cooked .	What is the theme of cooked ?	a drink beside the girls	cogs_qa	( ( ( A ) ( director ) ) ( ( found ) ( ( ( ( a ) ( drink ) ) ( ( beside ) ( ( the ) ( girls ) ) ) ) ( ( that ) ( was ) ( cooked ) ) ) ) )
The girl knew a boy beside the cats that was eaten .	What is the theme of eaten ?	a boy beside the cats	cogs_qa	( ( ( The ) ( girl ) ) ( ( knew ) ( ( ( ( a ) ( boy ) ) ( ( beside ) ( ( the ) ( cats ) ) ) ) ( ( that ) ( was ) ( eaten ) ) ) ) )
Noah found a cat beside the cakes that was seen .	What is the theme of seen ?	a cat beside the cakes	cogs_qa	( ( ( Noah ) ) ( ( found ) ( ( ( ( a ) ( cat ) ) ( ( beside ) ( ( the ) ( cakes ) ) ) ) ( ( that ) ( was ) ( seen ) ) ) ) )
Emma loved a cookie beside the donuts that was painted .	What is the theme of painted ?	a cookie beside the donuts	cogs_qa	( ( ( Emma ) ) ( ( loved ) ( ( ( ( a ) ( cookie ) ) ( ( beside ) ( ( the ) ( donuts ) ) ) ) ( ( that ) ( was ) ( painted ) ) ) ) )
The chicken reddened a butterfly beside mandarins that was painted .	What is the theme of painted ?	a butterfly beside mandarins	cogs_qa	( ( ( The ) ( chicken ) ) ( ( reddened ) ( ( ( ( a ) ( butterfly ) ) ( ( beside ) ( ( mandarins ) ) ) ) ( ( that ) ( was ) ( painted ) ) ) ) )
A boy rolled a human beside the babies that was eaten .	What is the theme of eaten ?	a human beside the babies	cogs_qa	( ( ( A ) ( boy ) ) ( ( rolled ) ( ( ( ( a ) ( human ) ) ( ( beside ) ( ( the ) ( babies ) ) ) ) ( ( that ) ( was ) ( eaten ) ) ) ) )
A girl hunted a cat beside children that was studied .	What is the theme of studied ?	a cat beside children	cogs_qa	( ( ( A ) ( girl ) ) ( ( hunted ) ( ( ( ( a ) ( cat ) ) ( ( beside ) ( ( children ) ) ) ) ( ( that ) ( was ) ( studied ) ) ) ) )
The girl cooked a cat beside presents that was eaten .	What is the theme of eaten ?	a cat beside presents	cogs_qa	( ( ( The ) ( girl ) ) ( ( cooked ) ( ( ( ( a ) ( cat ) ) ( ( beside ) ( ( presents ) ) ) ) ( ( that ) ( was ) ( eaten ) ) ) ) )
Skylar rolled the banana beside the boys that was painted .	What is the theme of painted ?	the banana beside the boys	cogs_qa	( ( ( Skylar ) ) ( ( rolled ) ( ( ( ( the ) ( banana ) ) ( ( beside ) ( ( the ) ( boys ) ) ) ) ( ( that ) ( was ) ( painted ) ) ) ) )
Emma liked the hero beside the turkeys that was eaten .	What is the theme of eaten ?	the hero beside the turkeys	cogs_qa	( ( ( Emma ) ) ( ( liked ) ( ( ( ( the ) ( hero ) ) ( ( beside ) ( ( the ) ( turkeys ) ) ) ) ( ( that ) ( was ) ( eaten ) ) ) ) )
Emma rolled the donut beside the raisins that was eaten .	What is the theme of eaten ?	the donut beside the raisins	cogs_qa	( ( ( Emma ) ) ( ( rolled ) ( ( ( ( the ) ( donut ) ) ( ( beside ) ( ( the ) ( raisins ) ) ) ) ( ( that ) ( was ) ( eaten ) ) ) ) )
Liam floated a raisin beside cakes that was painted .	What is the theme of painted ?	a raisin beside cakes	cogs_qa	( ( ( Liam ) ) ( ( floated ) ( ( ( ( a ) ( raisin ) ) ( ( beside ) ( ( cakes ) ) ) ) ( ( that ) ( was ) ( painted ) ) ) ) )
The fish froze the donut beside the boys that was observed .	What is the theme of observed ?	the donut beside the boys	cogs_qa	( ( ( The ) ( fish ) ) ( ( froze ) ( ( ( ( the ) ( donut ) ) ( ( beside ) ( ( the ) ( boys ) ) ) ) ( ( that ) ( was ) ( observed ) ) ) ) )
Emily rolled the cake beside lions that was dusted .	What is the theme of dusted ?	the cake beside lions	cogs_qa	( ( ( Emily ) ) ( ( rolled ) ( ( ( ( the ) ( cake ) ) ( ( beside ) ( ( lions ) ) ) ) ( ( that ) ( was ) ( dusted ) ) ) ) )
Joseph ate the butterfly beside roses that was painted .	What is the theme of painted ?	the butterfly beside roses	cogs_qa	( ( ( Joseph ) ) ( ( ate ) ( ( ( ( the ) ( butterfly ) ) ( ( beside ) ( ( roses ) ) ) ) ( ( that ) ( was ) ( painted ) ) ) ) )
Emma discovered a bat beside soldiers that was dusted .	What is the theme of dusted ?	a bat beside soldiers	cogs_qa	( ( ( Emma ) ) ( ( discovered ) ( ( ( ( a ) ( bat ) ) ( ( beside ) ( ( soldiers ) ) ) ) ( ( that ) ( was ) ( dusted ) ) ) ) )
Olivia loved the cake beside butterflies that was eaten .	What is the theme of eaten ?	the cake beside butterflies	cogs_qa	( ( ( Olivia ) ) ( ( loved ) ( ( ( ( the ) ( cake ) ) ( ( beside ) ( ( butterflies ) ) ) ) ( ( that ) ( was ) ( eaten ) ) ) ) )
Michael sketched the girl beside the cakes that was cleaned .	What is the theme of cleaned ?	the girl beside the cakes	cogs_qa	( ( ( Michael ) ) ( ( sketched ) ( ( ( ( the ) ( girl ) ) ( ( beside ) ( ( the ) ( cakes ) ) ) ) ( ( that ) ( was ) ( cleaned ) ) ) ) )
Noah rolled a girl beside boxes that was eaten .	What is the theme of eaten ?	a girl beside boxes	cogs_qa	( ( ( Noah ) ) ( ( rolled ) ( ( ( ( a ) ( girl ) ) ( ( beside ) ( ( boxes ) ) ) ) ( ( that ) ( was ) ( eaten ) ) ) ) )
Penelope burned the girl beside cakes that was drawn .	What is the theme of drawn ?	the girl beside cakes	cogs_qa	( ( ( Penelope ) ) ( ( burned ) ( ( ( ( the ) ( girl ) ) ( ( beside ) ( ( cakes ) ) ) ) ( ( that ) ( was ) ( drawn ) ) ) ) )
Emma ate a bag beside dogs that was nursed .	What is the theme of nursed ?	a bag beside dogs	cogs_qa	( ( ( Emma ) ) ( ( ate ) ( ( ( ( a ) ( bag ) ) ( ( beside ) ( ( dogs ) ) ) ) ( ( that ) ( was ) ( nursed ) ) ) ) )
Olivia rolled a cake beside lambs that was packed .	What is the theme of packed ?	a cake beside lambs	cogs_qa	( ( ( Olivia ) ) ( ( rolled ) ( ( ( ( a ) ( cake ) ) ( ( beside ) ( ( lambs ) ) ) ) ( ( that ) ( was ) ( packed ) ) ) ) )
Ava dusted the cake beside the girls that was painted .	What is the theme of painted ?	the cake beside the girls	cogs_qa	( ( ( Ava ) ) ( ( dusted ) ( ( ( ( the ) ( cake ) ) ( ( beside ) ( ( the ) ( girls ) ) ) ) ( ( that ) ( was ) ( painted ) ) ) ) )
Emma painted a boy beside the donuts that was drawn .	What is the theme of drawn ?	a boy beside the donuts	cogs_qa	( ( ( Emma ) ) ( ( painted ) ( ( ( ( a ) ( boy ) ) ( ( beside ) ( ( the ) ( donuts ) ) ) ) ( ( that ) ( was ) ( drawn ) ) ) ) )
A customer investigated a cat beside cakes that was eaten .	What is the theme of eaten ?	a cat beside cakes	cogs_qa	( ( ( A ) ( customer ) ) ( ( investigated ) ( ( ( ( a ) ( cat ) ) ( ( beside ) ( ( cakes ) ) ) ) ( ( that ) ( was ) ( eaten ) ) ) ) )
The girl liked the donut beside the cakes that was painted .	What is the theme of painted ?	the donut beside the cakes	cogs_qa	( ( ( The ) ( girl ) ) ( ( liked ) ( ( ( ( the ) ( donut ) ) ( ( beside ) ( ( the ) ( cakes ) ) ) ) ( ( that ) ( was ) ( painted ) ) ) ) )
Emma found a fly beside boys that was eaten .	What is the theme of eaten ?	a fly beside boys	cogs_qa	( ( ( Emma ) ) ( ( found ) ( ( ( ( a ) ( fly ) ) ( ( beside ) ( ( boys ) ) ) ) ( ( that ) ( was ) ( eaten ) ) ) ) )
Emma heard the donut beside the cats that was eaten .	What is the theme of eaten ?	the donut beside the cats	cogs_qa	( ( ( Emma ) ) ( ( heard ) ( ( ( ( the ) ( donut ) ) ( ( beside ) ( ( the ) ( cats ) ) ) ) ( ( that ) ( was ) ( eaten ) ) ) ) )
Zoe rolled a boy beside children that was eaten .	What is the theme of eaten ?	a boy beside children	cogs_qa	( ( ( Zoe ) ) ( ( rolled ) ( ( ( ( a ) ( boy ) ) ( ( beside ) ( ( children ) ) ) ) ( ( that ) ( was ) ( eaten ) ) ) ) )
Samuel shortened a customer beside the raisins that was cleaned .	What is the theme of cleaned ?	a customer beside the raisins	cogs_qa	( ( ( Samuel ) ) ( ( shortened ) ( ( ( ( a ) ( customer ) ) ( ( beside ) ( ( the ) ( raisins ) ) ) ) ( ( that ) ( was ) ( cleaned ) ) ) ) )
The teacher liked a donut beside girls that was cooked .	What is the theme of cooked ?	a donut beside girls	cogs_qa	( ( ( The ) ( teacher ) ) ( ( liked ) ( ( ( ( a ) ( donut ) ) ( ( beside ) ( ( girls ) ) ) ) ( ( that ) ( was ) ( cooked ) ) ) ) )
The guest held the girl beside cookies that was juggled .	What is the theme of juggled ?	the girl beside cookies	cogs_qa	( ( ( The ) ( guest ) ) ( ( held ) ( ( ( ( the ) ( girl ) ) ( ( beside ) ( ( cookies ) ) ) ) ( ( that ) ( was ) ( juggled ) ) ) ) )
Addison inflated the cat beside girls that was observed .	What is the theme of observed ?	the cat beside girls	cogs_qa	( ( ( Addison ) ) ( ( inflated ) ( ( ( ( the ) ( cat ) ) ( ( beside ) ( ( girls ) ) ) ) ( ( that ) ( was ) ( observed ) ) ) ) )
A boy froze the cake beside the producers that was eaten .	What is the theme of eaten ?	the cake beside the producers	cogs_qa	( ( ( A ) ( boy ) ) ( ( froze ) ( ( ( ( the ) ( cake ) ) ( ( beside ) ( ( the ) ( producers ) ) ) ) ( ( that ) ( was ) ( eaten ) ) ) ) )
Emma dusted the cookie beside the cakes that was eaten .	What is the theme of eaten ?	the cookie beside the cakes	cogs_qa	( ( ( Emma ) ) ( ( dusted ) ( ( ( ( the ) ( cookie ) ) ( ( beside ) ( ( the ) ( cakes ) ) ) ) ( ( that ) ( was ) ( eaten ) ) ) ) )
The bear helped a cookie beside cats that was drawn .	What is the theme of drawn ?	a cookie beside cats	cogs_qa	( ( ( The ) ( bear ) ) ( ( helped ) ( ( ( ( a ) ( cookie ) ) ( ( beside ) ( ( cats ) ) ) ) ( ( that ) ( was ) ( drawn ) ) ) ) )
