Emma grew the jacket beside the mice that was eaten .	What is the theme of eaten ?	the jacket beside the mice	cogs_qa	( ( ( Emma ) ) ( ( grew ) ( ( ( ( the ) ( jacket ) ) ( ( beside ) ( ( the ) ( mice ) ) ) ) ( ( that ) ( was ) ( eaten ) ) ) ) )
The guest liked a melon beside the glues that was dusted .	What is the theme of dusted ?	a melon beside the glues	cogs_qa	( ( ( The ) ( guest ) ) ( ( liked ) ( ( ( ( a ) ( melon ) ) ( ( beside ) ( ( the ) ( glues ) ) ) ) ( ( that ) ( was ) ( dusted ) ) ) ) )
Emma rolled a horse beside the cakes that was cooked .	What is the theme of cooked ?	a horse beside the cakes	cogs_qa	( ( ( Emma ) ) ( ( rolled ) ( ( ( ( a ) ( horse ) ) ( ( beside ) ( ( the ) ( cakes ) ) ) ) ( ( that ) ( was ) ( cooked ) ) ) ) )
The girl poked the raisin beside babies that was eaten .	What is the theme of eaten ?	the raisin beside babies	cogs_qa	( ( ( The ) ( girl ) ) ( ( poked ) ( ( ( ( the ) ( raisin ) ) ( ( beside ) ( ( babies ) ) ) ) ( ( that ) ( was ) ( eaten ) ) ) ) )
Emma decomposed the monkey beside books that was juggled .	What is the theme of juggled ?	the monkey beside books	cogs_qa	( ( ( Emma ) ) ( ( decomposed ) ( ( ( ( the ) ( monkey ) ) ( ( beside ) ( ( books ) ) ) ) ( ( that ) ( was ) ( juggled ) ) ) ) )
A cat froze the rose beside cakes that was juggled .	What is the theme of juggled ?	the rose beside cakes	cogs_qa	( ( ( A ) ( cat ) ) ( ( froze ) ( ( ( ( the ) ( rose ) ) ( ( beside ) ( ( cakes ) ) ) ) ( ( that ) ( was ) ( juggled ) ) ) ) )
A girl helped a cake beside cows that was studied .	What is the theme of studied ?	a cake beside cows	cogs_qa	( ( ( A ) ( girl ) ) ( ( helped ) ( ( ( ( a ) ( cake ) ) ( ( beside ) ( ( cows ) ) ) ) ( ( that ) ( was ) ( studied ) ) ) ) )
Emma painted a boy beside the roses that was eaten .	What is the theme of eaten ?	a boy beside the roses	cogs_qa	( ( ( Emma ) ) ( ( painted ) ( ( ( ( a ) ( boy ) ) ( ( beside ) ( ( the ) ( roses ) ) ) ) ( ( that ) ( was ) ( eaten ) ) ) ) )
Benjamin burned a horse beside the melons that was eaten .	What is the theme of eaten ?	a horse beside the melons	cogs_qa	( ( ( Benjamin ) ) ( ( burned ) ( ( ( ( a ) ( horse ) ) ( ( beside ) ( ( the ) ( melons ) ) ) ) ( ( that ) ( was ) ( eaten ) ) ) ) )
A turtle ate the cake beside the chalks that was heard .	What is the theme of heard ?	the cake beside the chalks	cogs_qa	( ( ( A ) ( turtle ) ) ( ( ate ) ( ( ( ( the ) ( cake ) ) ( ( beside ) ( ( the ) ( chalks ) ) ) ) ( ( that ) ( was ) ( heard ) ) ) ) )
Harper split a pony beside boys that was painted .	What is the theme of painted ?	a pony beside boys	cogs_qa	( ( ( Harper ) ) ( ( split ) ( ( ( ( a ) ( pony ) ) ( ( beside ) ( ( boys ) ) ) ) ( ( that ) ( was ) ( painted ) ) ) ) )
A teacher rolled a doll beside the prisoners that was cleaned .	What is the theme of cleaned ?	a doll beside the prisoners	cogs_qa	( ( ( A ) ( teacher ) ) ( ( rolled ) ( ( ( ( a ) ( doll ) ) ( ( beside ) ( ( the ) ( prisoners ) ) ) ) ( ( that ) ( was ) ( cleaned ) ) ) ) )
A professor respected a giraffe beside cookies that was juggled .	What is the theme of juggled ?	a giraffe beside cookies	cogs_qa	( ( ( A ) ( professor ) ) ( ( respected ) ( ( ( ( a ) ( giraffe ) ) ( ( beside ) ( ( cookies ) ) ) ) ( ( that ) ( was ) ( juggled ) ) ) ) )
A cat rolled the donut beside monsters that was investigated .	What is the theme of investigated ?	the donut beside monsters	cogs_qa	( ( ( A ) ( cat ) ) ( ( rolled ) ( ( ( ( the ) ( donut ) ) ( ( beside ) ( ( monsters ) ) ) ) ( ( that ) ( was ) ( investigated ) ) ) ) )
Matthew liked a girl beside the boys that was painted .	What is the theme of painted ?	a girl beside the boys	cogs_qa	( ( ( Matthew ) ) ( ( liked ) ( ( ( ( a ) ( girl ) ) ( ( beside ) ( ( the ) ( boys ) ) ) ) ( ( that ) ( was ) ( painted ) ) ) ) )
A baby worshipped a girl beside passengers that was eaten .	What is the theme of eaten ?	a girl beside passengers	cogs_qa	( ( ( A ) ( baby ) ) ( ( worshipped ) ( ( ( ( a ) ( girl ) ) ( ( beside ) ( ( passengers ) ) ) ) ( ( that ) ( was ) ( eaten ) ) ) ) )
The human held a resident beside the bats that was cooked .	What is the theme of cooked ?	a resident beside the bats	cogs_qa	( ( ( The ) ( human ) ) ( ( held ) ( ( ( ( a ) ( resident ) ) ( ( beside ) ( ( the ) ( bats ) ) ) ) ( ( that ) ( was ) ( cooked ) ) ) ) )
The chief cleaned a boy beside the girls that was called .	What is the theme of called ?	a boy beside the girls	cogs_qa	( ( ( The ) ( chief ) ) ( ( cleaned ) ( ( ( ( a ) ( boy ) ) ( ( beside ) ( ( the ) ( girls ) ) ) ) ( ( that ) ( was ) ( called ) ) ) ) )
The girl ate the turtle beside the cakes that was noticed .	What is the theme of noticed ?	the turtle beside the cakes	cogs_qa	( ( ( The ) ( girl ) ) ( ( ate ) ( ( ( ( the ) ( turtle ) ) ( ( beside ) ( ( the ) ( cakes ) ) ) ) ( ( that ) ( was ) ( noticed ) ) ) ) )
Liam liked the sandwich beside cookies that was drawn .	What is the theme of drawn ?	the sandwich beside cookies	cogs_qa	( ( ( Liam ) ) ( ( liked ) ( ( ( ( the ) ( sandwich ) ) ( ( beside ) ( ( cookies ) ) ) ) ( ( that ) ( was ) ( drawn ) ) ) ) )
A cat drew a cake beside the boxes that was eaten .	What is the theme of eaten ?	a cake beside the boxes	cogs_qa	( ( ( A ) ( cat ) ) ( ( drew ) ( ( ( ( a ) ( cake ) ) ( ( beside ) ( ( the ) ( boxes ) ) ) ) ( ( that ) ( was ) ( eaten ) ) ) ) )
David saw a sheep beside butterflies that was eaten .	What is the theme of eaten ?	a sheep beside butterflies	cogs_qa	( ( ( David ) ) ( ( saw ) ( ( ( ( a ) ( sheep ) ) ( ( beside ) ( ( butterflies ) ) ) ) ( ( that ) ( was ) ( eaten ) ) ) ) )
Emma painted the melon beside the boys that was eaten .	What is the theme of eaten ?	the melon beside the boys	cogs_qa	( ( ( Emma ) ) ( ( painted ) ( ( ( ( the ) ( melon ) ) ( ( beside ) ( ( the ) ( boys ) ) ) ) ( ( that ) ( was ) ( eaten ) ) ) ) )
A donkey rolled the boy beside cakes that was eaten .	What is the theme of eaten ?	the boy beside cakes	cogs_qa	( ( ( A ) ( donkey ) ) ( ( rolled ) ( ( ( ( the ) ( boy ) ) ( ( beside ) ( ( cakes ) ) ) ) ( ( that ) ( was ) ( eaten ) ) ) ) )
The girl crumpled a cake beside cookies that was eaten .	What is the theme of eaten ?	a cake beside cookies	cogs_qa	( ( ( The ) ( girl ) ) ( ( crumpled ) ( ( ( ( a ) ( cake ) ) ( ( beside ) ( ( cookies ) ) ) ) ( ( that ) ( was ) ( eaten ) ) ) ) )
The teacher admired a cake beside children that was painted .	What is the theme of painted ?	a cake beside children	cogs_qa	( ( ( The ) ( teacher ) ) ( ( admired ) ( ( ( ( a ) ( cake ) ) ( ( beside ) ( ( children ) ) ) ) ( ( that ) ( was ) ( painted ) ) ) ) )
Wyatt slid a mouse beside books that was heard .	What is the theme of heard ?	a mouse beside books	cogs_qa	( ( ( Wyatt ) ) ( ( slid ) ( ( ( ( a ) ( mouse ) ) ( ( beside ) ( ( books ) ) ) ) ( ( that ) ( was ) ( heard ) ) ) ) )
A priest burned the box beside the boys that was dusted .	What is the theme of dusted ?	the box beside the boys	cogs_qa	( ( ( A ) ( priest ) ) ( ( burned ) ( ( ( ( the ) ( box ) ) ( ( beside ) ( ( the ) ( boys ) ) ) ) ( ( that ) ( was ) ( dusted ) ) ) ) )
A scientist cooked a bat beside the boys that was eaten .	What is the theme of eaten ?	a bat beside the boys	cogs_qa	( ( ( A ) ( scientist ) ) ( ( cooked ) ( ( ( ( a ) ( bat ) ) ( ( beside ) ( ( the ) ( boys ) ) ) ) ( ( that ) ( was ) ( eaten ) ) ) ) )
Emma burned the strawberry beside the hamburgers that was sketched .	What is the theme of sketched ?	the strawberry beside the hamburgers	cogs_qa	( ( ( Emma ) ) ( ( burned ) ( ( ( ( the ) ( strawberry ) ) ( ( beside ) ( ( the ) ( hamburgers ) ) ) ) ( ( that ) ( was ) ( sketched ) ) ) ) )
The girl held the dog beside baskets that was hunted .	What is the theme of hunted ?	the dog beside baskets	cogs_qa	( ( ( The ) ( girl ) ) ( ( held ) ( ( ( ( the ) ( dog ) ) ( ( beside ) ( ( baskets ) ) ) ) ( ( that ) ( was ) ( hunted ) ) ) ) )
Riley helped a cake beside girls that was noticed .	What is the theme of noticed ?	a cake beside girls	cogs_qa	( ( ( Riley ) ) ( ( helped ) ( ( ( ( a ) ( cake ) ) ( ( beside ) ( ( girls ) ) ) ) ( ( that ) ( was ) ( noticed ) ) ) ) )
Gabriel discovered a biscuit beside muffins that was examined .	What is the theme of examined ?	a biscuit beside muffins	cogs_qa	( ( ( Gabriel ) ) ( ( discovered ) ( ( ( ( a ) ( biscuit ) ) ( ( beside ) ( ( muffins ) ) ) ) ( ( that ) ( was ) ( examined ) ) ) ) )
Liam burned the cake beside the boxes that was packed .	What is the theme of packed ?	the cake beside the boxes	cogs_qa	( ( ( Liam ) ) ( ( burned ) ( ( ( ( the ) ( cake ) ) ( ( beside ) ( ( the ) ( boxes ) ) ) ) ( ( that ) ( was ) ( packed ) ) ) ) )
A girl rolled a bucket beside raisins that was called .	What is the theme of called ?	a bucket beside raisins	cogs_qa	( ( ( A ) ( girl ) ) ( ( rolled ) ( ( ( ( a ) ( bucket ) ) ( ( beside ) ( ( raisins ) ) ) ) ( ( that ) ( was ) ( called ) ) ) ) )
The boy rolled the raisin beside girls that was hunted .	What is the theme of hunted ?	the raisin beside girls	cogs_qa	( ( ( The ) ( boy ) ) ( ( rolled ) ( ( ( ( the ) ( raisin ) ) ( ( beside ) ( ( girls ) ) ) ) ( ( that ) ( was ) ( hunted ) ) ) ) )
Elizabeth rolled a boy beside girls that was known .	What is the theme of known ?	a boy beside girls	cogs_qa	( ( ( Elizabeth ) ) ( ( rolled ) ( ( ( ( a ) ( boy ) ) ( ( beside ) ( ( girls ) ) ) ) ( ( that ) ( was ) ( known ) ) ) ) )
A kid helped the tiger beside the chiefs that was eaten .	What is the theme of eaten ?	the tiger beside the chiefs	cogs_qa	( ( ( A ) ( kid ) ) ( ( helped ) ( ( ( ( the ) ( tiger ) ) ( ( beside ) ( ( the ) ( chiefs ) ) ) ) ( ( that ) ( was ) ( eaten ) ) ) ) )
The guard floated the coin beside the cakes that was eaten .	What is the theme of eaten ?	the coin beside the cakes	cogs_qa	( ( ( The ) ( guard ) ) ( ( floated ) ( ( ( ( the ) ( coin ) ) ( ( beside ) ( ( the ) ( cakes ) ) ) ) ( ( that ) ( was ) ( eaten ) ) ) ) )
Daniel cleaned a chicken beside the buyers that was hunted .	What is the theme of hunted ?	a chicken beside the buyers	cogs_qa	( ( ( Daniel ) ) ( ( cleaned ) ( ( ( ( a ) ( chicken ) ) ( ( beside ) ( ( the ) ( buyers ) ) ) ) ( ( that ) ( was ) ( hunted ) ) ) ) )
Emma observed a frog beside customers that was drawn .	What is the theme of drawn ?	a frog beside customers	cogs_qa	( ( ( Emma ) ) ( ( observed ) ( ( ( ( a ) ( frog ) ) ( ( beside ) ( ( customers ) ) ) ) ( ( that ) ( was ) ( drawn ) ) ) ) )
Liam sketched the princess beside cakes that was cleaned .	What is the theme of cleaned ?	the princess beside cakes	cogs_qa	( ( ( Liam ) ) ( ( sketched ) ( ( ( ( the ) ( princess ) ) ( ( beside ) ( ( cakes ) ) ) ) ( ( that ) ( was ) ( cleaned ) ) ) ) )
Liam froze the game beside boxes that was observed .	What is the theme of observed ?	the game beside boxes	cogs_qa	( ( ( Liam ) ) ( ( froze ) ( ( ( ( the ) ( game ) ) ( ( beside ) ( ( boxes ) ) ) ) ( ( that ) ( was ) ( observed ) ) ) ) )
Emma burned the banana beside girls that was eaten .	What is the theme of eaten ?	the banana beside girls	cogs_qa	( ( ( Emma ) ) ( ( burned ) ( ( ( ( the ) ( banana ) ) ( ( beside ) ( ( girls ) ) ) ) ( ( that ) ( was ) ( eaten ) ) ) ) )
Logan helped a boy beside drinks that was painted .	What is the theme of painted ?	a boy beside drinks	cogs_qa	( ( ( Logan ) ) ( ( helped ) ( ( ( ( a ) ( boy ) ) ( ( beside ) ( ( drinks ) ) ) ) ( ( that ) ( was ) ( painted ) ) ) ) )
The crocodile helped the boy beside the cakes that was eaten .	What is the theme of eaten ?	the boy beside the cakes	cogs_qa	( ( ( The ) ( crocodile ) ) ( ( helped ) ( ( ( ( the ) ( boy ) ) ( ( beside ) ( ( the ) ( cakes ) ) ) ) ( ( that ) ( was ) ( eaten ) ) ) ) )
Claire tossed a boy beside the creatures that was drawn .	What is the theme of drawn ?	a boy beside the creatures	cogs_qa	( ( ( Claire ) ) ( ( tossed ) ( ( ( ( a ) ( boy ) ) ( ( beside ) ( ( the ) ( creatures ) ) ) ) ( ( that ) ( was ) ( drawn ) ) ) ) )
Emma rolled a girl beside the sheep? that was drawn .	What is the theme of drawn ?	a girl beside the sheep?	cogs_qa	( ( ( Emma ) ) ( ( rolled ) ( ( ( ( a ) ( girl ) ) ( ( beside ) ( ( the ) ( sheep? ) ) ) ) ( ( that ) ( was ) ( drawn ) ) ) ) )
Oliver juggled a cat beside cakes that was heard .	What is the theme of heard ?	a cat beside cakes	cogs_qa	( ( ( Oliver ) ) ( ( juggled ) ( ( ( ( a ) ( cat ) ) ( ( beside ) ( ( cakes ) ) ) ) ( ( that ) ( was ) ( heard ) ) ) ) )
The pupil liked the cake beside bats that was eaten .	What is the theme of eaten ?	the cake beside bats	cogs_qa	( ( ( The ) ( pupil ) ) ( ( liked ) ( ( ( ( the ) ( cake ) ) ( ( beside ) ( ( bats ) ) ) ) ( ( that ) ( was ) ( eaten ) ) ) ) )
A cat drew a donut beside flies that was sketched .	What is the theme of sketched ?	a donut beside flies	cogs_qa	( ( ( A ) ( cat ) ) ( ( drew ) ( ( ( ( a ) ( donut ) ) ( ( beside ) ( ( flies ) ) ) ) ( ( that ) ( was ) ( sketched ) ) ) ) )
A child reddened the sandwich beside cows that was eaten .	What is the theme of eaten ?	the sandwich beside cows	cogs_qa	( ( ( A ) ( child ) ) ( ( reddened ) ( ( ( ( the ) ( sandwich ) ) ( ( beside ) ( ( cows ) ) ) ) ( ( that ) ( was ) ( eaten ) ) ) ) )
Noah helped a donut beside crowns that was eaten .	What is the theme of eaten ?	a donut beside crowns	cogs_qa	( ( ( Noah ) ) ( ( helped ) ( ( ( ( a ) ( donut ) ) ( ( beside ) ( ( crowns ) ) ) ) ( ( that ) ( was ) ( eaten ) ) ) ) )
Camila grew a chalk beside girls that was eaten .	What is the theme of eaten ?	a chalk beside girls	cogs_qa	( ( ( Camila ) ) ( ( grew ) ( ( ( ( a ) ( chalk ) ) ( ( beside ) ( ( girls ) ) ) ) ( ( that ) ( was ) ( eaten ) ) ) ) )
The kitty rolled the bottle beside boys that was hunted .	What is the theme of hunted ?	the bottle beside boys	cogs_qa	( ( ( The ) ( kitty ) ) ( ( rolled ) ( ( ( ( the ) ( bottle ) ) ( ( beside ) ( ( boys ) ) ) ) ( ( that ) ( was ) ( hunted ) ) ) ) )
Liam floated a hamburger beside the children that was heard .	What is the theme of heard ?	a hamburger beside the children	cogs_qa	( ( ( Liam ) ) ( ( floated ) ( ( ( ( a ) ( hamburger ) ) ( ( beside ) ( ( the ) ( children ) ) ) ) ( ( that ) ( was ) ( heard ) ) ) ) )
Liam missed a cake beside donuts that was eaten .	What is the theme of eaten ?	a cake beside donuts	cogs_qa	( ( ( Liam ) ) ( ( missed ) ( ( ( ( a ) ( cake ) ) ( ( beside ) ( ( donuts ) ) ) ) ( ( that ) ( was ) ( eaten ) ) ) ) )
A lion poked the girl beside spoons that was nursed .	What is the theme of nursed ?	the girl beside spoons	cogs_qa	( ( ( A ) ( lion ) ) ( ( poked ) ( ( ( ( the ) ( girl ) ) ( ( beside ) ( ( spoons ) ) ) ) ( ( that ) ( was ) ( nursed ) ) ) ) )
A bear helped the cake beside the cookies that was painted .	What is the theme of painted ?	the cake beside the cookies	cogs_qa	( ( ( A ) ( bear ) ) ( ( helped ) ( ( ( ( the ) ( cake ) ) ( ( beside ) ( ( the ) ( cookies ) ) ) ) ( ( that ) ( was ) ( painted ) ) ) ) )
Jack rolled the dog beside the raisins that was painted .	What is the theme of painted ?	the dog beside the raisins	cogs_qa	( ( ( Jack ) ) ( ( rolled ) ( ( ( ( the ) ( dog ) ) ( ( beside ) ( ( the ) ( raisins ) ) ) ) ( ( that ) ( was ) ( painted ) ) ) ) )
Emma hunted a duck beside the cakes that was drawn .	What is the theme of drawn ?	a duck beside the cakes	cogs_qa	( ( ( Emma ) ) ( ( hunted ) ( ( ( ( a ) ( duck ) ) ( ( beside ) ( ( the ) ( cakes ) ) ) ) ( ( that ) ( was ) ( drawn ) ) ) ) )
Noah sketched the hammer beside the donuts that was painted .	What is the theme of painted ?	the hammer beside the donuts	cogs_qa	( ( ( Noah ) ) ( ( sketched ) ( ( ( ( the ) ( hammer ) ) ( ( beside ) ( ( the ) ( donuts ) ) ) ) ( ( that ) ( was ) ( painted ) ) ) ) )
The girl rolled the monster beside the donuts that was cleaned .	What is the theme of cleaned ?	the monster beside the donuts	cogs_qa	( ( ( The ) ( girl ) ) ( ( rolled ) ( ( ( ( the ) ( monster ) ) ( ( beside ) ( ( the ) ( donuts ) ) ) ) ( ( that ) ( was ) ( cleaned ) ) ) ) )
A child helped the guest beside the boys that was nursed .	What is the theme of nursed ?	the guest beside the boys	cogs_qa	( ( ( A ) ( child ) ) ( ( helped ) ( ( ( ( the ) ( guest ) ) ( ( beside ) ( ( the ) ( boys ) ) ) ) ( ( that ) ( was ) ( nursed ) ) ) ) )
William changed the queen beside cakes that was drawn .	What is the theme of drawn ?	the queen beside cakes	cogs_qa	( ( ( William ) ) ( ( changed ) ( ( ( ( the ) ( queen ) ) ( ( beside ) ( ( cakes ) ) ) ) ( ( that ) ( was ) ( drawn ) ) ) ) )
A dog investigated a baby beside the girls that was eaten .	What is the theme of eaten ?	a baby beside the girls	cogs_qa	( ( ( A ) ( dog ) ) ( ( investigated ) ( ( ( ( a ) ( baby ) ) ( ( beside ) ( ( the ) ( girls ) ) ) ) ( ( that ) ( was ) ( eaten ) ) ) ) )
Jayden dusted the boy beside servants that was eaten .	What is the theme of eaten ?	the boy beside servants	cogs_qa	( ( ( Jayden ) ) ( ( dusted ) ( ( ( ( the ) ( boy ) ) ( ( beside ) ( ( servants ) ) ) ) ( ( that ) ( was ) ( eaten ) ) ) ) )
Emma froze a girl beside the frogs that was painted .	What is the theme of painted ?	a girl beside the frogs	cogs_qa	( ( ( Emma ) ) ( ( froze ) ( ( ( ( a ) ( girl ) ) ( ( beside ) ( ( the ) ( frogs ) ) ) ) ( ( that ) ( was ) ( painted ) ) ) ) )
Mateo helped a raisin beside the tigers that was called .	What is the theme of called ?	a raisin beside the tigers	cogs_qa	( ( ( Mateo ) ) ( ( helped ) ( ( ( ( a ) ( raisin ) ) ( ( beside ) ( ( the ) ( tigers ) ) ) ) ( ( that ) ( was ) ( called ) ) ) ) )
A customer examined the rose beside strawberries that was painted .	What is the theme of painted ?	the rose beside strawberries	cogs_qa	( ( ( A ) ( customer ) ) ( ( examined ) ( ( ( ( the ) ( rose ) ) ( ( beside ) ( ( strawberries ) ) ) ) ( ( that ) ( was ) ( painted ) ) ) ) )
Emily called a girl beside watches that was eaten .	What is the theme of eaten ?	a girl beside watches	cogs_qa	( ( ( Emily ) ) ( ( called ) ( ( ( ( a ) ( girl ) ) ( ( beside ) ( ( watches ) ) ) ) ( ( that ) ( was ) ( eaten ) ) ) ) )
Isabella rolled a ball beside the dogs that was seen .	What is the theme of seen ?	a ball beside the dogs	cogs_qa	( ( ( Isabella ) ) ( ( rolled ) ( ( ( ( a ) ( ball ) ) ( ( beside ) ( ( the ) ( dogs ) ) ) ) ( ( that ) ( was ) ( seen ) ) ) ) )
Liam stabbed the cake beside radios that was painted .	What is the theme of painted ?	the cake beside radios	cogs_qa	( ( ( Liam ) ) ( ( stabbed ) ( ( ( ( the ) ( cake ) ) ( ( beside ) ( ( radios ) ) ) ) ( ( that ) ( was ) ( painted ) ) ) ) )
Isabella painted the donut beside the boxes that was eaten .	What is the theme of eaten ?	the donut beside the boxes	cogs_qa	( ( ( Isabella ) ) ( ( painted ) ( ( ( ( the ) ( donut ) ) ( ( beside ) ( ( the ) ( boxes ) ) ) ) ( ( that ) ( was ) ( eaten ) ) ) ) )
James rolled a girl beside cats that was painted .	What is the theme of painted ?	a girl beside cats	cogs_qa	( ( ( James ) ) ( ( rolled ) ( ( ( ( a ) ( girl ) ) ( ( beside ) ( ( cats ) ) ) ) ( ( that ) ( was ) ( painted ) ) ) ) )
A baby floated a girl beside lions that was drawn .	What is the theme of drawn ?	a girl beside lions	cogs_qa	( ( ( A ) ( baby ) ) ( ( floated ) ( ( ( ( a ) ( girl ) ) ( ( beside ) ( ( lions ) ) ) ) ( ( that ) ( was ) ( drawn ) ) ) ) )
Olivia painted a rose beside the boys that was eaten .	What is the theme of eaten ?	a rose beside the boys	cogs_qa	( ( ( Olivia ) ) ( ( painted ) ( ( ( ( a ) ( rose ) ) ( ( beside ) ( ( the ) ( boys ) ) ) ) ( ( that ) ( was ) ( eaten ) ) ) ) )
William ate the girl beside books that was seen .	What is the theme of seen ?	the girl beside books	cogs_qa	( ( ( William ) ) ( ( ate ) ( ( ( ( the ) ( girl ) ) ( ( beside ) ( ( books ) ) ) ) ( ( that ) ( was ) ( seen ) ) ) ) )
The cat burned the cake beside monkeys that was drawn .	What is the theme of drawn ?	the cake beside monkeys	cogs_qa	( ( ( The ) ( cat ) ) ( ( burned ) ( ( ( ( the ) ( cake ) ) ( ( beside ) ( ( monkeys ) ) ) ) ( ( that ) ( was ) ( drawn ) ) ) ) )
Olivia burned the cake beside scientists that was eaten .	What is the theme of eaten ?	the cake beside scientists	cogs_qa	( ( ( Olivia ) ) ( ( burned ) ( ( ( ( the ) ( cake ) ) ( ( beside ) ( ( scientists ) ) ) ) ( ( that ) ( was ) ( eaten ) ) ) ) )
A baby grew the liver beside cats that was dusted .	What is the theme of dusted ?	the liver beside cats	cogs_qa	( ( ( A ) ( baby ) ) ( ( grew ) ( ( ( ( the ) ( liver ) ) ( ( beside ) ( ( cats ) ) ) ) ( ( that ) ( was ) ( dusted ) ) ) ) )
Liam ate the boy beside the children that was packed .	What is the theme of packed ?	the boy beside the children	cogs_qa	( ( ( Liam ) ) ( ( ate ) ( ( ( ( the ) ( boy ) ) ( ( beside ) ( ( the ) ( children ) ) ) ) ( ( that ) ( was ) ( packed ) ) ) ) )
A girl investigated a turkey beside drinks that was eaten .	What is the theme of eaten ?	a turkey beside drinks	cogs_qa	( ( ( A ) ( girl ) ) ( ( investigated ) ( ( ( ( a ) ( turkey ) ) ( ( beside ) ( ( drinks ) ) ) ) ( ( that ) ( was ) ( eaten ) ) ) ) )
A girl respected a bunny beside the lions that was noticed .	What is the theme of noticed ?	a bunny beside the lions	cogs_qa	( ( ( A ) ( girl ) ) ( ( respected ) ( ( ( ( a ) ( bunny ) ) ( ( beside ) ( ( the ) ( lions ) ) ) ) ( ( that ) ( was ) ( noticed ) ) ) ) )
Mia slid a monster beside the teachers that was eaten .	What is the theme of eaten ?	a monster beside the teachers	cogs_qa	( ( ( Mia ) ) ( ( slid ) ( ( ( ( a ) ( monster ) ) ( ( beside ) ( ( the ) ( teachers ) ) ) ) ( ( that ) ( was ) ( eaten ) ) ) ) )
A baby grew the box beside the cats that was eaten .	What is the theme of eaten ?	the box beside the cats	cogs_qa	( ( ( A ) ( baby ) ) ( ( grew ) ( ( ( ( the ) ( box ) ) ( ( beside ) ( ( the ) ( cats ) ) ) ) ( ( that ) ( was ) ( eaten ) ) ) ) )
A lion painted a wolf beside roses that was eaten .	What is the theme of eaten ?	a wolf beside roses	cogs_qa	( ( ( A ) ( lion ) ) ( ( painted ) ( ( ( ( a ) ( wolf ) ) ( ( beside ) ( ( roses ) ) ) ) ( ( that ) ( was ) ( eaten ) ) ) ) )
Sophia ate a glue beside the cookies that was cooked .	What is the theme of cooked ?	a glue beside the cookies	cogs_qa	( ( ( Sophia ) ) ( ( ate ) ( ( ( ( a ) ( glue ) ) ( ( beside ) ( ( the ) ( cookies ) ) ) ) ( ( that ) ( was ) ( cooked ) ) ) ) )
The lion heard a drink beside boys that was eaten .	What is the theme of eaten ?	a drink beside boys	cogs_qa	( ( ( The ) ( lion ) ) ( ( heard ) ( ( ( ( a ) ( drink ) ) ( ( beside ) ( ( boys ) ) ) ) ( ( that ) ( was ) ( eaten ) ) ) ) )
The boy froze the guest beside cookies that was painted .	What is the theme of painted ?	the guest beside cookies	cogs_qa	( ( ( The ) ( boy ) ) ( ( froze ) ( ( ( ( the ) ( guest ) ) ( ( beside ) ( ( cookies ) ) ) ) ( ( that ) ( was ) ( painted ) ) ) ) )
Emma burned the girl beside cakes that was eaten .	What is the theme of eaten ?	the girl beside cakes	cogs_qa	( ( ( Emma ) ) ( ( burned ) ( ( ( ( the ) ( girl ) ) ( ( beside ) ( ( cakes ) ) ) ) ( ( that ) ( was ) ( eaten ) ) ) ) )
Emma tossed a donkey beside the cakes that was known .	What is the theme of known ?	a donkey beside the cakes	cogs_qa	( ( ( Emma ) ) ( ( tossed ) ( ( ( ( a ) ( donkey ) ) ( ( beside ) ( ( the ) ( cakes ) ) ) ) ( ( that ) ( was ) ( known ) ) ) ) )
The girl cleaned a rose beside cookies that was eaten .	What is the theme of eaten ?	a rose beside cookies	cogs_qa	( ( ( The ) ( girl ) ) ( ( cleaned ) ( ( ( ( a ) ( rose ) ) ( ( beside ) ( ( cookies ) ) ) ) ( ( that ) ( was ) ( eaten ) ) ) ) )
Emma rolled a girl beside the pencils that was eaten .	What is the theme of eaten ?	a girl beside the pencils	cogs_qa	( ( ( Emma ) ) ( ( rolled ) ( ( ( ( a ) ( girl ) ) ( ( beside ) ( ( the ) ( pencils ) ) ) ) ( ( that ) ( was ) ( eaten ) ) ) ) )
Emma ate a mouse beside the boys that was drawn .	What is the theme of drawn ?	a mouse beside the boys	cogs_qa	( ( ( Emma ) ) ( ( ate ) ( ( ( ( a ) ( mouse ) ) ( ( beside ) ( ( the ) ( boys ) ) ) ) ( ( that ) ( was ) ( drawn ) ) ) ) )
Liam adored a cake beside the girls that was seen .	What is the theme of seen ?	a cake beside the girls	cogs_qa	( ( ( Liam ) ) ( ( adored ) ( ( ( ( a ) ( cake ) ) ( ( beside ) ( ( the ) ( girls ) ) ) ) ( ( that ) ( was ) ( seen ) ) ) ) )
Ava ate a cake beside the jackets that was dusted .	What is the theme of dusted ?	a cake beside the jackets	cogs_qa	( ( ( Ava ) ) ( ( ate ) ( ( ( ( a ) ( cake ) ) ( ( beside ) ( ( the ) ( jackets ) ) ) ) ( ( that ) ( was ) ( dusted ) ) ) ) )
Liam liked the donut beside cakes that was painted .	What is the theme of painted ?	the donut beside cakes	cogs_qa	( ( ( Liam ) ) ( ( liked ) ( ( ( ( the ) ( donut ) ) ( ( beside ) ( ( cakes ) ) ) ) ( ( that ) ( was ) ( painted ) ) ) ) )
Liam ate a girl beside cakes that was nursed .	What is the theme of nursed ?	a girl beside cakes	cogs_qa	( ( ( Liam ) ) ( ( ate ) ( ( ( ( a ) ( girl ) ) ( ( beside ) ( ( cakes ) ) ) ) ( ( that ) ( was ) ( nursed ) ) ) ) )
The dog rolled the governor beside the melons that was seen .	What is the theme of seen ?	the governor beside the melons	cogs_qa	( ( ( The ) ( dog ) ) ( ( rolled ) ( ( ( ( the ) ( governor ) ) ( ( beside ) ( ( the ) ( melons ) ) ) ) ( ( that ) ( was ) ( seen ) ) ) ) )
A cat juggled the mouse beside the sandwiches that was dusted .	What is the theme of dusted ?	the mouse beside the sandwiches	cogs_qa	( ( ( A ) ( cat ) ) ( ( juggled ) ( ( ( ( the ) ( mouse ) ) ( ( beside ) ( ( the ) ( sandwiches ) ) ) ) ( ( that ) ( was ) ( dusted ) ) ) ) )
A judge helped the cookie beside leaves that was eaten .	What is the theme of eaten ?	the cookie beside leaves	cogs_qa	( ( ( A ) ( judge ) ) ( ( helped ) ( ( ( ( the ) ( cookie ) ) ( ( beside ) ( ( leaves ) ) ) ) ( ( that ) ( was ) ( eaten ) ) ) ) )
The dog ate the cookie beside the monkeys that was called .	What is the theme of called ?	the cookie beside the monkeys	cogs_qa	( ( ( The ) ( dog ) ) ( ( ate ) ( ( ( ( the ) ( cookie ) ) ( ( beside ) ( ( the ) ( monkeys ) ) ) ) ( ( that ) ( was ) ( called ) ) ) ) )
A girl rolled a cookie beside the donuts that was nursed .	What is the theme of nursed ?	a cookie beside the donuts	cogs_qa	( ( ( A ) ( girl ) ) ( ( rolled ) ( ( ( ( a ) ( cookie ) ) ( ( beside ) ( ( the ) ( donuts ) ) ) ) ( ( that ) ( was ) ( nursed ) ) ) ) )
