James drew a drink beside the customers that was eaten .	What is the theme of eaten ?	a drink beside the customers	cogs_qa	( ( ( James ) ) ( ( drew ) ( ( ( ( a ) ( drink ) ) ( ( beside ) ( ( the ) ( customers ) ) ) ) ( ( that ) ( was ) ( eaten ) ) ) ) )
A lion liked the girl beside the princesses that was eaten .	What is the theme of eaten ?	the girl beside the princesses	cogs_qa	( ( ( A ) ( lion ) ) ( ( liked ) ( ( ( ( the ) ( girl ) ) ( ( beside ) ( ( the ) ( princesses ) ) ) ) ( ( that ) ( was ) ( eaten ) ) ) ) )
Noah hunted a donut beside pigs that was cooked .	What is the theme of cooked ?	a donut beside pigs	cogs_qa	( ( ( Noah ) ) ( ( hunted ) ( ( ( ( a ) ( donut ) ) ( ( beside ) ( ( pigs ) ) ) ) ( ( that ) ( was ) ( cooked ) ) ) ) )
Liam painted the girl beside flies that was cooked .	What is the theme of cooked ?	the girl beside flies	cogs_qa	( ( ( Liam ) ) ( ( painted ) ( ( ( ( the ) ( girl ) ) ( ( beside ) ( ( flies ) ) ) ) ( ( that ) ( was ) ( cooked ) ) ) ) )
Emma heard a cake beside girls that was known .	What is the theme of known ?	a cake beside girls	cogs_qa	( ( ( Emma ) ) ( ( heard ) ( ( ( ( a ) ( cake ) ) ( ( beside ) ( ( girls ) ) ) ) ( ( that ) ( was ) ( known ) ) ) ) )
Sophia froze a cat beside cakes that was painted .	What is the theme of painted ?	a cat beside cakes	cogs_qa	( ( ( Sophia ) ) ( ( froze ) ( ( ( ( a ) ( cat ) ) ( ( beside ) ( ( cakes ) ) ) ) ( ( that ) ( was ) ( painted ) ) ) ) )
Liam noticed the dog beside cakes that was called .	What is the theme of called ?	the dog beside cakes	cogs_qa	( ( ( Liam ) ) ( ( noticed ) ( ( ( ( the ) ( dog ) ) ( ( beside ) ( ( cakes ) ) ) ) ( ( that ) ( was ) ( called ) ) ) ) )
Zoey painted the girl beside the melons that was juggled .	What is the theme of juggled ?	the girl beside the melons	cogs_qa	( ( ( Zoey ) ) ( ( painted ) ( ( ( ( the ) ( girl ) ) ( ( beside ) ( ( the ) ( melons ) ) ) ) ( ( that ) ( was ) ( juggled ) ) ) ) )
Liam ate a yogurt beside the beers that was cooked .	What is the theme of cooked ?	a yogurt beside the beers	cogs_qa	( ( ( Liam ) ) ( ( ate ) ( ( ( ( a ) ( yogurt ) ) ( ( beside ) ( ( the ) ( beers ) ) ) ) ( ( that ) ( was ) ( cooked ) ) ) ) )
The frog liked a cat beside girls that was eaten .	What is the theme of eaten ?	a cat beside girls	cogs_qa	( ( ( The ) ( frog ) ) ( ( liked ) ( ( ( ( a ) ( cat ) ) ( ( beside ) ( ( girls ) ) ) ) ( ( that ) ( was ) ( eaten ) ) ) ) )
James liked a girl beside melons that was observed .	What is the theme of observed ?	a girl beside melons	cogs_qa	( ( ( James ) ) ( ( liked ) ( ( ( ( a ) ( girl ) ) ( ( beside ) ( ( melons ) ) ) ) ( ( that ) ( was ) ( observed ) ) ) ) )
Emma burned the girl beside the prisoners that was eaten .	What is the theme of eaten ?	the girl beside the prisoners	cogs_qa	( ( ( Emma ) ) ( ( burned ) ( ( ( ( the ) ( girl ) ) ( ( beside ) ( ( the ) ( prisoners ) ) ) ) ( ( that ) ( was ) ( eaten ) ) ) ) )
Liam examined a drink beside the cakes that was painted .	What is the theme of painted ?	a drink beside the cakes	cogs_qa	( ( ( Liam ) ) ( ( examined ) ( ( ( ( a ) ( drink ) ) ( ( beside ) ( ( the ) ( cakes ) ) ) ) ( ( that ) ( was ) ( painted ) ) ) ) )
Evelyn helped the chemical beside the students that was eaten .	What is the theme of eaten ?	the chemical beside the students	cogs_qa	( ( ( Evelyn ) ) ( ( helped ) ( ( ( ( the ) ( chemical ) ) ( ( beside ) ( ( the ) ( students ) ) ) ) ( ( that ) ( was ) ( eaten ) ) ) ) )
Benjamin ate a teacher beside the roses that was painted .	What is the theme of painted ?	a teacher beside the roses	cogs_qa	( ( ( Benjamin ) ) ( ( ate ) ( ( ( ( a ) ( teacher ) ) ( ( beside ) ( ( the ) ( roses ) ) ) ) ( ( that ) ( was ) ( painted ) ) ) ) )
Olivia observed a melon beside cakes that was eaten .	What is the theme of eaten ?	a melon beside cakes	cogs_qa	( ( ( Olivia ) ) ( ( observed ) ( ( ( ( a ) ( melon ) ) ( ( beside ) ( ( cakes ) ) ) ) ( ( that ) ( was ) ( eaten ) ) ) ) )
Liam painted the cake beside girls that was eaten .	What is the theme of eaten ?	the cake beside girls	cogs_qa	( ( ( Liam ) ) ( ( painted ) ( ( ( ( the ) ( cake ) ) ( ( beside ) ( ( girls ) ) ) ) ( ( that ) ( was ) ( eaten ) ) ) ) )
Jack discovered the princess beside the balloons that was packed .	What is the theme of packed ?	the princess beside the balloons	cogs_qa	( ( ( Jack ) ) ( ( discovered ) ( ( ( ( the ) ( princess ) ) ( ( beside ) ( ( the ) ( balloons ) ) ) ) ( ( that ) ( was ) ( packed ) ) ) ) )
A moose rolled a father beside the cats that was juggled .	What is the theme of juggled ?	a father beside the cats	cogs_qa	( ( ( A ) ( moose ) ) ( ( rolled ) ( ( ( ( a ) ( father ) ) ( ( beside ) ( ( the ) ( cats ) ) ) ) ( ( that ) ( was ) ( juggled ) ) ) ) )
The girl ate the cake beside frogs that was painted .	What is the theme of painted ?	the cake beside frogs	cogs_qa	( ( ( The ) ( girl ) ) ( ( ate ) ( ( ( ( the ) ( cake ) ) ( ( beside ) ( ( frogs ) ) ) ) ( ( that ) ( was ) ( painted ) ) ) ) )
Noah rolled the girl beside the cakes that was eaten .	What is the theme of eaten ?	the girl beside the cakes	cogs_qa	( ( ( Noah ) ) ( ( rolled ) ( ( ( ( the ) ( girl ) ) ( ( beside ) ( ( the ) ( cakes ) ) ) ) ( ( that ) ( was ) ( eaten ) ) ) ) )
Emma froze the cake beside the buttons that was cleaned .	What is the theme of cleaned ?	the cake beside the buttons	cogs_qa	( ( ( Emma ) ) ( ( froze ) ( ( ( ( the ) ( cake ) ) ( ( beside ) ( ( the ) ( buttons ) ) ) ) ( ( that ) ( was ) ( cleaned ) ) ) ) )
Emma decomposed a box beside the boys that was nursed .	What is the theme of nursed ?	a box beside the boys	cogs_qa	( ( ( Emma ) ) ( ( decomposed ) ( ( ( ( a ) ( box ) ) ( ( beside ) ( ( the ) ( boys ) ) ) ) ( ( that ) ( was ) ( nursed ) ) ) ) )
Alexander worshipped the cat beside girls that was painted .	What is the theme of painted ?	the cat beside girls	cogs_qa	( ( ( Alexander ) ) ( ( worshipped ) ( ( ( ( the ) ( cat ) ) ( ( beside ) ( ( girls ) ) ) ) ( ( that ) ( was ) ( painted ) ) ) ) )
Chloe helped a guard beside lawyers that was eaten .	What is the theme of eaten ?	a guard beside lawyers	cogs_qa	( ( ( Chloe ) ) ( ( helped ) ( ( ( ( a ) ( guard ) ) ( ( beside ) ( ( lawyers ) ) ) ) ( ( that ) ( was ) ( eaten ) ) ) ) )
A baby rolled a cake beside the donuts that was eaten .	What is the theme of eaten ?	a cake beside the donuts	cogs_qa	( ( ( A ) ( baby ) ) ( ( rolled ) ( ( ( ( a ) ( cake ) ) ( ( beside ) ( ( the ) ( donuts ) ) ) ) ( ( that ) ( was ) ( eaten ) ) ) ) )
Liam liked a pumpkin beside cats that was nursed .	What is the theme of nursed ?	a pumpkin beside cats	cogs_qa	( ( ( Liam ) ) ( ( liked ) ( ( ( ( a ) ( pumpkin ) ) ( ( beside ) ( ( cats ) ) ) ) ( ( that ) ( was ) ( nursed ) ) ) ) )
The cat doubled a box beside girls that was eaten .	What is the theme of eaten ?	a box beside girls	cogs_qa	( ( ( The ) ( cat ) ) ( ( doubled ) ( ( ( ( a ) ( box ) ) ( ( beside ) ( ( girls ) ) ) ) ( ( that ) ( was ) ( eaten ) ) ) ) )
Liam rolled a banana beside strawberries that was cleaned .	What is the theme of cleaned ?	a banana beside strawberries	cogs_qa	( ( ( Liam ) ) ( ( rolled ) ( ( ( ( a ) ( banana ) ) ( ( beside ) ( ( strawberries ) ) ) ) ( ( that ) ( was ) ( cleaned ) ) ) ) )
The monster nursed a boy beside the drinks that was eaten .	What is the theme of eaten ?	a boy beside the drinks	cogs_qa	( ( ( The ) ( monster ) ) ( ( nursed ) ( ( ( ( a ) ( boy ) ) ( ( beside ) ( ( the ) ( drinks ) ) ) ) ( ( that ) ( was ) ( eaten ) ) ) ) )
Emma ate a tourist beside princesses that was investigated .	What is the theme of investigated ?	a tourist beside princesses	cogs_qa	( ( ( Emma ) ) ( ( ate ) ( ( ( ( a ) ( tourist ) ) ( ( beside ) ( ( princesses ) ) ) ) ( ( that ) ( was ) ( investigated ) ) ) ) )
A host burned a servant beside cakes that was drawn .	What is the theme of drawn ?	a servant beside cakes	cogs_qa	( ( ( A ) ( host ) ) ( ( burned ) ( ( ( ( a ) ( servant ) ) ( ( beside ) ( ( cakes ) ) ) ) ( ( that ) ( was ) ( drawn ) ) ) ) )
The prisoner decomposed a drink beside the girls that was nursed .	What is the theme of nursed ?	a drink beside the girls	cogs_qa	( ( ( The ) ( prisoner ) ) ( ( decomposed ) ( ( ( ( a ) ( drink ) ) ( ( beside ) ( ( the ) ( girls ) ) ) ) ( ( that ) ( was ) ( nursed ) ) ) ) )
Emma liked the cat beside the birds that was studied .	What is the theme of studied ?	the cat beside the birds	cogs_qa	( ( ( Emma ) ) ( ( liked ) ( ( ( ( the ) ( cat ) ) ( ( beside ) ( ( the ) ( birds ) ) ) ) ( ( that ) ( was ) ( studied ) ) ) ) )
Evelyn ate the donut beside lollipops that was seen .	What is the theme of seen ?	the donut beside lollipops	cogs_qa	( ( ( Evelyn ) ) ( ( ate ) ( ( ( ( the ) ( donut ) ) ( ( beside ) ( ( lollipops ) ) ) ) ( ( that ) ( was ) ( seen ) ) ) ) )
Emma liked a donut beside figs that was drawn .	What is the theme of drawn ?	a donut beside figs	cogs_qa	( ( ( Emma ) ) ( ( liked ) ( ( ( ( a ) ( donut ) ) ( ( beside ) ( ( figs ) ) ) ) ( ( that ) ( was ) ( drawn ) ) ) ) )
Liam rolled a cake beside the boys that was known .	What is the theme of known ?	a cake beside the boys	cogs_qa	( ( ( Liam ) ) ( ( rolled ) ( ( ( ( a ) ( cake ) ) ( ( beside ) ( ( the ) ( boys ) ) ) ) ( ( that ) ( was ) ( known ) ) ) ) )
Olivia liked the dog beside the cats that was hunted .	What is the theme of hunted ?	the dog beside the cats	cogs_qa	( ( ( Olivia ) ) ( ( liked ) ( ( ( ( the ) ( dog ) ) ( ( beside ) ( ( the ) ( cats ) ) ) ) ( ( that ) ( was ) ( hunted ) ) ) ) )
A boy split a mouse beside girls that was eaten .	What is the theme of eaten ?	a mouse beside girls	cogs_qa	( ( ( A ) ( boy ) ) ( ( split ) ( ( ( ( a ) ( mouse ) ) ( ( beside ) ( ( girls ) ) ) ) ( ( that ) ( was ) ( eaten ) ) ) ) )
Harper dusted the clock beside the girls that was eaten .	What is the theme of eaten ?	the clock beside the girls	cogs_qa	( ( ( Harper ) ) ( ( dusted ) ( ( ( ( the ) ( clock ) ) ( ( beside ) ( ( the ) ( girls ) ) ) ) ( ( that ) ( was ) ( eaten ) ) ) ) )
Harper drew the box beside cakes that was eaten .	What is the theme of eaten ?	the box beside cakes	cogs_qa	( ( ( Harper ) ) ( ( drew ) ( ( ( ( the ) ( box ) ) ( ( beside ) ( ( cakes ) ) ) ) ( ( that ) ( was ) ( eaten ) ) ) ) )
Emma ate the donut beside the babies that was noticed .	What is the theme of noticed ?	the donut beside the babies	cogs_qa	( ( ( Emma ) ) ( ( ate ) ( ( ( ( the ) ( donut ) ) ( ( beside ) ( ( the ) ( babies ) ) ) ) ( ( that ) ( was ) ( noticed ) ) ) ) )
The chicken ate a child beside the boys that was cooked .	What is the theme of cooked ?	a child beside the boys	cogs_qa	( ( ( The ) ( chicken ) ) ( ( ate ) ( ( ( ( a ) ( child ) ) ( ( beside ) ( ( the ) ( boys ) ) ) ) ( ( that ) ( was ) ( cooked ) ) ) ) )
The duck rolled a host beside cakes that was eaten .	What is the theme of eaten ?	a host beside cakes	cogs_qa	( ( ( The ) ( duck ) ) ( ( rolled ) ( ( ( ( a ) ( host ) ) ( ( beside ) ( ( cakes ) ) ) ) ( ( that ) ( was ) ( eaten ) ) ) ) )
Noah liked the present beside shoes that was drawn .	What is the theme of drawn ?	the present beside shoes	cogs_qa	( ( ( Noah ) ) ( ( liked ) ( ( ( ( the ) ( present ) ) ( ( beside ) ( ( shoes ) ) ) ) ( ( that ) ( was ) ( drawn ) ) ) ) )
The girl rolled a cookie beside the cakes that was eaten .	What is the theme of eaten ?	a cookie beside the cakes	cogs_qa	( ( ( The ) ( girl ) ) ( ( rolled ) ( ( ( ( a ) ( cookie ) ) ( ( beside ) ( ( the ) ( cakes ) ) ) ) ( ( that ) ( was ) ( eaten ) ) ) ) )
A cat changed the donut beside the girls that was eaten .	What is the theme of eaten ?	the donut beside the girls	cogs_qa	( ( ( A ) ( cat ) ) ( ( changed ) ( ( ( ( the ) ( donut ) ) ( ( beside ) ( ( the ) ( girls ) ) ) ) ( ( that ) ( was ) ( eaten ) ) ) ) )
A bear pierced a prisoner beside books that was nursed .	What is the theme of nursed ?	a prisoner beside books	cogs_qa	( ( ( A ) ( bear ) ) ( ( pierced ) ( ( ( ( a ) ( prisoner ) ) ( ( beside ) ( ( books ) ) ) ) ( ( that ) ( was ) ( nursed ) ) ) ) )
A girl burned the donut beside cakes that was eaten .	What is the theme of eaten ?	the donut beside cakes	cogs_qa	( ( ( A ) ( girl ) ) ( ( burned ) ( ( ( ( the ) ( donut ) ) ( ( beside ) ( ( cakes ) ) ) ) ( ( that ) ( was ) ( eaten ) ) ) ) )
Emma admired a girl beside boys that was eaten .	What is the theme of eaten ?	a girl beside boys	cogs_qa	( ( ( Emma ) ) ( ( admired ) ( ( ( ( a ) ( girl ) ) ( ( beside ) ( ( boys ) ) ) ) ( ( that ) ( was ) ( eaten ) ) ) ) )
Emma liked the chicken beside the donuts that was cooked .	What is the theme of cooked ?	the chicken beside the donuts	cogs_qa	( ( ( Emma ) ) ( ( liked ) ( ( ( ( the ) ( chicken ) ) ( ( beside ) ( ( the ) ( donuts ) ) ) ) ( ( that ) ( was ) ( cooked ) ) ) ) )
Evelyn burned the balloon beside the girls that was cleaned .	What is the theme of cleaned ?	the balloon beside the girls	cogs_qa	( ( ( Evelyn ) ) ( ( burned ) ( ( ( ( the ) ( balloon ) ) ( ( beside ) ( ( the ) ( girls ) ) ) ) ( ( that ) ( was ) ( cleaned ) ) ) ) )
The dealer shortened a girl beside potatoes that was eaten .	What is the theme of eaten ?	a girl beside potatoes	cogs_qa	( ( ( The ) ( dealer ) ) ( ( shortened ) ( ( ( ( a ) ( girl ) ) ( ( beside ) ( ( potatoes ) ) ) ) ( ( that ) ( was ) ( eaten ) ) ) ) )
A girl painted a penguin beside teachers that was eaten .	What is the theme of eaten ?	a penguin beside teachers	cogs_qa	( ( ( A ) ( girl ) ) ( ( painted ) ( ( ( ( a ) ( penguin ) ) ( ( beside ) ( ( teachers ) ) ) ) ( ( that ) ( was ) ( eaten ) ) ) ) )
A baby hunted a donut beside the bunnies that was noticed .	What is the theme of noticed ?	a donut beside the bunnies	cogs_qa	( ( ( A ) ( baby ) ) ( ( hunted ) ( ( ( ( a ) ( donut ) ) ( ( beside ) ( ( the ) ( bunnies ) ) ) ) ( ( that ) ( was ) ( noticed ) ) ) ) )
Liam pierced a girl beside cakes that was eaten .	What is the theme of eaten ?	a girl beside cakes	cogs_qa	( ( ( Liam ) ) ( ( pierced ) ( ( ( ( a ) ( girl ) ) ( ( beside ) ( ( cakes ) ) ) ) ( ( that ) ( was ) ( eaten ) ) ) ) )
A girl poked a goose beside butterflies that was eaten .	What is the theme of eaten ?	a goose beside butterflies	cogs_qa	( ( ( A ) ( girl ) ) ( ( poked ) ( ( ( ( a ) ( goose ) ) ( ( beside ) ( ( butterflies ) ) ) ) ( ( that ) ( was ) ( eaten ) ) ) ) )
Emma helped a jigsaw beside the cakes that was painted .	What is the theme of painted ?	a jigsaw beside the cakes	cogs_qa	( ( ( Emma ) ) ( ( helped ) ( ( ( ( a ) ( jigsaw ) ) ( ( beside ) ( ( the ) ( cakes ) ) ) ) ( ( that ) ( was ) ( painted ) ) ) ) )
The boy liked the cat beside chemicals that was eaten .	What is the theme of eaten ?	the cat beside chemicals	cogs_qa	( ( ( The ) ( boy ) ) ( ( liked ) ( ( ( ( the ) ( cat ) ) ( ( beside ) ( ( chemicals ) ) ) ) ( ( that ) ( was ) ( eaten ) ) ) ) )
Olivia shortened a dog beside the cakes that was dusted .	What is the theme of dusted ?	a dog beside the cakes	cogs_qa	( ( ( Olivia ) ) ( ( shortened ) ( ( ( ( a ) ( dog ) ) ( ( beside ) ( ( the ) ( cakes ) ) ) ) ( ( that ) ( was ) ( dusted ) ) ) ) )
A dog doubled a box beside turtles that was eaten .	What is the theme of eaten ?	a box beside turtles	cogs_qa	( ( ( A ) ( dog ) ) ( ( doubled ) ( ( ( ( a ) ( box ) ) ( ( beside ) ( ( turtles ) ) ) ) ( ( that ) ( was ) ( eaten ) ) ) ) )
Isabella liked the lawyer beside boxes that was eaten .	What is the theme of eaten ?	the lawyer beside boxes	cogs_qa	( ( ( Isabella ) ) ( ( liked ) ( ( ( ( the ) ( lawyer ) ) ( ( beside ) ( ( boxes ) ) ) ) ( ( that ) ( was ) ( eaten ) ) ) ) )
Emma burned the sandwich beside dogs that was hunted .	What is the theme of hunted ?	the sandwich beside dogs	cogs_qa	( ( ( Emma ) ) ( ( burned ) ( ( ( ( the ) ( sandwich ) ) ( ( beside ) ( ( dogs ) ) ) ) ( ( that ) ( was ) ( hunted ) ) ) ) )
The girl burned a hammer beside cakes that was hunted .	What is the theme of hunted ?	a hammer beside cakes	cogs_qa	( ( ( The ) ( girl ) ) ( ( burned ) ( ( ( ( a ) ( hammer ) ) ( ( beside ) ( ( cakes ) ) ) ) ( ( that ) ( was ) ( hunted ) ) ) ) )
Mila crumpled the cat beside roses that was eaten .	What is the theme of eaten ?	the cat beside roses	cogs_qa	( ( ( Mila ) ) ( ( crumpled ) ( ( ( ( the ) ( cat ) ) ( ( beside ) ( ( roses ) ) ) ) ( ( that ) ( was ) ( eaten ) ) ) ) )
Emma dusted the drink beside cakes that was eaten .	What is the theme of eaten ?	the drink beside cakes	cogs_qa	( ( ( Emma ) ) ( ( dusted ) ( ( ( ( the ) ( drink ) ) ( ( beside ) ( ( cakes ) ) ) ) ( ( that ) ( was ) ( eaten ) ) ) ) )
A wolf painted the donut beside the teachers that was hunted .	What is the theme of hunted ?	the donut beside the teachers	cogs_qa	( ( ( A ) ( wolf ) ) ( ( painted ) ( ( ( ( the ) ( donut ) ) ( ( beside ) ( ( the ) ( teachers ) ) ) ) ( ( that ) ( was ) ( hunted ) ) ) ) )
Luna rolled the cake beside residents that was dusted .	What is the theme of dusted ?	the cake beside residents	cogs_qa	( ( ( Luna ) ) ( ( rolled ) ( ( ( ( the ) ( cake ) ) ( ( beside ) ( ( residents ) ) ) ) ( ( that ) ( was ) ( dusted ) ) ) ) )
Liam collapsed the cake beside the boxes that was examined .	What is the theme of examined ?	the cake beside the boxes	cogs_qa	( ( ( Liam ) ) ( ( collapsed ) ( ( ( ( the ) ( cake ) ) ( ( beside ) ( ( the ) ( boxes ) ) ) ) ( ( that ) ( was ) ( examined ) ) ) ) )
A girl liked the father beside the boxes that was sketched .	What is the theme of sketched ?	the father beside the boxes	cogs_qa	( ( ( A ) ( girl ) ) ( ( liked ) ( ( ( ( the ) ( father ) ) ( ( beside ) ( ( the ) ( boxes ) ) ) ) ( ( that ) ( was ) ( sketched ) ) ) ) )
Olivia noticed a present beside the donuts that was eaten .	What is the theme of eaten ?	a present beside the donuts	cogs_qa	( ( ( Olivia ) ) ( ( noticed ) ( ( ( ( a ) ( present ) ) ( ( beside ) ( ( the ) ( donuts ) ) ) ) ( ( that ) ( was ) ( eaten ) ) ) ) )
Isabella ate the cake beside the melons that was dusted .	What is the theme of dusted ?	the cake beside the melons	cogs_qa	( ( ( Isabella ) ) ( ( ate ) ( ( ( ( the ) ( cake ) ) ( ( beside ) ( ( the ) ( melons ) ) ) ) ( ( that ) ( was ) ( dusted ) ) ) ) )
Camila pierced a bunny beside doctors that was nursed .	What is the theme of nursed ?	a bunny beside doctors	cogs_qa	( ( ( Camila ) ) ( ( pierced ) ( ( ( ( a ) ( bunny ) ) ( ( beside ) ( ( doctors ) ) ) ) ( ( that ) ( was ) ( nursed ) ) ) ) )
Emma enlarged a needle beside games that was cleaned .	What is the theme of cleaned ?	a needle beside games	cogs_qa	( ( ( Emma ) ) ( ( enlarged ) ( ( ( ( a ) ( needle ) ) ( ( beside ) ( ( games ) ) ) ) ( ( that ) ( was ) ( cleaned ) ) ) ) )
A cat helped a ball beside professors that was sketched .	What is the theme of sketched ?	a ball beside professors	cogs_qa	( ( ( A ) ( cat ) ) ( ( helped ) ( ( ( ( a ) ( ball ) ) ( ( beside ) ( ( professors ) ) ) ) ( ( that ) ( was ) ( sketched ) ) ) ) )
Levi threw the giraffe beside boys that was eaten .	What is the theme of eaten ?	the giraffe beside boys	cogs_qa	( ( ( Levi ) ) ( ( threw ) ( ( ( ( the ) ( giraffe ) ) ( ( beside ) ( ( boys ) ) ) ) ( ( that ) ( was ) ( eaten ) ) ) ) )
Emma helped a newspaper beside cats that was painted .	What is the theme of painted ?	a newspaper beside cats	cogs_qa	( ( ( Emma ) ) ( ( helped ) ( ( ( ( a ) ( newspaper ) ) ( ( beside ) ( ( cats ) ) ) ) ( ( that ) ( was ) ( painted ) ) ) ) )
A lion burned a crayon beside girls that was painted .	What is the theme of painted ?	a crayon beside girls	cogs_qa	( ( ( A ) ( lion ) ) ( ( burned ) ( ( ( ( a ) ( crayon ) ) ( ( beside ) ( ( girls ) ) ) ) ( ( that ) ( was ) ( painted ) ) ) ) )
Emma tossed the cake beside the girls that was cooked .	What is the theme of cooked ?	the cake beside the girls	cogs_qa	( ( ( Emma ) ) ( ( tossed ) ( ( ( ( the ) ( cake ) ) ( ( beside ) ( ( the ) ( girls ) ) ) ) ( ( that ) ( was ) ( cooked ) ) ) ) )
A girl helped a teacher beside turtles that was eaten .	What is the theme of eaten ?	a teacher beside turtles	cogs_qa	( ( ( A ) ( girl ) ) ( ( helped ) ( ( ( ( a ) ( teacher ) ) ( ( beside ) ( ( turtles ) ) ) ) ( ( that ) ( was ) ( eaten ) ) ) ) )
Liam ate a cake beside the dogs that was hunted .	What is the theme of hunted ?	a cake beside the dogs	cogs_qa	( ( ( Liam ) ) ( ( ate ) ( ( ( ( a ) ( cake ) ) ( ( beside ) ( ( the ) ( dogs ) ) ) ) ( ( that ) ( was ) ( hunted ) ) ) ) )
Olivia burned a cake beside girls that was noticed .	What is the theme of noticed ?	a cake beside girls	cogs_qa	( ( ( Olivia ) ) ( ( burned ) ( ( ( ( a ) ( cake ) ) ( ( beside ) ( ( girls ) ) ) ) ( ( that ) ( was ) ( noticed ) ) ) ) )
Olivia liked the yogurt beside the mice that was cleaned .	What is the theme of cleaned ?	the yogurt beside the mice	cogs_qa	( ( ( Olivia ) ) ( ( liked ) ( ( ( ( the ) ( yogurt ) ) ( ( beside ) ( ( the ) ( mice ) ) ) ) ( ( that ) ( was ) ( cleaned ) ) ) ) )
The chicken drew the driver beside the girls that was eaten .	What is the theme of eaten ?	the driver beside the girls	cogs_qa	( ( ( The ) ( chicken ) ) ( ( drew ) ( ( ( ( the ) ( driver ) ) ( ( beside ) ( ( the ) ( girls ) ) ) ) ( ( that ) ( was ) ( eaten ) ) ) ) )
A hero hunted a cake beside the cats that was eaten .	What is the theme of eaten ?	a cake beside the cats	cogs_qa	( ( ( A ) ( hero ) ) ( ( hunted ) ( ( ( ( a ) ( cake ) ) ( ( beside ) ( ( the ) ( cats ) ) ) ) ( ( that ) ( was ) ( eaten ) ) ) ) )
The girl rolled a donut beside cakes that was hunted .	What is the theme of hunted ?	a donut beside cakes	cogs_qa	( ( ( The ) ( girl ) ) ( ( rolled ) ( ( ( ( a ) ( donut ) ) ( ( beside ) ( ( cakes ) ) ) ) ( ( that ) ( was ) ( hunted ) ) ) ) )
Liam liked a donut beside the journalists that was called .	What is the theme of called ?	a donut beside the journalists	cogs_qa	( ( ( Liam ) ) ( ( liked ) ( ( ( ( a ) ( donut ) ) ( ( beside ) ( ( the ) ( journalists ) ) ) ) ( ( that ) ( was ) ( called ) ) ) ) )
A giraffe drew the crayon beside drinks that was observed .	What is the theme of observed ?	the crayon beside drinks	cogs_qa	( ( ( A ) ( giraffe ) ) ( ( drew ) ( ( ( ( the ) ( crayon ) ) ( ( beside ) ( ( drinks ) ) ) ) ( ( that ) ( was ) ( observed ) ) ) ) )
Noah liked the pumpkin beside the girls that was eaten .	What is the theme of eaten ?	the pumpkin beside the girls	cogs_qa	( ( ( Noah ) ) ( ( liked ) ( ( ( ( the ) ( pumpkin ) ) ( ( beside ) ( ( the ) ( girls ) ) ) ) ( ( that ) ( was ) ( eaten ) ) ) ) )
Isabella sketched a dog beside the balls that was eaten .	What is the theme of eaten ?	a dog beside the balls	cogs_qa	( ( ( Isabella ) ) ( ( sketched ) ( ( ( ( a ) ( dog ) ) ( ( beside ) ( ( the ) ( balls ) ) ) ) ( ( that ) ( was ) ( eaten ) ) ) ) )
The girl rolled a turkey beside the brushes that was eaten .	What is the theme of eaten ?	a turkey beside the brushes	cogs_qa	( ( ( The ) ( girl ) ) ( ( rolled ) ( ( ( ( a ) ( turkey ) ) ( ( beside ) ( ( the ) ( brushes ) ) ) ) ( ( that ) ( was ) ( eaten ) ) ) ) )
Emma helped a girl beside the balloons that was eaten .	What is the theme of eaten ?	a girl beside the balloons	cogs_qa	( ( ( Emma ) ) ( ( helped ) ( ( ( ( a ) ( girl ) ) ( ( beside ) ( ( the ) ( balloons ) ) ) ) ( ( that ) ( was ) ( eaten ) ) ) ) )
The penguin painted a cake beside dogs that was eaten .	What is the theme of eaten ?	a cake beside dogs	cogs_qa	( ( ( The ) ( penguin ) ) ( ( painted ) ( ( ( ( a ) ( cake ) ) ( ( beside ) ( ( dogs ) ) ) ) ( ( that ) ( was ) ( eaten ) ) ) ) )
Emma noticed the donut beside the chickens that was eaten .	What is the theme of eaten ?	the donut beside the chickens	cogs_qa	( ( ( Emma ) ) ( ( noticed ) ( ( ( ( the ) ( donut ) ) ( ( beside ) ( ( the ) ( chickens ) ) ) ) ( ( that ) ( was ) ( eaten ) ) ) ) )
The baby helped the cake beside the children that was painted .	What is the theme of painted ?	the cake beside the children	cogs_qa	( ( ( The ) ( baby ) ) ( ( helped ) ( ( ( ( the ) ( cake ) ) ( ( beside ) ( ( the ) ( children ) ) ) ) ( ( that ) ( was ) ( painted ) ) ) ) )
A servant called the balloon beside cats that was cleaned .	What is the theme of cleaned ?	the balloon beside cats	cogs_qa	( ( ( A ) ( servant ) ) ( ( called ) ( ( ( ( the ) ( balloon ) ) ( ( beside ) ( ( cats ) ) ) ) ( ( that ) ( was ) ( cleaned ) ) ) ) )
The girl rolled a cake beside blocks that was cleaned .	What is the theme of cleaned ?	a cake beside blocks	cogs_qa	( ( ( The ) ( girl ) ) ( ( rolled ) ( ( ( ( a ) ( cake ) ) ( ( beside ) ( ( blocks ) ) ) ) ( ( that ) ( was ) ( cleaned ) ) ) ) )
A chicken shortened a dog beside bees that was eaten .	What is the theme of eaten ?	a dog beside bees	cogs_qa	( ( ( A ) ( chicken ) ) ( ( shortened ) ( ( ( ( a ) ( dog ) ) ( ( beside ) ( ( bees ) ) ) ) ( ( that ) ( was ) ( eaten ) ) ) ) )
Noah admired the box beside the dogs that was painted .	What is the theme of painted ?	the box beside the dogs	cogs_qa	( ( ( Noah ) ) ( ( admired ) ( ( ( ( the ) ( box ) ) ( ( beside ) ( ( the ) ( dogs ) ) ) ) ( ( that ) ( was ) ( painted ) ) ) ) )
Isabella missed a baby beside girls that was eaten .	What is the theme of eaten ?	a baby beside girls	cogs_qa	( ( ( Isabella ) ) ( ( missed ) ( ( ( ( a ) ( baby ) ) ( ( beside ) ( ( girls ) ) ) ) ( ( that ) ( was ) ( eaten ) ) ) ) )
Andrew ate the pizza beside the donuts that was drawn .	What is the theme of drawn ?	the pizza beside the donuts	cogs_qa	( ( ( Andrew ) ) ( ( ate ) ( ( ( ( the ) ( pizza ) ) ( ( beside ) ( ( the ) ( donuts ) ) ) ) ( ( that ) ( was ) ( drawn ) ) ) ) )
A lion adored the towel beside girls that was painted .	What is the theme of painted ?	the towel beside girls	cogs_qa	( ( ( A ) ( lion ) ) ( ( adored ) ( ( ( ( the ) ( towel ) ) ( ( beside ) ( ( girls ) ) ) ) ( ( that ) ( was ) ( painted ) ) ) ) )
Olivia poked the pumpkin beside the cookies that was called .	What is the theme of called ?	the pumpkin beside the cookies	cogs_qa	( ( ( Olivia ) ) ( ( poked ) ( ( ( ( the ) ( pumpkin ) ) ( ( beside ) ( ( the ) ( cookies ) ) ) ) ( ( that ) ( was ) ( called ) ) ) ) )
Emma cleaned the girl beside cakes that was cooked .	What is the theme of cooked ?	the girl beside cakes	cogs_qa	( ( ( Emma ) ) ( ( cleaned ) ( ( ( ( the ) ( girl ) ) ( ( beside ) ( ( cakes ) ) ) ) ( ( that ) ( was ) ( cooked ) ) ) ) )
