Liam liked that the citizen eats the strawberry and found a cake beside a poster .	What is the ccomp of liked ?	that the citizen eats the strawberry	cogs_qa	( ( ( Liam ) ) ( ( ( liked ) ( ( that ) ( ( ( the ) ( citizen ) ) ( ( eats ) ( ( the ) ( strawberry ) ) ) ) ) ) ( and ) ( ( found ) ( ( a ) ( cake ) ( ( beside ) ( ( a ) ( poster ) ) ) ) ) ) )
A cat expected that the duck sees Emma and ate a boy on a road .	What is the ccomp of expected ?	that the duck sees Emma	cogs_qa	( ( ( A ) ( cat ) ) ( ( ( expected ) ( ( that ) ( ( ( the ) ( duck ) ) ( ( sees ) ( ( Emma ) ) ) ) ) ) ( and ) ( ( ate ) ( ( a ) ( boy ) ( ( on ) ( ( a ) ( road ) ) ) ) ) ) )
Olivia hoped that Emma likes Liam and jogged .	What is the ccomp of hoped ?	that Emma likes Liam	cogs_qa	( ( ( Olivia ) ) ( ( ( hoped ) ( ( that ) ( ( ( Emma ) ) ( ( likes ) ( ( Liam ) ) ) ) ) ) ( and ) ( ( jogged ) ) ) )
A visitor hoped that Charlotte appreciates the cake on a bed and slid a molecule beside a table .	What is the ccomp of hoped ?	that Charlotte appreciates the cake on a bed	cogs_qa	( ( ( A ) ( visitor ) ) ( ( ( hoped ) ( ( that ) ( ( ( Charlotte ) ) ( ( appreciates ) ( ( the ) ( cake ) ( ( on ) ( ( a ) ( bed ) ) ) ) ) ) ) ) ( and ) ( ( slid ) ( ( a ) ( molecule ) ( ( beside ) ( ( a ) ( table ) ) ) ) ) ) )
Liam appreciated that a professor eats the cookie and noticed the father on a box on the table .	What is the ccomp of appreciated ?	that a professor eats the cookie	cogs_qa	( ( ( Liam ) ) ( ( ( appreciated ) ( ( that ) ( ( ( a ) ( professor ) ) ( ( eats ) ( ( the ) ( cookie ) ) ) ) ) ) ( and ) ( ( noticed ) ( ( the ) ( father ) ( ( on ) ( ( a ) ( box ) ( ( on ) ( ( the ) ( table ) ) ) ) ) ) ) ) )
A girl said that Emma eats and helped the cake .	What is the ccomp of said ?	that Emma eats	cogs_qa	( ( ( A ) ( girl ) ) ( ( ( said ) ( ( that ) ( ( ( Emma ) ) ( ( eats ) ) ) ) ) ( and ) ( ( helped ) ( ( the ) ( cake ) ) ) ) )
The lion liked that the kitty cooks and rolled a girl .	What is the ccomp of liked ?	that the kitty cooks	cogs_qa	( ( ( The ) ( lion ) ) ( ( ( liked ) ( ( that ) ( ( ( the ) ( kitty ) ) ( ( cooks ) ) ) ) ) ( and ) ( ( rolled ) ( ( a ) ( girl ) ) ) ) )
The girl wished that Layla eats and scoffed .	What is the ccomp of wished ?	that Layla eats	cogs_qa	( ( ( The ) ( girl ) ) ( ( ( wished ) ( ( that ) ( ( ( Layla ) ) ( ( eats ) ) ) ) ) ( and ) ( ( scoffed ) ) ) )
Emma liked that a girl jogs and noticed .	What is the ccomp of liked ?	that a girl jogs	cogs_qa	( ( ( Emma ) ) ( ( ( liked ) ( ( that ) ( ( ( a ) ( girl ) ) ( ( jogs ) ) ) ) ) ( and ) ( ( noticed ) ) ) )
Samuel hoped that a student eats Skylar and liked a towel .	What is the ccomp of hoped ?	that a student eats Skylar	cogs_qa	( ( ( Samuel ) ) ( ( ( hoped ) ( ( that ) ( ( ( a ) ( student ) ) ( ( eats ) ( ( Skylar ) ) ) ) ) ) ( and ) ( ( liked ) ( ( a ) ( towel ) ) ) ) )
Emma valued that Skylar sleeps and liked a donkey .	What is the ccomp of valued ?	that Skylar sleeps	cogs_qa	( ( ( Emma ) ) ( ( ( valued ) ( ( that ) ( ( ( Skylar ) ) ( ( sleeps ) ) ) ) ) ( and ) ( ( liked ) ( ( a ) ( donkey ) ) ) ) )
William hoped that the girl sleeps and noticed .	What is the ccomp of hoped ?	that the girl sleeps	cogs_qa	( ( ( William ) ) ( ( ( hoped ) ( ( that ) ( ( ( the ) ( girl ) ) ( ( sleeps ) ) ) ) ) ( and ) ( ( noticed ) ) ) )
Charlotte said that the chicken cries and walked .	What is the ccomp of said ?	that the chicken cries	cogs_qa	( ( ( Charlotte ) ) ( ( ( said ) ( ( that ) ( ( ( the ) ( chicken ) ) ( ( cries ) ) ) ) ) ( and ) ( ( walked ) ) ) )
The bear hoped that Brooklyn cleans and shortened the frog in a fishbowl .	What is the ccomp of hoped ?	that Brooklyn cleans	cogs_qa	( ( ( The ) ( bear ) ) ( ( ( hoped ) ( ( that ) ( ( ( Brooklyn ) ) ( ( cleans ) ) ) ) ) ( and ) ( ( shortened ) ( ( the ) ( frog ) ( ( in ) ( ( a ) ( fishbowl ) ) ) ) ) ) )
Liam liked that Isabella finds the donut on a dog and ate Olivia .	What is the ccomp of liked ?	that Isabella finds the donut on a dog	cogs_qa	( ( ( Liam ) ) ( ( ( liked ) ( ( that ) ( ( ( Isabella ) ) ( ( finds ) ( ( the ) ( donut ) ( ( on ) ( ( a ) ( dog ) ) ) ) ) ) ) ) ( and ) ( ( ate ) ( ( Olivia ) ) ) ) )
The dog liked that the cat scoffs and nursed Elizabeth .	What is the ccomp of liked ?	that the cat scoffs	cogs_qa	( ( ( The ) ( dog ) ) ( ( ( liked ) ( ( that ) ( ( ( the ) ( cat ) ) ( ( scoffs ) ) ) ) ) ( and ) ( ( nursed ) ( ( Elizabeth ) ) ) ) )
The boy liked that Noah floats the donut and doubled Olivia .	What is the ccomp of liked ?	that Noah floats the donut	cogs_qa	( ( ( The ) ( boy ) ) ( ( ( liked ) ( ( that ) ( ( ( Noah ) ) ( ( floats ) ( ( the ) ( donut ) ) ) ) ) ) ( and ) ( ( doubled ) ( ( Olivia ) ) ) ) )
A cat noticed that Emma sleeps and burned the cake .	What is the ccomp of noticed ?	that Emma sleeps	cogs_qa	( ( ( A ) ( cat ) ) ( ( ( noticed ) ( ( that ) ( ( ( Emma ) ) ( ( sleeps ) ) ) ) ) ( and ) ( ( burned ) ( ( the ) ( cake ) ) ) ) )
Liam liked that Olivia rolls the professor in a can and painted the box on a table beside a stage .	What is the ccomp of liked ?	that Olivia rolls the professor in a can	cogs_qa	( ( ( Liam ) ) ( ( ( liked ) ( ( that ) ( ( ( Olivia ) ) ( ( rolls ) ( ( the ) ( professor ) ( ( in ) ( ( a ) ( can ) ) ) ) ) ) ) ) ( and ) ( ( painted ) ( ( the ) ( box ) ( ( on ) ( ( a ) ( table ) ( ( beside ) ( ( a ) ( stage ) ) ) ) ) ) ) ) )
The dog liked that John slides Charlotte and slept .	What is the ccomp of liked ?	that John slides Charlotte	cogs_qa	( ( ( The ) ( dog ) ) ( ( ( liked ) ( ( that ) ( ( ( John ) ) ( ( slides ) ( ( Charlotte ) ) ) ) ) ) ( and ) ( ( slept ) ) ) )
Emma admired that Lucas smiles and ate .	What is the ccomp of admired ?	that Lucas smiles	cogs_qa	( ( ( Emma ) ) ( ( ( admired ) ( ( that ) ( ( ( Lucas ) ) ( ( smiles ) ) ) ) ) ( and ) ( ( ate ) ) ) )
Luna hoped that Emma smiles and painted a donut beside the stage .	What is the ccomp of hoped ?	that Emma smiles	cogs_qa	( ( ( Luna ) ) ( ( ( hoped ) ( ( that ) ( ( ( Emma ) ) ( ( smiles ) ) ) ) ) ( and ) ( ( painted ) ( ( a ) ( donut ) ( ( beside ) ( ( the ) ( stage ) ) ) ) ) ) )
Scarlett said that Ava floats a ball beside a bush and grew the cookie in a pile beside the table .	What is the ccomp of said ?	that Ava floats a ball beside a bush	cogs_qa	( ( ( Scarlett ) ) ( ( ( said ) ( ( that ) ( ( ( Ava ) ) ( ( floats ) ( ( a ) ( ball ) ( ( beside ) ( ( a ) ( bush ) ) ) ) ) ) ) ) ( and ) ( ( grew ) ( ( the ) ( cookie ) ( ( in ) ( ( a ) ( pile ) ( ( beside ) ( ( the ) ( table ) ) ) ) ) ) ) ) )
Ava said that the giraffe throws Sebastian and ran .	What is the ccomp of said ?	that the giraffe throws Sebastian	cogs_qa	( ( ( Ava ) ) ( ( ( said ) ( ( that ) ( ( ( the ) ( giraffe ) ) ( ( throws ) ( ( Sebastian ) ) ) ) ) ) ( and ) ( ( ran ) ) ) )
The dog noticed that a girl inflates Emma and dusted .	What is the ccomp of noticed ?	that a girl inflates Emma	cogs_qa	( ( ( The ) ( dog ) ) ( ( ( noticed ) ( ( that ) ( ( ( a ) ( girl ) ) ( ( inflates ) ( ( Emma ) ) ) ) ) ) ( and ) ( ( dusted ) ) ) )
Emma appreciated that Bella giggles and rolled the cake .	What is the ccomp of appreciated ?	that Bella giggles	cogs_qa	( ( ( Emma ) ) ( ( ( appreciated ) ( ( that ) ( ( ( Bella ) ) ( ( giggles ) ) ) ) ) ( and ) ( ( rolled ) ( ( the ) ( cake ) ) ) ) )
A cat said that a frog adores a cake in a cylinder and helped a knife beside the table .	What is the ccomp of said ?	that a frog adores a cake in a cylinder	cogs_qa	( ( ( A ) ( cat ) ) ( ( ( said ) ( ( that ) ( ( ( a ) ( frog ) ) ( ( adores ) ( ( a ) ( cake ) ( ( in ) ( ( a ) ( cylinder ) ) ) ) ) ) ) ) ( and ) ( ( helped ) ( ( a ) ( knife ) ( ( beside ) ( ( the ) ( table ) ) ) ) ) ) )
The girl dreamed that a prisoner sees and inflated a cake on a rock .	What is the ccomp of dreamed ?	that a prisoner sees	cogs_qa	( ( ( The ) ( girl ) ) ( ( ( dreamed ) ( ( that ) ( ( ( a ) ( prisoner ) ) ( ( sees ) ) ) ) ) ( and ) ( ( inflated ) ( ( a ) ( cake ) ( ( on ) ( ( a ) ( rock ) ) ) ) ) ) )
Emma supported that Mason loves Christopher and ate the girl .	What is the ccomp of supported ?	that Mason loves Christopher	cogs_qa	( ( ( Emma ) ) ( ( ( supported ) ( ( that ) ( ( ( Mason ) ) ( ( loves ) ( ( Christopher ) ) ) ) ) ) ( and ) ( ( ate ) ( ( the ) ( girl ) ) ) ) )
The lion liked that Madison tolerates the donut beside the bicycle and crumpled a cat in a bag .	What is the ccomp of liked ?	that Madison tolerates the donut beside the bicycle	cogs_qa	( ( ( The ) ( lion ) ) ( ( ( liked ) ( ( that ) ( ( ( Madison ) ) ( ( tolerates ) ( ( the ) ( donut ) ( ( beside ) ( ( the ) ( bicycle ) ) ) ) ) ) ) ) ( and ) ( ( crumpled ) ( ( a ) ( cat ) ( ( in ) ( ( a ) ( bag ) ) ) ) ) ) )
Logan said that a crocodile pokes the drink in the house and froze a cake .	What is the ccomp of said ?	that a crocodile pokes the drink in the house	cogs_qa	( ( ( Logan ) ) ( ( ( said ) ( ( that ) ( ( ( a ) ( crocodile ) ) ( ( pokes ) ( ( the ) ( drink ) ( ( in ) ( ( the ) ( house ) ) ) ) ) ) ) ) ( and ) ( ( froze ) ( ( a ) ( cake ) ) ) ) )
Benjamin meant that a prisoner dusts and gasped .	What is the ccomp of meant ?	that a prisoner dusts	cogs_qa	( ( ( Benjamin ) ) ( ( ( meant ) ( ( that ) ( ( ( a ) ( prisoner ) ) ( ( dusts ) ) ) ) ) ( and ) ( ( gasped ) ) ) )
Sophia noticed that Oliver rolls Evelyn and helped a baby .	What is the ccomp of noticed ?	that Oliver rolls Evelyn	cogs_qa	( ( ( Sophia ) ) ( ( ( noticed ) ( ( that ) ( ( ( Oliver ) ) ( ( rolls ) ( ( Evelyn ) ) ) ) ) ) ( and ) ( ( helped ) ( ( a ) ( baby ) ) ) ) )
Matthew liked that a teacher sleeps and packed .	What is the ccomp of liked ?	that a teacher sleeps	cogs_qa	( ( ( Matthew ) ) ( ( ( liked ) ( ( that ) ( ( ( a ) ( teacher ) ) ( ( sleeps ) ) ) ) ) ( and ) ( ( packed ) ) ) )
A girl noticed that the dealer paints the donut and ate a cake .	What is the ccomp of noticed ?	that the dealer paints the donut	cogs_qa	( ( ( A ) ( girl ) ) ( ( ( noticed ) ( ( that ) ( ( ( the ) ( dealer ) ) ( ( paints ) ( ( the ) ( donut ) ) ) ) ) ) ( and ) ( ( ate ) ( ( a ) ( cake ) ) ) ) )
Noah liked that Liam floats a cake in a house and called .	What is the ccomp of liked ?	that Liam floats a cake in a house	cogs_qa	( ( ( Noah ) ) ( ( ( liked ) ( ( that ) ( ( ( Liam ) ) ( ( floats ) ( ( a ) ( cake ) ( ( in ) ( ( a ) ( house ) ) ) ) ) ) ) ) ( and ) ( ( called ) ) ) )
The boy declared that the bird likes a cookie in a house and noticed Emma .	What is the ccomp of declared ?	that the bird likes a cookie in a house	cogs_qa	( ( ( The ) ( boy ) ) ( ( ( declared ) ( ( that ) ( ( ( the ) ( bird ) ) ( ( likes ) ( ( a ) ( cookie ) ( ( in ) ( ( a ) ( house ) ) ) ) ) ) ) ) ( and ) ( ( noticed ) ( ( Emma ) ) ) ) )
Emma liked that the cat tolerates a radio and painted Olivia .	What is the ccomp of liked ?	that the cat tolerates a radio	cogs_qa	( ( ( Emma ) ) ( ( ( liked ) ( ( that ) ( ( ( the ) ( cat ) ) ( ( tolerates ) ( ( a ) ( radio ) ) ) ) ) ) ( and ) ( ( painted ) ( ( Olivia ) ) ) ) )
Ava said that the lamb rolls the teacher and painted Isabella .	What is the ccomp of said ?	that the lamb rolls the teacher	cogs_qa	( ( ( Ava ) ) ( ( ( said ) ( ( that ) ( ( ( the ) ( lamb ) ) ( ( rolls ) ( ( the ) ( teacher ) ) ) ) ) ) ( and ) ( ( painted ) ( ( Isabella ) ) ) ) )
Noah liked that a girl smiles and gasped .	What is the ccomp of liked ?	that a girl smiles	cogs_qa	( ( ( Noah ) ) ( ( ( liked ) ( ( that ) ( ( ( a ) ( girl ) ) ( ( smiles ) ) ) ) ) ( and ) ( ( gasped ) ) ) )
The dog confessed that a producer freezes the boy and slept .	What is the ccomp of confessed ?	that a producer freezes the boy	cogs_qa	( ( ( The ) ( dog ) ) ( ( ( confessed ) ( ( that ) ( ( ( a ) ( producer ) ) ( ( freezes ) ( ( the ) ( boy ) ) ) ) ) ) ( and ) ( ( slept ) ) ) )
The mouse thought that Ava dusts and rolled the cat .	What is the ccomp of thought ?	that Ava dusts	cogs_qa	( ( ( The ) ( mouse ) ) ( ( ( thought ) ( ( that ) ( ( ( Ava ) ) ( ( dusts ) ) ) ) ) ( and ) ( ( rolled ) ( ( the ) ( cat ) ) ) ) )
A president hoped that Olivia knows the fig and slept .	What is the ccomp of hoped ?	that Olivia knows the fig	cogs_qa	( ( ( A ) ( president ) ) ( ( ( hoped ) ( ( that ) ( ( ( Olivia ) ) ( ( knows ) ( ( the ) ( fig ) ) ) ) ) ) ( and ) ( ( slept ) ) ) )
A girl liked that Emma dusts and cried .	What is the ccomp of liked ?	that Emma dusts	cogs_qa	( ( ( A ) ( girl ) ) ( ( ( liked ) ( ( that ) ( ( ( Emma ) ) ( ( dusts ) ) ) ) ) ( and ) ( ( cried ) ) ) )
Alexander valued that Noah eats Aubrey and liked the brain .	What is the ccomp of valued ?	that Noah eats Aubrey	cogs_qa	( ( ( Alexander ) ) ( ( ( valued ) ( ( that ) ( ( ( Noah ) ) ( ( eats ) ( ( Aubrey ) ) ) ) ) ) ( and ) ( ( liked ) ( ( the ) ( brain ) ) ) ) )
Bella hoped that Camila paints the cake in a room and gasped .	What is the ccomp of hoped ?	that Camila paints the cake in a room	cogs_qa	( ( ( Bella ) ) ( ( ( hoped ) ( ( that ) ( ( ( Camila ) ) ( ( paints ) ( ( the ) ( cake ) ( ( in ) ( ( a ) ( room ) ) ) ) ) ) ) ) ( and ) ( ( gasped ) ) ) )
Liam liked that Charlotte draws and cooked a donut in the cage .	What is the ccomp of liked ?	that Charlotte draws	cogs_qa	( ( ( Liam ) ) ( ( ( liked ) ( ( that ) ( ( ( Charlotte ) ) ( ( draws ) ) ) ) ) ( and ) ( ( cooked ) ( ( a ) ( donut ) ( ( in ) ( ( the ) ( cage ) ) ) ) ) ) )
Charlotte meant that Noah eats and liked a cake in the cup .	What is the ccomp of meant ?	that Noah eats	cogs_qa	( ( ( Charlotte ) ) ( ( ( meant ) ( ( that ) ( ( ( Noah ) ) ( ( eats ) ) ) ) ) ( and ) ( ( liked ) ( ( a ) ( cake ) ( ( in ) ( ( the ) ( cup ) ) ) ) ) ) )
A cat admired that a mother eats a bat and sneezed .	What is the ccomp of admired ?	that a mother eats a bat	cogs_qa	( ( ( A ) ( cat ) ) ( ( ( admired ) ( ( that ) ( ( ( a ) ( mother ) ) ( ( eats ) ( ( a ) ( bat ) ) ) ) ) ) ( and ) ( ( sneezed ) ) ) )
Noah imagined that Liam walks and ate .	What is the ccomp of imagined ?	that Liam walks	cogs_qa	( ( ( Noah ) ) ( ( ( imagined ) ( ( that ) ( ( ( Liam ) ) ( ( walks ) ) ) ) ) ( and ) ( ( ate ) ) ) )
A monster liked that Isabella paints Luna and smiled .	What is the ccomp of liked ?	that Isabella paints Luna	cogs_qa	( ( ( A ) ( monster ) ) ( ( ( liked ) ( ( that ) ( ( ( Isabella ) ) ( ( paints ) ( ( Luna ) ) ) ) ) ) ( and ) ( ( smiled ) ) ) )
The lamb hoped that a girl breaks Scarlett and painted .	What is the ccomp of hoped ?	that a girl breaks Scarlett	cogs_qa	( ( ( The ) ( lamb ) ) ( ( ( hoped ) ( ( that ) ( ( ( a ) ( girl ) ) ( ( breaks ) ( ( Scarlett ) ) ) ) ) ) ( and ) ( ( painted ) ) ) )
Alexander liked that Ava snores and walked .	What is the ccomp of liked ?	that Ava snores	cogs_qa	( ( ( Alexander ) ) ( ( ( liked ) ( ( that ) ( ( ( Ava ) ) ( ( snores ) ) ) ) ) ( and ) ( ( walked ) ) ) )
The horse said that Audrey cries and slept .	What is the ccomp of said ?	that Audrey cries	cogs_qa	( ( ( The ) ( horse ) ) ( ( ( said ) ( ( that ) ( ( ( Audrey ) ) ( ( cries ) ) ) ) ) ( and ) ( ( slept ) ) ) )
Emma valued that Liam smiles and slept .	What is the ccomp of valued ?	that Liam smiles	cogs_qa	( ( ( Emma ) ) ( ( ( valued ) ( ( that ) ( ( ( Liam ) ) ( ( smiles ) ) ) ) ) ( and ) ( ( slept ) ) ) )
Liam hoped that Mason paints the drink and sketched a girl in a house .	What is the ccomp of hoped ?	that Mason paints the drink	cogs_qa	( ( ( Liam ) ) ( ( ( hoped ) ( ( that ) ( ( ( Mason ) ) ( ( paints ) ( ( the ) ( drink ) ) ) ) ) ) ( and ) ( ( sketched ) ( ( a ) ( girl ) ( ( in ) ( ( a ) ( house ) ) ) ) ) ) )
Liam hoped that the child paints a cake and admired the box .	What is the ccomp of hoped ?	that the child paints a cake	cogs_qa	( ( ( Liam ) ) ( ( ( hoped ) ( ( that ) ( ( ( the ) ( child ) ) ( ( paints ) ( ( a ) ( cake ) ) ) ) ) ) ( and ) ( ( admired ) ( ( the ) ( box ) ) ) ) )
Emma confessed that the dog slides a cake and noticed .	What is the ccomp of confessed ?	that the dog slides a cake	cogs_qa	( ( ( Emma ) ) ( ( ( confessed ) ( ( that ) ( ( ( the ) ( dog ) ) ( ( slides ) ( ( a ) ( cake ) ) ) ) ) ) ( and ) ( ( noticed ) ) ) )
Emma supported that a boy draws a basket in the house and painted .	What is the ccomp of supported ?	that a boy draws a basket in the house	cogs_qa	( ( ( Emma ) ) ( ( ( supported ) ( ( that ) ( ( ( a ) ( boy ) ) ( ( draws ) ( ( a ) ( basket ) ( ( in ) ( ( the ) ( house ) ) ) ) ) ) ) ) ( and ) ( ( painted ) ) ) )
Emma liked that a girl nurses the wolf in a cup on a table and ate Noah .	What is the ccomp of liked ?	that a girl nurses the wolf in a cup on a table	cogs_qa	( ( ( Emma ) ) ( ( ( liked ) ( ( that ) ( ( ( a ) ( girl ) ) ( ( nurses ) ( ( the ) ( wolf ) ( ( in ) ( ( a ) ( cup ) ( ( on ) ( ( a ) ( table ) ) ) ) ) ) ) ) ) ) ( and ) ( ( ate ) ( ( Noah ) ) ) ) )
The girl liked that the turtle sneezes and nursed the child .	What is the ccomp of liked ?	that the turtle sneezes	cogs_qa	( ( ( The ) ( girl ) ) ( ( ( liked ) ( ( that ) ( ( ( the ) ( turtle ) ) ( ( sneezes ) ) ) ) ) ( and ) ( ( nursed ) ( ( the ) ( child ) ) ) ) )
The deer confessed that Emma eats the girl and painted .	What is the ccomp of confessed ?	that Emma eats the girl	cogs_qa	( ( ( The ) ( deer ) ) ( ( ( confessed ) ( ( that ) ( ( ( Emma ) ) ( ( eats ) ( ( the ) ( girl ) ) ) ) ) ) ( and ) ( ( painted ) ) ) )
A boy noticed that a professor helps the pencil and smiled .	What is the ccomp of noticed ?	that a professor helps the pencil	cogs_qa	( ( ( A ) ( boy ) ) ( ( ( noticed ) ( ( that ) ( ( ( a ) ( professor ) ) ( ( helps ) ( ( the ) ( pencil ) ) ) ) ) ) ( and ) ( ( smiled ) ) ) )
Liam confessed that a girl dances and slept .	What is the ccomp of confessed ?	that a girl dances	cogs_qa	( ( ( Liam ) ) ( ( ( confessed ) ( ( that ) ( ( ( a ) ( girl ) ) ( ( dances ) ) ) ) ) ( and ) ( ( slept ) ) ) )
Liam liked that the squirrel eats a cake beside the table and smirked .	What is the ccomp of liked ?	that the squirrel eats a cake beside the table	cogs_qa	( ( ( Liam ) ) ( ( ( liked ) ( ( that ) ( ( ( the ) ( squirrel ) ) ( ( eats ) ( ( a ) ( cake ) ( ( beside ) ( ( the ) ( table ) ) ) ) ) ) ) ) ( and ) ( ( smirked ) ) ) )
Emma proved that the doctor paints and smiled .	What is the ccomp of proved ?	that the doctor paints	cogs_qa	( ( ( Emma ) ) ( ( ( proved ) ( ( that ) ( ( ( the ) ( doctor ) ) ( ( paints ) ) ) ) ) ( and ) ( ( smiled ) ) ) )
The professor believed that the mother freezes a cake and slept .	What is the ccomp of believed ?	that the mother freezes a cake	cogs_qa	( ( ( The ) ( professor ) ) ( ( ( believed ) ( ( that ) ( ( ( the ) ( mother ) ) ( ( freezes ) ( ( a ) ( cake ) ) ) ) ) ) ( and ) ( ( slept ) ) ) )
A girl declared that a chicken eats and juggled .	What is the ccomp of declared ?	that a chicken eats	cogs_qa	( ( ( A ) ( girl ) ) ( ( ( declared ) ( ( that ) ( ( ( a ) ( chicken ) ) ( ( eats ) ) ) ) ) ( and ) ( ( juggled ) ) ) )
Emma liked that a fly smiles and knew .	What is the ccomp of liked ?	that a fly smiles	cogs_qa	( ( ( Emma ) ) ( ( ( liked ) ( ( that ) ( ( ( a ) ( fly ) ) ( ( smiles ) ) ) ) ) ( and ) ( ( knew ) ) ) )
Zoey said that Olivia splits the pupil and nursed Camila .	What is the ccomp of said ?	that Olivia splits the pupil	cogs_qa	( ( ( Zoey ) ) ( ( ( said ) ( ( that ) ( ( ( Olivia ) ) ( ( splits ) ( ( the ) ( pupil ) ) ) ) ) ) ( and ) ( ( nursed ) ( ( Camila ) ) ) ) )
A bear declared that Emma collapses a cake beside the table and poked Ava .	What is the ccomp of declared ?	that Emma collapses a cake beside the table	cogs_qa	( ( ( A ) ( bear ) ) ( ( ( declared ) ( ( that ) ( ( ( Emma ) ) ( ( collapses ) ( ( a ) ( cake ) ( ( beside ) ( ( the ) ( table ) ) ) ) ) ) ) ) ( and ) ( ( poked ) ( ( Ava ) ) ) ) )
A frog said that Olivia burns a key and saw .	What is the ccomp of said ?	that Olivia burns a key	cogs_qa	( ( ( A ) ( frog ) ) ( ( ( said ) ( ( that ) ( ( ( Olivia ) ) ( ( burns ) ( ( a ) ( key ) ) ) ) ) ) ( and ) ( ( saw ) ) ) )
A girl confessed that Emma screams and found Mila .	What is the ccomp of confessed ?	that Emma screams	cogs_qa	( ( ( A ) ( girl ) ) ( ( ( confessed ) ( ( that ) ( ( ( Emma ) ) ( ( screams ) ) ) ) ) ( and ) ( ( found ) ( ( Mila ) ) ) ) )
The mother liked that the baby jogs and ate .	What is the ccomp of liked ?	that the baby jogs	cogs_qa	( ( ( The ) ( mother ) ) ( ( ( liked ) ( ( that ) ( ( ( the ) ( baby ) ) ( ( jogs ) ) ) ) ) ( and ) ( ( ate ) ) ) )
The boy noticed that Emma talks and liked a drink beside a chair .	What is the ccomp of noticed ?	that Emma talks	cogs_qa	( ( ( The ) ( boy ) ) ( ( ( noticed ) ( ( that ) ( ( ( Emma ) ) ( ( talks ) ) ) ) ) ( and ) ( ( liked ) ( ( a ) ( drink ) ( ( beside ) ( ( a ) ( chair ) ) ) ) ) ) )
William admired that Emma finds a cake and ate .	What is the ccomp of admired ?	that Emma finds a cake	cogs_qa	( ( ( William ) ) ( ( ( admired ) ( ( that ) ( ( ( Emma ) ) ( ( finds ) ( ( a ) ( cake ) ) ) ) ) ) ( and ) ( ( ate ) ) ) )
Sofia thought that Emma finds the jacket and burned James .	What is the ccomp of thought ?	that Emma finds the jacket	cogs_qa	( ( ( Sofia ) ) ( ( ( thought ) ( ( that ) ( ( ( Emma ) ) ( ( finds ) ( ( the ) ( jacket ) ) ) ) ) ) ( and ) ( ( burned ) ( ( James ) ) ) ) )
Olivia wished that a boy cleans and slept .	What is the ccomp of wished ?	that a boy cleans	cogs_qa	( ( ( Olivia ) ) ( ( ( wished ) ( ( that ) ( ( ( a ) ( boy ) ) ( ( cleans ) ) ) ) ) ( and ) ( ( slept ) ) ) )
Emma said that a cat nurses a cake and drew the girl .	What is the ccomp of said ?	that a cat nurses a cake	cogs_qa	( ( ( Emma ) ) ( ( ( said ) ( ( that ) ( ( ( a ) ( cat ) ) ( ( nurses ) ( ( a ) ( cake ) ) ) ) ) ) ( and ) ( ( drew ) ( ( the ) ( girl ) ) ) ) )
The wolf liked that a lion smiles and threw a cake .	What is the ccomp of liked ?	that a lion smiles	cogs_qa	( ( ( The ) ( wolf ) ) ( ( ( liked ) ( ( that ) ( ( ( a ) ( lion ) ) ( ( smiles ) ) ) ) ) ( and ) ( ( threw ) ( ( a ) ( cake ) ) ) ) )
Emma supported that Olivia stabs the hat and ate a duck .	What is the ccomp of supported ?	that Olivia stabs the hat	cogs_qa	( ( ( Emma ) ) ( ( ( supported ) ( ( that ) ( ( ( Olivia ) ) ( ( stabs ) ( ( the ) ( hat ) ) ) ) ) ) ( and ) ( ( ate ) ( ( a ) ( duck ) ) ) ) )
A cat liked that Noah eats a boy and smiled .	What is the ccomp of liked ?	that Noah eats a boy	cogs_qa	( ( ( A ) ( cat ) ) ( ( ( liked ) ( ( that ) ( ( ( Noah ) ) ( ( eats ) ( ( a ) ( boy ) ) ) ) ) ) ( and ) ( ( smiled ) ) ) )
The cat hoped that Ava snoozes and drew .	What is the ccomp of hoped ?	that Ava snoozes	cogs_qa	( ( ( The ) ( cat ) ) ( ( ( hoped ) ( ( that ) ( ( ( Ava ) ) ( ( snoozes ) ) ) ) ) ( and ) ( ( drew ) ) ) )
Sophia said that Madison sketches and ate .	What is the ccomp of said ?	that Madison sketches	cogs_qa	( ( ( Sophia ) ) ( ( ( said ) ( ( that ) ( ( ( Madison ) ) ( ( sketches ) ) ) ) ) ( and ) ( ( ate ) ) ) )
A baby liked that Emma respects the weapon and cleaned John .	What is the ccomp of liked ?	that Emma respects the weapon	cogs_qa	( ( ( A ) ( baby ) ) ( ( ( liked ) ( ( that ) ( ( ( Emma ) ) ( ( respects ) ( ( the ) ( weapon ) ) ) ) ) ) ( and ) ( ( cleaned ) ( ( John ) ) ) ) )
A chicken expected that Emma enlarges the box in the vehicle and rolled a monkey .	What is the ccomp of expected ?	that Emma enlarges the box in the vehicle	cogs_qa	( ( ( A ) ( chicken ) ) ( ( ( expected ) ( ( that ) ( ( ( Emma ) ) ( ( enlarges ) ( ( the ) ( box ) ( ( in ) ( ( the ) ( vehicle ) ) ) ) ) ) ) ) ( and ) ( ( rolled ) ( ( a ) ( monkey ) ) ) ) )
Ava liked that the girl talks and ate a cake in a glass .	What is the ccomp of liked ?	that the girl talks	cogs_qa	( ( ( Ava ) ) ( ( ( liked ) ( ( that ) ( ( ( the ) ( girl ) ) ( ( talks ) ) ) ) ) ( and ) ( ( ate ) ( ( a ) ( cake ) ( ( in ) ( ( a ) ( glass ) ) ) ) ) ) )
A cat confessed that Emma juggles and painted a cake .	What is the ccomp of confessed ?	that Emma juggles	cogs_qa	( ( ( A ) ( cat ) ) ( ( ( confessed ) ( ( that ) ( ( ( Emma ) ) ( ( juggles ) ) ) ) ) ( and ) ( ( painted ) ( ( a ) ( cake ) ) ) ) )
A lion liked that the fly sleeps and rolled a bat .	What is the ccomp of liked ?	that the fly sleeps	cogs_qa	( ( ( A ) ( lion ) ) ( ( ( liked ) ( ( that ) ( ( ( the ) ( fly ) ) ( ( sleeps ) ) ) ) ) ( and ) ( ( rolled ) ( ( a ) ( bat ) ) ) ) )
Emma hoped that Liam paints and investigated .	What is the ccomp of hoped ?	that Liam paints	cogs_qa	( ( ( Emma ) ) ( ( ( hoped ) ( ( that ) ( ( ( Liam ) ) ( ( paints ) ) ) ) ) ( and ) ( ( investigated ) ) ) )
A princess hoped that Olivia laughs and liked the cake .	What is the ccomp of hoped ?	that Olivia laughs	cogs_qa	( ( ( A ) ( princess ) ) ( ( ( hoped ) ( ( that ) ( ( ( Olivia ) ) ( ( laughs ) ) ) ) ) ( and ) ( ( liked ) ( ( the ) ( cake ) ) ) ) )
The girl confessed that Olivia eats and rolled a cake in the pit .	What is the ccomp of confessed ?	that Olivia eats	cogs_qa	( ( ( The ) ( girl ) ) ( ( ( confessed ) ( ( that ) ( ( ( Olivia ) ) ( ( eats ) ) ) ) ) ( and ) ( ( rolled ) ( ( a ) ( cake ) ( ( in ) ( ( the ) ( pit ) ) ) ) ) ) )
The captain hoped that Emma hears and ate .	What is the ccomp of hoped ?	that Emma hears	cogs_qa	( ( ( The ) ( captain ) ) ( ( ( hoped ) ( ( that ) ( ( ( Emma ) ) ( ( hears ) ) ) ) ) ( and ) ( ( ate ) ) ) )
The mouse liked that Ava sleeps and stuttered .	What is the ccomp of liked ?	that Ava sleeps	cogs_qa	( ( ( The ) ( mouse ) ) ( ( ( liked ) ( ( that ) ( ( ( Ava ) ) ( ( sleeps ) ) ) ) ) ( and ) ( ( stuttered ) ) ) )
The teacher liked that a girl crumples the cookie beside a stage and slept .	What is the ccomp of liked ?	that a girl crumples the cookie beside a stage	cogs_qa	( ( ( The ) ( teacher ) ) ( ( ( liked ) ( ( that ) ( ( ( a ) ( girl ) ) ( ( crumples ) ( ( the ) ( cookie ) ( ( beside ) ( ( a ) ( stage ) ) ) ) ) ) ) ) ( and ) ( ( slept ) ) ) )
A guy hoped that Aiden snores and laughed .	What is the ccomp of hoped ?	that Aiden snores	cogs_qa	( ( ( A ) ( guy ) ) ( ( ( hoped ) ( ( that ) ( ( ( Aiden ) ) ( ( snores ) ) ) ) ) ( and ) ( ( laughed ) ) ) )
Emma liked that a cat nurses and dusted .	What is the ccomp of liked ?	that a cat nurses	cogs_qa	( ( ( Emma ) ) ( ( ( liked ) ( ( that ) ( ( ( a ) ( cat ) ) ( ( nurses ) ) ) ) ) ( and ) ( ( dusted ) ) ) )
