The girl noticed that Liam sneezes and shortened a cookie beside the sculpture .	What is the ccomp of noticed ?	that Liam sneezes	cogs_qa	( ( ( The ) ( girl ) ) ( ( ( noticed ) ( ( that ) ( ( ( Liam ) ) ( ( sneezes ) ) ) ) ) ( and ) ( ( shortened ) ( ( a ) ( cookie ) ( ( beside ) ( ( the ) ( sculpture ) ) ) ) ) ) )
The lawyer confessed that a prince screams and shortened the cat .	What is the ccomp of confessed ?	that a prince screams	cogs_qa	( ( ( The ) ( lawyer ) ) ( ( ( confessed ) ( ( that ) ( ( ( a ) ( prince ) ) ( ( screams ) ) ) ) ) ( and ) ( ( shortened ) ( ( the ) ( cat ) ) ) ) )
James expected that Ava paints the girl in the car and cooked Zoey .	What is the ccomp of expected ?	that Ava paints the girl in the car	cogs_qa	( ( ( James ) ) ( ( ( expected ) ( ( that ) ( ( ( Ava ) ) ( ( paints ) ( ( the ) ( girl ) ( ( in ) ( ( the ) ( car ) ) ) ) ) ) ) ) ( and ) ( ( cooked ) ( ( Zoey ) ) ) ) )
A girl declared that Luke hunts and juggled .	What is the ccomp of declared ?	that Luke hunts	cogs_qa	( ( ( A ) ( girl ) ) ( ( ( declared ) ( ( that ) ( ( ( Luke ) ) ( ( hunts ) ) ) ) ) ( and ) ( ( juggled ) ) ) )
The girl admired that a host stutters and found Liam .	What is the ccomp of admired ?	that a host stutters	cogs_qa	( ( ( The ) ( girl ) ) ( ( ( admired ) ( ( that ) ( ( ( a ) ( host ) ) ( ( stutters ) ) ) ) ) ( and ) ( ( found ) ( ( Liam ) ) ) ) )
Emma respected that a boy eats a journalist in a coffin and froze a cookie .	What is the ccomp of respected ?	that a boy eats a journalist in a coffin	cogs_qa	( ( ( Emma ) ) ( ( ( respected ) ( ( that ) ( ( ( a ) ( boy ) ) ( ( eats ) ( ( a ) ( journalist ) ( ( in ) ( ( a ) ( coffin ) ) ) ) ) ) ) ) ( and ) ( ( froze ) ( ( a ) ( cookie ) ) ) ) )
The cat thought that Abigail likes the toy beside the box and ate .	What is the ccomp of thought ?	that Abigail likes the toy beside the box	cogs_qa	( ( ( The ) ( cat ) ) ( ( ( thought ) ( ( that ) ( ( ( Abigail ) ) ( ( likes ) ( ( the ) ( toy ) ( ( beside ) ( ( the ) ( box ) ) ) ) ) ) ) ) ( and ) ( ( ate ) ) ) )
A boy liked that Mia sketches a cake and painted .	What is the ccomp of liked ?	that Mia sketches a cake	cogs_qa	( ( ( A ) ( boy ) ) ( ( ( liked ) ( ( that ) ( ( ( Mia ) ) ( ( sketches ) ( ( a ) ( cake ) ) ) ) ) ) ( and ) ( ( painted ) ) ) )
The cat believed that a girl knows a glue and ate .	What is the ccomp of believed ?	that a girl knows a glue	cogs_qa	( ( ( The ) ( cat ) ) ( ( ( believed ) ( ( that ) ( ( ( a ) ( girl ) ) ( ( knows ) ( ( a ) ( glue ) ) ) ) ) ) ( and ) ( ( ate ) ) ) )
Ava liked that the moose finds Jackson and split the coach in the car .	What is the ccomp of liked ?	that the moose finds Jackson	cogs_qa	( ( ( Ava ) ) ( ( ( liked ) ( ( that ) ( ( ( the ) ( moose ) ) ( ( finds ) ( ( Jackson ) ) ) ) ) ) ( and ) ( ( split ) ( ( the ) ( coach ) ( ( in ) ( ( the ) ( car ) ) ) ) ) ) )
The frog liked that David hunts the doll and heard .	What is the ccomp of liked ?	that David hunts the doll	cogs_qa	( ( ( The ) ( frog ) ) ( ( ( liked ) ( ( that ) ( ( ( David ) ) ( ( hunts ) ( ( the ) ( doll ) ) ) ) ) ) ( and ) ( ( heard ) ) ) )
Nathan admired that Olivia giggles and nursed the butterfly .	What is the ccomp of admired ?	that Olivia giggles	cogs_qa	( ( ( Nathan ) ) ( ( ( admired ) ( ( that ) ( ( ( Olivia ) ) ( ( giggles ) ) ) ) ) ( and ) ( ( nursed ) ( ( the ) ( butterfly ) ) ) ) )
The butterfly valued that Emma observes and drew .	What is the ccomp of valued ?	that Emma observes	cogs_qa	( ( ( The ) ( butterfly ) ) ( ( ( valued ) ( ( that ) ( ( ( Emma ) ) ( ( observes ) ) ) ) ) ( and ) ( ( drew ) ) ) )
A boy confessed that Emma snoozes and ate Elizabeth .	What is the ccomp of confessed ?	that Emma snoozes	cogs_qa	( ( ( A ) ( boy ) ) ( ( ( confessed ) ( ( that ) ( ( ( Emma ) ) ( ( snoozes ) ) ) ) ) ( and ) ( ( ate ) ( ( Elizabeth ) ) ) ) )
The dog said that Eleanor respects a butterfly on the computer and disintegrated the donut beside a mirror .	What is the ccomp of said ?	that Eleanor respects a butterfly on the computer	cogs_qa	( ( ( The ) ( dog ) ) ( ( ( said ) ( ( that ) ( ( ( Eleanor ) ) ( ( respects ) ( ( a ) ( butterfly ) ( ( on ) ( ( the ) ( computer ) ) ) ) ) ) ) ) ( and ) ( ( disintegrated ) ( ( the ) ( donut ) ( ( beside ) ( ( a ) ( mirror ) ) ) ) ) ) )
A fly meant that the soldier sleeps and rolled Elijah .	What is the ccomp of meant ?	that the soldier sleeps	cogs_qa	( ( ( A ) ( fly ) ) ( ( ( meant ) ( ( that ) ( ( ( the ) ( soldier ) ) ( ( sleeps ) ) ) ) ) ( and ) ( ( rolled ) ( ( Elijah ) ) ) ) )
A boy expected that Liam hunts a pizza on a speaker and cried .	What is the ccomp of expected ?	that Liam hunts a pizza on a speaker	cogs_qa	( ( ( A ) ( boy ) ) ( ( ( expected ) ( ( that ) ( ( ( Liam ) ) ( ( hunts ) ( ( a ) ( pizza ) ( ( on ) ( ( a ) ( speaker ) ) ) ) ) ) ) ) ( and ) ( ( cried ) ) ) )
Sebastian liked that a director eats and laughed .	What is the ccomp of liked ?	that a director eats	cogs_qa	( ( ( Sebastian ) ) ( ( ( liked ) ( ( that ) ( ( ( a ) ( director ) ) ( ( eats ) ) ) ) ) ( and ) ( ( laughed ) ) ) )
Charlotte respected that Noah paints the boy on a sheet and broke the donut .	What is the ccomp of respected ?	that Noah paints the boy on a sheet	cogs_qa	( ( ( Charlotte ) ) ( ( ( respected ) ( ( that ) ( ( ( Noah ) ) ( ( paints ) ( ( the ) ( boy ) ( ( on ) ( ( a ) ( sheet ) ) ) ) ) ) ) ) ( and ) ( ( broke ) ( ( the ) ( donut ) ) ) ) )
A hero confessed that the girl notices a lollipop and snapped James .	What is the ccomp of confessed ?	that the girl notices a lollipop	cogs_qa	( ( ( A ) ( hero ) ) ( ( ( confessed ) ( ( that ) ( ( ( the ) ( girl ) ) ( ( notices ) ( ( a ) ( lollipop ) ) ) ) ) ) ( and ) ( ( snapped ) ( ( James ) ) ) ) )
The child proved that Oliver examines the cake and ate .	What is the ccomp of proved ?	that Oliver examines the cake	cogs_qa	( ( ( The ) ( child ) ) ( ( ( proved ) ( ( that ) ( ( ( Oliver ) ) ( ( examines ) ( ( the ) ( cake ) ) ) ) ) ) ( and ) ( ( ate ) ) ) )
Aiden noticed that Liam paints and jogged .	What is the ccomp of noticed ?	that Liam paints	cogs_qa	( ( ( Aiden ) ) ( ( ( noticed ) ( ( that ) ( ( ( Liam ) ) ( ( paints ) ) ) ) ) ( and ) ( ( jogged ) ) ) )
Emma thought that the chicken likes a dog and drew .	What is the ccomp of thought ?	that the chicken likes a dog	cogs_qa	( ( ( Emma ) ) ( ( ( thought ) ( ( that ) ( ( ( the ) ( chicken ) ) ( ( likes ) ( ( a ) ( dog ) ) ) ) ) ) ( and ) ( ( drew ) ) ) )
A cat admired that William snaps the box in a house and rolled Alexander .	What is the ccomp of admired ?	that William snaps the box in a house	cogs_qa	( ( ( A ) ( cat ) ) ( ( ( admired ) ( ( that ) ( ( ( William ) ) ( ( snaps ) ( ( the ) ( box ) ( ( in ) ( ( a ) ( house ) ) ) ) ) ) ) ) ( and ) ( ( rolled ) ( ( Alexander ) ) ) ) )
Emma liked that the hero helps the raisin and missed Oliver .	What is the ccomp of liked ?	that the hero helps the raisin	cogs_qa	( ( ( Emma ) ) ( ( ( liked ) ( ( that ) ( ( ( the ) ( hero ) ) ( ( helps ) ( ( the ) ( raisin ) ) ) ) ) ) ( and ) ( ( missed ) ( ( Oliver ) ) ) ) )
Liam said that a girl loves a cake and ate .	What is the ccomp of said ?	that a girl loves a cake	cogs_qa	( ( ( Liam ) ) ( ( ( said ) ( ( that ) ( ( ( a ) ( girl ) ) ( ( loves ) ( ( a ) ( cake ) ) ) ) ) ) ( and ) ( ( ate ) ) ) )
Ava liked that Emma packs Liam and slept .	What is the ccomp of liked ?	that Emma packs Liam	cogs_qa	( ( ( Ava ) ) ( ( ( liked ) ( ( that ) ( ( ( Emma ) ) ( ( packs ) ( ( Liam ) ) ) ) ) ) ( and ) ( ( slept ) ) ) )
Alexander respected that Emma rolls the child and liked the cookie .	What is the ccomp of respected ?	that Emma rolls the child	cogs_qa	( ( ( Alexander ) ) ( ( ( respected ) ( ( that ) ( ( ( Emma ) ) ( ( rolls ) ( ( the ) ( child ) ) ) ) ) ) ( and ) ( ( liked ) ( ( the ) ( cookie ) ) ) ) )
Emma hoped that a girl burns the box and ate .	What is the ccomp of hoped ?	that a girl burns the box	cogs_qa	( ( ( Emma ) ) ( ( ( hoped ) ( ( that ) ( ( ( a ) ( girl ) ) ( ( burns ) ( ( the ) ( box ) ) ) ) ) ) ( and ) ( ( ate ) ) ) )
The bird liked that a patient eats and danced .	What is the ccomp of liked ?	that a patient eats	cogs_qa	( ( ( The ) ( bird ) ) ( ( ( liked ) ( ( that ) ( ( ( a ) ( patient ) ) ( ( eats ) ) ) ) ) ( and ) ( ( danced ) ) ) )
A judge said that Liam nurses a girl in the house and painted .	What is the ccomp of said ?	that Liam nurses a girl in the house	cogs_qa	( ( ( A ) ( judge ) ) ( ( ( said ) ( ( that ) ( ( ( Liam ) ) ( ( nurses ) ( ( a ) ( girl ) ( ( in ) ( ( the ) ( house ) ) ) ) ) ) ) ) ( and ) ( ( painted ) ) ) )
Emma liked that a girl screams and changed William .	What is the ccomp of liked ?	that a girl screams	cogs_qa	( ( ( Emma ) ) ( ( ( liked ) ( ( that ) ( ( ( a ) ( girl ) ) ( ( screams ) ) ) ) ) ( and ) ( ( changed ) ( ( William ) ) ) ) )
The girl wished that a dog eats and rolled the cake on a vessel .	What is the ccomp of wished ?	that a dog eats	cogs_qa	( ( ( The ) ( girl ) ) ( ( ( wished ) ( ( that ) ( ( ( a ) ( dog ) ) ( ( eats ) ) ) ) ) ( and ) ( ( rolled ) ( ( the ) ( cake ) ( ( on ) ( ( a ) ( vessel ) ) ) ) ) ) )
The boy liked that the queen cleans and danced .	What is the ccomp of liked ?	that the queen cleans	cogs_qa	( ( ( The ) ( boy ) ) ( ( ( liked ) ( ( that ) ( ( ( the ) ( queen ) ) ( ( cleans ) ) ) ) ) ( and ) ( ( danced ) ) ) )
Benjamin believed that Liam slides the drink on the stage and knew Emma .	What is the ccomp of believed ?	that Liam slides the drink on the stage	cogs_qa	( ( ( Benjamin ) ) ( ( ( believed ) ( ( that ) ( ( ( Liam ) ) ( ( slides ) ( ( the ) ( drink ) ( ( on ) ( ( the ) ( stage ) ) ) ) ) ) ) ) ( and ) ( ( knew ) ( ( Emma ) ) ) ) )
A bird believed that Daniel cleans Emma and ate .	What is the ccomp of believed ?	that Daniel cleans Emma	cogs_qa	( ( ( A ) ( bird ) ) ( ( ( believed ) ( ( that ) ( ( ( Daniel ) ) ( ( cleans ) ( ( Emma ) ) ) ) ) ) ( and ) ( ( ate ) ) ) )
The girl liked that Emma eats and drew the cake .	What is the ccomp of liked ?	that Emma eats	cogs_qa	( ( ( The ) ( girl ) ) ( ( ( liked ) ( ( that ) ( ( ( Emma ) ) ( ( eats ) ) ) ) ) ( and ) ( ( drew ) ( ( the ) ( cake ) ) ) ) )
The cat said that a girl nurses a director and packed Liam .	What is the ccomp of said ?	that a girl nurses a director	cogs_qa	( ( ( The ) ( cat ) ) ( ( ( said ) ( ( that ) ( ( ( a ) ( girl ) ) ( ( nurses ) ( ( a ) ( director ) ) ) ) ) ) ( and ) ( ( packed ) ( ( Liam ) ) ) ) )
A boy liked that Isabella loves Emma and rolled the poet in a hammock .	What is the ccomp of liked ?	that Isabella loves Emma	cogs_qa	( ( ( A ) ( boy ) ) ( ( ( liked ) ( ( that ) ( ( ( Isabella ) ) ( ( loves ) ( ( Emma ) ) ) ) ) ) ( and ) ( ( rolled ) ( ( the ) ( poet ) ( ( in ) ( ( a ) ( hammock ) ) ) ) ) ) )
The kitty liked that Emma snores and investigated .	What is the ccomp of liked ?	that Emma snores	cogs_qa	( ( ( The ) ( kitty ) ) ( ( ( liked ) ( ( that ) ( ( ( Emma ) ) ( ( snores ) ) ) ) ) ( and ) ( ( investigated ) ) ) )
Emma liked that Olivia eats and floated a donut beside the beast .	What is the ccomp of liked ?	that Olivia eats	cogs_qa	( ( ( Emma ) ) ( ( ( liked ) ( ( that ) ( ( ( Olivia ) ) ( ( eats ) ) ) ) ) ( and ) ( ( floated ) ( ( a ) ( donut ) ( ( beside ) ( ( the ) ( beast ) ) ) ) ) ) )
Nora said that Abigail eats and found Charlotte .	What is the ccomp of said ?	that Abigail eats	cogs_qa	( ( ( Nora ) ) ( ( ( said ) ( ( that ) ( ( ( Abigail ) ) ( ( eats ) ) ) ) ) ( and ) ( ( found ) ( ( Charlotte ) ) ) ) )
A girl liked that Emma eats a donut and painted the cake .	What is the ccomp of liked ?	that Emma eats a donut	cogs_qa	( ( ( A ) ( girl ) ) ( ( ( liked ) ( ( that ) ( ( ( Emma ) ) ( ( eats ) ( ( a ) ( donut ) ) ) ) ) ) ( and ) ( ( painted ) ( ( the ) ( cake ) ) ) ) )
A boy proved that Aria dusts and helped the cake .	What is the ccomp of proved ?	that Aria dusts	cogs_qa	( ( ( A ) ( boy ) ) ( ( ( proved ) ( ( that ) ( ( ( Aria ) ) ( ( dusts ) ) ) ) ) ( and ) ( ( helped ) ( ( the ) ( cake ) ) ) ) )
The guard hoped that the boy smiles and slept .	What is the ccomp of hoped ?	that the boy smiles	cogs_qa	( ( ( The ) ( guard ) ) ( ( ( hoped ) ( ( that ) ( ( ( the ) ( boy ) ) ( ( smiles ) ) ) ) ) ( and ) ( ( slept ) ) ) )
The horse confessed that Liam sees a crown and frowned .	What is the ccomp of confessed ?	that Liam sees a crown	cogs_qa	( ( ( The ) ( horse ) ) ( ( ( confessed ) ( ( that ) ( ( ( Liam ) ) ( ( sees ) ( ( a ) ( crown ) ) ) ) ) ) ( and ) ( ( frowned ) ) ) )
A hero liked that a girl eats the cake and dusted a cookie .	What is the ccomp of liked ?	that a girl eats the cake	cogs_qa	( ( ( A ) ( hero ) ) ( ( ( liked ) ( ( that ) ( ( ( a ) ( girl ) ) ( ( eats ) ( ( the ) ( cake ) ) ) ) ) ) ( and ) ( ( dusted ) ( ( a ) ( cookie ) ) ) ) )
Charlotte expected that Emma rolls a rose on the stage and hunted .	What is the ccomp of expected ?	that Emma rolls a rose on the stage	cogs_qa	( ( ( Charlotte ) ) ( ( ( expected ) ( ( that ) ( ( ( Emma ) ) ( ( rolls ) ( ( a ) ( rose ) ( ( on ) ( ( the ) ( stage ) ) ) ) ) ) ) ) ( and ) ( ( hunted ) ) ) )
Emma liked that Henry crumples a knife beside a chemist and found the giraffe in the bush .	What is the ccomp of liked ?	that Henry crumples a knife beside a chemist	cogs_qa	( ( ( Emma ) ) ( ( ( liked ) ( ( that ) ( ( ( Henry ) ) ( ( crumples ) ( ( a ) ( knife ) ( ( beside ) ( ( a ) ( chemist ) ) ) ) ) ) ) ) ( and ) ( ( found ) ( ( the ) ( giraffe ) ( ( in ) ( ( the ) ( bush ) ) ) ) ) ) )
Olivia hoped that a girl likes Elijah and ate Harper .	What is the ccomp of hoped ?	that a girl likes Elijah	cogs_qa	( ( ( Olivia ) ) ( ( ( hoped ) ( ( that ) ( ( ( a ) ( girl ) ) ( ( likes ) ( ( Elijah ) ) ) ) ) ) ( and ) ( ( ate ) ( ( Harper ) ) ) ) )
A fish liked that a girl rolls Mia and sneezed .	What is the ccomp of liked ?	that a girl rolls Mia	cogs_qa	( ( ( A ) ( fish ) ) ( ( ( liked ) ( ( that ) ( ( ( a ) ( girl ) ) ( ( rolls ) ( ( Mia ) ) ) ) ) ) ( and ) ( ( sneezed ) ) ) )
A duck said that Emma rolls a donut and liked a cake .	What is the ccomp of said ?	that Emma rolls a donut	cogs_qa	( ( ( A ) ( duck ) ) ( ( ( said ) ( ( that ) ( ( ( Emma ) ) ( ( rolls ) ( ( a ) ( donut ) ) ) ) ) ) ( and ) ( ( liked ) ( ( a ) ( cake ) ) ) ) )
Avery said that Charlotte cleans a brush and snored .	What is the ccomp of said ?	that Charlotte cleans a brush	cogs_qa	( ( ( Avery ) ) ( ( ( said ) ( ( that ) ( ( ( Charlotte ) ) ( ( cleans ) ( ( a ) ( brush ) ) ) ) ) ) ( and ) ( ( snored ) ) ) )
A cat hoped that a girl rolls Emma and noticed .	What is the ccomp of hoped ?	that a girl rolls Emma	cogs_qa	( ( ( A ) ( cat ) ) ( ( ( hoped ) ( ( that ) ( ( ( a ) ( girl ) ) ( ( rolls ) ( ( Emma ) ) ) ) ) ) ( and ) ( ( noticed ) ) ) )
Liam hoped that a mouse hunts and frowned .	What is the ccomp of hoped ?	that a mouse hunts	cogs_qa	( ( ( Liam ) ) ( ( ( hoped ) ( ( that ) ( ( ( a ) ( mouse ) ) ( ( hunts ) ) ) ) ) ( and ) ( ( frowned ) ) ) )
Noah dreamed that Luna likes the cake beside a stage and smiled .	What is the ccomp of dreamed ?	that Luna likes the cake beside a stage	cogs_qa	( ( ( Noah ) ) ( ( ( dreamed ) ( ( that ) ( ( ( Luna ) ) ( ( likes ) ( ( the ) ( cake ) ( ( beside ) ( ( a ) ( stage ) ) ) ) ) ) ) ) ( and ) ( ( smiled ) ) ) )
A bunny meant that Olivia sleeps and rolled the customer .	What is the ccomp of meant ?	that Olivia sleeps	cogs_qa	( ( ( A ) ( bunny ) ) ( ( ( meant ) ( ( that ) ( ( ( Olivia ) ) ( ( sleeps ) ) ) ) ) ( and ) ( ( rolled ) ( ( the ) ( customer ) ) ) ) )
Charlotte valued that Noah paints and ate a bag in a house .	What is the ccomp of valued ?	that Noah paints	cogs_qa	( ( ( Charlotte ) ) ( ( ( valued ) ( ( that ) ( ( ( Noah ) ) ( ( paints ) ) ) ) ) ( and ) ( ( ate ) ( ( a ) ( bag ) ( ( in ) ( ( a ) ( house ) ) ) ) ) ) )
The girl noticed that Sophia jogs and talked .	What is the ccomp of noticed ?	that Sophia jogs	cogs_qa	( ( ( The ) ( girl ) ) ( ( ( noticed ) ( ( that ) ( ( ( Sophia ) ) ( ( jogs ) ) ) ) ) ( and ) ( ( talked ) ) ) )
The cat liked that the dog grows a donut and jogged .	What is the ccomp of liked ?	that the dog grows a donut	cogs_qa	( ( ( The ) ( cat ) ) ( ( ( liked ) ( ( that ) ( ( ( the ) ( dog ) ) ( ( grows ) ( ( a ) ( donut ) ) ) ) ) ) ( and ) ( ( jogged ) ) ) )
James valued that Liam pokes Isabella and slept .	What is the ccomp of valued ?	that Liam pokes Isabella	cogs_qa	( ( ( James ) ) ( ( ( valued ) ( ( that ) ( ( ( Liam ) ) ( ( pokes ) ( ( Isabella ) ) ) ) ) ) ( and ) ( ( slept ) ) ) )
Charlotte liked that a girl smiles and rolled the rose .	What is the ccomp of liked ?	that a girl smiles	cogs_qa	( ( ( Charlotte ) ) ( ( ( liked ) ( ( that ) ( ( ( a ) ( girl ) ) ( ( smiles ) ) ) ) ) ( and ) ( ( rolled ) ( ( the ) ( rose ) ) ) ) )
The boy hoped that Emma hears and cleaned .	What is the ccomp of hoped ?	that Emma hears	cogs_qa	( ( ( The ) ( boy ) ) ( ( ( hoped ) ( ( that ) ( ( ( Emma ) ) ( ( hears ) ) ) ) ) ( and ) ( ( cleaned ) ) ) )
A dog hoped that the girl helps a donut and packed Olivia .	What is the ccomp of hoped ?	that the girl helps a donut	cogs_qa	( ( ( A ) ( dog ) ) ( ( ( hoped ) ( ( that ) ( ( ( the ) ( girl ) ) ( ( helps ) ( ( a ) ( donut ) ) ) ) ) ) ( and ) ( ( packed ) ( ( Olivia ) ) ) ) )
The girl noticed that the captain eats and sneezed .	What is the ccomp of noticed ?	that the captain eats	cogs_qa	( ( ( The ) ( girl ) ) ( ( ( noticed ) ( ( that ) ( ( ( the ) ( captain ) ) ( ( eats ) ) ) ) ) ( and ) ( ( sneezed ) ) ) )
The dog believed that Claire cooks the cookie and threw a sandwich .	What is the ccomp of believed ?	that Claire cooks the cookie	cogs_qa	( ( ( The ) ( dog ) ) ( ( ( believed ) ( ( that ) ( ( ( Claire ) ) ( ( cooks ) ( ( the ) ( cookie ) ) ) ) ) ) ( and ) ( ( threw ) ( ( a ) ( sandwich ) ) ) ) )
A boy hoped that Emma likes Daniel and heard .	What is the ccomp of hoped ?	that Emma likes Daniel	cogs_qa	( ( ( A ) ( boy ) ) ( ( ( hoped ) ( ( that ) ( ( ( Emma ) ) ( ( likes ) ( ( Daniel ) ) ) ) ) ) ( and ) ( ( heard ) ) ) )
The cat liked that Emma worships the baby and painted Mia .	What is the ccomp of liked ?	that Emma worships the baby	cogs_qa	( ( ( The ) ( cat ) ) ( ( ( liked ) ( ( that ) ( ( ( Emma ) ) ( ( worships ) ( ( the ) ( baby ) ) ) ) ) ) ( and ) ( ( painted ) ( ( Mia ) ) ) ) )
Benjamin hoped that a dog paints and crumpled Emma .	What is the ccomp of hoped ?	that a dog paints	cogs_qa	( ( ( Benjamin ) ) ( ( ( hoped ) ( ( that ) ( ( ( a ) ( dog ) ) ( ( paints ) ) ) ) ) ( and ) ( ( crumpled ) ( ( Emma ) ) ) ) )
The boy hoped that the zebra eats and grew Theodore .	What is the ccomp of hoped ?	that the zebra eats	cogs_qa	( ( ( The ) ( boy ) ) ( ( ( hoped ) ( ( that ) ( ( ( the ) ( zebra ) ) ( ( eats ) ) ) ) ) ( and ) ( ( grew ) ( ( Theodore ) ) ) ) )
The girl liked that Charlotte helps the hamburger and loved a cookie on a road .	What is the ccomp of liked ?	that Charlotte helps the hamburger	cogs_qa	( ( ( The ) ( girl ) ) ( ( ( liked ) ( ( that ) ( ( ( Charlotte ) ) ( ( helps ) ( ( the ) ( hamburger ) ) ) ) ) ) ( and ) ( ( loved ) ( ( a ) ( cookie ) ( ( on ) ( ( a ) ( road ) ) ) ) ) ) )
Isabella expected that Sophia juggles and dusted a cake .	What is the ccomp of expected ?	that Sophia juggles	cogs_qa	( ( ( Isabella ) ) ( ( ( expected ) ( ( that ) ( ( ( Sophia ) ) ( ( juggles ) ) ) ) ) ( and ) ( ( dusted ) ( ( a ) ( cake ) ) ) ) )
The professor hoped that the girl sleeps and rolled a cake .	What is the ccomp of hoped ?	that the girl sleeps	cogs_qa	( ( ( The ) ( professor ) ) ( ( ( hoped ) ( ( that ) ( ( ( the ) ( girl ) ) ( ( sleeps ) ) ) ) ) ( and ) ( ( rolled ) ( ( a ) ( cake ) ) ) ) )
A girl hoped that Emma runs and ate Liam .	What is the ccomp of hoped ?	that Emma runs	cogs_qa	( ( ( A ) ( girl ) ) ( ( ( hoped ) ( ( that ) ( ( ( Emma ) ) ( ( runs ) ) ) ) ) ( and ) ( ( ate ) ( ( Liam ) ) ) ) )
A girl said that Oliver improves a pen on a leaflet and ate Olivia .	What is the ccomp of said ?	that Oliver improves a pen on a leaflet	cogs_qa	( ( ( A ) ( girl ) ) ( ( ( said ) ( ( that ) ( ( ( Oliver ) ) ( ( improves ) ( ( a ) ( pen ) ( ( on ) ( ( a ) ( leaflet ) ) ) ) ) ) ) ) ( and ) ( ( ate ) ( ( Olivia ) ) ) ) )
A girl hoped that Emma paints the donut and cleaned .	What is the ccomp of hoped ?	that Emma paints the donut	cogs_qa	( ( ( A ) ( girl ) ) ( ( ( hoped ) ( ( that ) ( ( ( Emma ) ) ( ( paints ) ( ( the ) ( donut ) ) ) ) ) ) ( and ) ( ( cleaned ) ) ) )
Emma believed that a kid eats and juggled the cake on the tree .	What is the ccomp of believed ?	that a kid eats	cogs_qa	( ( ( Emma ) ) ( ( ( believed ) ( ( that ) ( ( ( a ) ( kid ) ) ( ( eats ) ) ) ) ) ( and ) ( ( juggled ) ( ( the ) ( cake ) ( ( on ) ( ( the ) ( tree ) ) ) ) ) ) )
The girl confessed that Liam likes Emma and froze a giraffe .	What is the ccomp of confessed ?	that Liam likes Emma	cogs_qa	( ( ( The ) ( girl ) ) ( ( ( confessed ) ( ( that ) ( ( ( Liam ) ) ( ( likes ) ( ( Emma ) ) ) ) ) ) ( and ) ( ( froze ) ( ( a ) ( giraffe ) ) ) ) )
James liked that Olivia examines and giggled .	What is the ccomp of liked ?	that Olivia examines	cogs_qa	( ( ( James ) ) ( ( ( liked ) ( ( that ) ( ( ( Olivia ) ) ( ( examines ) ) ) ) ) ( and ) ( ( giggled ) ) ) )
Liam admired that Sophia juggles the wine and investigated .	What is the ccomp of admired ?	that Sophia juggles the wine	cogs_qa	( ( ( Liam ) ) ( ( ( admired ) ( ( that ) ( ( ( Sophia ) ) ( ( juggles ) ( ( the ) ( wine ) ) ) ) ) ) ( and ) ( ( investigated ) ) ) )
Noah tolerated that the deer pokes the baby beside a table and laughed .	What is the ccomp of tolerated ?	that the deer pokes the baby beside a table	cogs_qa	( ( ( Noah ) ) ( ( ( tolerated ) ( ( that ) ( ( ( the ) ( deer ) ) ( ( pokes ) ( ( the ) ( baby ) ( ( beside ) ( ( a ) ( table ) ) ) ) ) ) ) ) ( and ) ( ( laughed ) ) ) )
The dog liked that Emma eats and observed .	What is the ccomp of liked ?	that Emma eats	cogs_qa	( ( ( The ) ( dog ) ) ( ( ( liked ) ( ( that ) ( ( ( Emma ) ) ( ( eats ) ) ) ) ) ( and ) ( ( observed ) ) ) )
A girl dreamed that Wyatt paints and helped the cake .	What is the ccomp of dreamed ?	that Wyatt paints	cogs_qa	( ( ( A ) ( girl ) ) ( ( ( dreamed ) ( ( that ) ( ( ( Wyatt ) ) ( ( paints ) ) ) ) ) ( and ) ( ( helped ) ( ( the ) ( cake ) ) ) ) )
A baby believed that a girl worships a balloon in the house and floated the sandwich .	What is the ccomp of believed ?	that a girl worships a balloon in the house	cogs_qa	( ( ( A ) ( baby ) ) ( ( ( believed ) ( ( that ) ( ( ( a ) ( girl ) ) ( ( worships ) ( ( a ) ( balloon ) ( ( in ) ( ( the ) ( house ) ) ) ) ) ) ) ) ( and ) ( ( floated ) ( ( the ) ( sandwich ) ) ) ) )
Emma said that Daniel finds the hamburger on a rug and rolled Liam .	What is the ccomp of said ?	that Daniel finds the hamburger on a rug	cogs_qa	( ( ( Emma ) ) ( ( ( said ) ( ( that ) ( ( ( Daniel ) ) ( ( finds ) ( ( the ) ( hamburger ) ( ( on ) ( ( a ) ( rug ) ) ) ) ) ) ) ) ( and ) ( ( rolled ) ( ( Liam ) ) ) ) )
The sheep admired that Isabella juggles and found the rose .	What is the ccomp of admired ?	that Isabella juggles	cogs_qa	( ( ( The ) ( sheep ) ) ( ( ( admired ) ( ( that ) ( ( ( Isabella ) ) ( ( juggles ) ) ) ) ) ( and ) ( ( found ) ( ( the ) ( rose ) ) ) ) )
The dog hoped that the princess paints Gabriel and rolled William .	What is the ccomp of hoped ?	that the princess paints Gabriel	cogs_qa	( ( ( The ) ( dog ) ) ( ( ( hoped ) ( ( that ) ( ( ( the ) ( princess ) ) ( ( paints ) ( ( Gabriel ) ) ) ) ) ) ( and ) ( ( rolled ) ( ( William ) ) ) ) )
Emma dreamed that the girl paints the donut and examined .	What is the ccomp of dreamed ?	that the girl paints the donut	cogs_qa	( ( ( Emma ) ) ( ( ( dreamed ) ( ( that ) ( ( ( the ) ( girl ) ) ( ( paints ) ( ( the ) ( donut ) ) ) ) ) ) ( and ) ( ( examined ) ) ) )
James hoped that a penguin likes the cake and rolled the melon .	What is the ccomp of hoped ?	that a penguin likes the cake	cogs_qa	( ( ( James ) ) ( ( ( hoped ) ( ( that ) ( ( ( a ) ( penguin ) ) ( ( likes ) ( ( the ) ( cake ) ) ) ) ) ) ( and ) ( ( rolled ) ( ( the ) ( melon ) ) ) ) )
Emma liked that Isabella rolls a spoon beside the cat and collapsed the cake beside the table .	What is the ccomp of liked ?	that Isabella rolls a spoon beside the cat	cogs_qa	( ( ( Emma ) ) ( ( ( liked ) ( ( that ) ( ( ( Isabella ) ) ( ( rolls ) ( ( a ) ( spoon ) ( ( beside ) ( ( the ) ( cat ) ) ) ) ) ) ) ) ( and ) ( ( collapsed ) ( ( the ) ( cake ) ( ( beside ) ( ( the ) ( table ) ) ) ) ) ) )
A boy liked that Olivia eats a donut beside the giant and shortened the soap .	What is the ccomp of liked ?	that Olivia eats a donut beside the giant	cogs_qa	( ( ( A ) ( boy ) ) ( ( ( liked ) ( ( that ) ( ( ( Olivia ) ) ( ( eats ) ( ( a ) ( donut ) ( ( beside ) ( ( the ) ( giant ) ) ) ) ) ) ) ) ( and ) ( ( shortened ) ( ( the ) ( soap ) ) ) ) )
A boy appreciated that a king draws a plant and slept .	What is the ccomp of appreciated ?	that a king draws a plant	cogs_qa	( ( ( A ) ( boy ) ) ( ( ( appreciated ) ( ( that ) ( ( ( a ) ( king ) ) ( ( draws ) ( ( a ) ( plant ) ) ) ) ) ) ( and ) ( ( slept ) ) ) )
Harper noticed that Matthew eats Riley and laughed .	What is the ccomp of noticed ?	that Matthew eats Riley	cogs_qa	( ( ( Harper ) ) ( ( ( noticed ) ( ( that ) ( ( ( Matthew ) ) ( ( eats ) ( ( Riley ) ) ) ) ) ) ( and ) ( ( laughed ) ) ) )
A child hoped that Isabella eats and respected Lillian .	What is the ccomp of hoped ?	that Isabella eats	cogs_qa	( ( ( A ) ( child ) ) ( ( ( hoped ) ( ( that ) ( ( ( Isabella ) ) ( ( eats ) ) ) ) ) ( and ) ( ( respected ) ( ( Lillian ) ) ) ) )
A baby hoped that William helps the cake and slept .	What is the ccomp of hoped ?	that William helps the cake	cogs_qa	( ( ( A ) ( baby ) ) ( ( ( hoped ) ( ( that ) ( ( ( William ) ) ( ( helps ) ( ( the ) ( cake ) ) ) ) ) ) ( and ) ( ( slept ) ) ) )
Emma declared that the cat helps the drink beside a tree and enlarged the baby in the box .	What is the ccomp of declared ?	that the cat helps the drink beside a tree	cogs_qa	( ( ( Emma ) ) ( ( ( declared ) ( ( that ) ( ( ( the ) ( cat ) ) ( ( helps ) ( ( the ) ( drink ) ( ( beside ) ( ( a ) ( tree ) ) ) ) ) ) ) ) ( and ) ( ( enlarged ) ( ( the ) ( baby ) ( ( in ) ( ( the ) ( box ) ) ) ) ) ) )
