David confessed that Emma sketches Liam and ate the tiger on the table .	What is the ccomp of confessed ?	that Emma sketches Liam	cogs_qa	( ( ( David ) ) ( ( ( confessed ) ( ( that ) ( ( ( Emma ) ) ( ( sketches ) ( ( Liam ) ) ) ) ) ) ( and ) ( ( ate ) ( ( the ) ( tiger ) ( ( on ) ( ( the ) ( table ) ) ) ) ) ) )
Liam believed that Olivia laughs and called Emma .	What is the ccomp of believed ?	that Olivia laughs	cogs_qa	( ( ( Liam ) ) ( ( ( believed ) ( ( that ) ( ( ( Olivia ) ) ( ( laughs ) ) ) ) ) ( and ) ( ( called ) ( ( Emma ) ) ) ) )
The dog hoped that Emma eats and knew the cookie .	What is the ccomp of hoped ?	that Emma eats	cogs_qa	( ( ( The ) ( dog ) ) ( ( ( hoped ) ( ( that ) ( ( ( Emma ) ) ( ( eats ) ) ) ) ) ( and ) ( ( knew ) ( ( the ) ( cookie ) ) ) ) )
A soldier proved that a baby cooks the cake on a tray and disintegrated a donut on a blanket .	What is the ccomp of proved ?	that a baby cooks the cake on a tray	cogs_qa	( ( ( A ) ( soldier ) ) ( ( ( proved ) ( ( that ) ( ( ( a ) ( baby ) ) ( ( cooks ) ( ( the ) ( cake ) ( ( on ) ( ( a ) ( tray ) ) ) ) ) ) ) ) ( and ) ( ( disintegrated ) ( ( a ) ( donut ) ( ( on ) ( ( a ) ( blanket ) ) ) ) ) ) )
Noah thought that Emma draws and cooked .	What is the ccomp of thought ?	that Emma draws	cogs_qa	( ( ( Noah ) ) ( ( ( thought ) ( ( that ) ( ( ( Emma ) ) ( ( draws ) ) ) ) ) ( and ) ( ( cooked ) ) ) )
A boy liked that Emma paints a hero and ate the gumball .	What is the ccomp of liked ?	that Emma paints a hero	cogs_qa	( ( ( A ) ( boy ) ) ( ( ( liked ) ( ( that ) ( ( ( Emma ) ) ( ( paints ) ( ( a ) ( hero ) ) ) ) ) ) ( and ) ( ( ate ) ( ( the ) ( gumball ) ) ) ) )
The teacher hoped that Mila eats a girl and observed .	What is the ccomp of hoped ?	that Mila eats a girl	cogs_qa	( ( ( The ) ( teacher ) ) ( ( ( hoped ) ( ( that ) ( ( ( Mila ) ) ( ( eats ) ( ( a ) ( girl ) ) ) ) ) ) ( and ) ( ( observed ) ) ) )
The girl hoped that Noah eats a melon and studied .	What is the ccomp of hoped ?	that Noah eats a melon	cogs_qa	( ( ( The ) ( girl ) ) ( ( ( hoped ) ( ( that ) ( ( ( Noah ) ) ( ( eats ) ( ( a ) ( melon ) ) ) ) ) ) ( and ) ( ( studied ) ) ) )
Mia hoped that William paints the cake and nursed Joshua .	What is the ccomp of hoped ?	that William paints the cake	cogs_qa	( ( ( Mia ) ) ( ( ( hoped ) ( ( that ) ( ( ( William ) ) ( ( paints ) ( ( the ) ( cake ) ) ) ) ) ) ( and ) ( ( nursed ) ( ( Joshua ) ) ) ) )
A pig said that the dog gasps and painted .	What is the ccomp of said ?	that the dog gasps	cogs_qa	( ( ( A ) ( pig ) ) ( ( ( said ) ( ( that ) ( ( ( the ) ( dog ) ) ( ( gasps ) ) ) ) ) ( and ) ( ( painted ) ) ) )
Emma declared that the president rolls a cake beside the chair and ate the cat .	What is the ccomp of declared ?	that the president rolls a cake beside the chair	cogs_qa	( ( ( Emma ) ) ( ( ( declared ) ( ( that ) ( ( ( the ) ( president ) ) ( ( rolls ) ( ( a ) ( cake ) ( ( beside ) ( ( the ) ( chair ) ) ) ) ) ) ) ) ( and ) ( ( ate ) ( ( the ) ( cat ) ) ) ) )
Ella noticed that Olivia burns David and liked a flag on the stage .	What is the ccomp of noticed ?	that Olivia burns David	cogs_qa	( ( ( Ella ) ) ( ( ( noticed ) ( ( that ) ( ( ( Olivia ) ) ( ( burns ) ( ( David ) ) ) ) ) ) ( and ) ( ( liked ) ( ( a ) ( flag ) ( ( on ) ( ( the ) ( stage ) ) ) ) ) ) )
Emma liked that a cat burns William and cleaned .	What is the ccomp of liked ?	that a cat burns William	cogs_qa	( ( ( Emma ) ) ( ( ( liked ) ( ( that ) ( ( ( a ) ( cat ) ) ( ( burns ) ( ( William ) ) ) ) ) ) ( and ) ( ( cleaned ) ) ) )
Victoria admired that the resident sneezes and rolled a professor .	What is the ccomp of admired ?	that the resident sneezes	cogs_qa	( ( ( Victoria ) ) ( ( ( admired ) ( ( that ) ( ( ( the ) ( resident ) ) ( ( sneezes ) ) ) ) ) ( and ) ( ( rolled ) ( ( a ) ( professor ) ) ) ) )
A girl noticed that Noah eats and stuttered .	What is the ccomp of noticed ?	that Noah eats	cogs_qa	( ( ( A ) ( girl ) ) ( ( ( noticed ) ( ( that ) ( ( ( Noah ) ) ( ( eats ) ) ) ) ) ( and ) ( ( stuttered ) ) ) )
The girl supported that Olivia sleeps and cooked the donut .	What is the ccomp of supported ?	that Olivia sleeps	cogs_qa	( ( ( The ) ( girl ) ) ( ( ( supported ) ( ( that ) ( ( ( Olivia ) ) ( ( sleeps ) ) ) ) ) ( and ) ( ( cooked ) ( ( the ) ( donut ) ) ) ) )
The cat said that the boy burns Benjamin and screamed .	What is the ccomp of said ?	that the boy burns Benjamin	cogs_qa	( ( ( The ) ( cat ) ) ( ( ( said ) ( ( that ) ( ( ( the ) ( boy ) ) ( ( burns ) ( ( Benjamin ) ) ) ) ) ) ( and ) ( ( screamed ) ) ) )
William valued that a cat cooks and slept .	What is the ccomp of valued ?	that a cat cooks	cogs_qa	( ( ( William ) ) ( ( ( valued ) ( ( that ) ( ( ( a ) ( cat ) ) ( ( cooks ) ) ) ) ) ( and ) ( ( slept ) ) ) )
Ava imagined that Emma cooks a donut beside a table and painted Matthew .	What is the ccomp of imagined ?	that Emma cooks a donut beside a table	cogs_qa	( ( ( Ava ) ) ( ( ( imagined ) ( ( that ) ( ( ( Emma ) ) ( ( cooks ) ( ( a ) ( donut ) ( ( beside ) ( ( a ) ( table ) ) ) ) ) ) ) ) ( and ) ( ( painted ) ( ( Matthew ) ) ) ) )
A mother imagined that a tiger adores Logan and found William .	What is the ccomp of imagined ?	that a tiger adores Logan	cogs_qa	( ( ( A ) ( mother ) ) ( ( ( imagined ) ( ( that ) ( ( ( a ) ( tiger ) ) ( ( adores ) ( ( Logan ) ) ) ) ) ) ( and ) ( ( found ) ( ( William ) ) ) ) )
Alexander hoped that Liam paints the brush and observed .	What is the ccomp of hoped ?	that Liam paints the brush	cogs_qa	( ( ( Alexander ) ) ( ( ( hoped ) ( ( that ) ( ( ( Liam ) ) ( ( paints ) ( ( the ) ( brush ) ) ) ) ) ) ( and ) ( ( observed ) ) ) )
The boy liked that a lion freezes a cookie and slept .	What is the ccomp of liked ?	that a lion freezes a cookie	cogs_qa	( ( ( The ) ( boy ) ) ( ( ( liked ) ( ( that ) ( ( ( a ) ( lion ) ) ( ( freezes ) ( ( a ) ( cookie ) ) ) ) ) ) ( and ) ( ( slept ) ) ) )
Emma hoped that Sophia eats and scoffed .	What is the ccomp of hoped ?	that Sophia eats	cogs_qa	( ( ( Emma ) ) ( ( ( hoped ) ( ( that ) ( ( ( Sophia ) ) ( ( eats ) ) ) ) ) ( and ) ( ( scoffed ) ) ) )
Olivia hoped that a girl cooks a boy and ate Noah .	What is the ccomp of hoped ?	that a girl cooks a boy	cogs_qa	( ( ( Olivia ) ) ( ( ( hoped ) ( ( that ) ( ( ( a ) ( girl ) ) ( ( cooks ) ( ( a ) ( boy ) ) ) ) ) ) ( and ) ( ( ate ) ( ( Noah ) ) ) ) )
Noah liked that a girl draws a cookie in the room and laughed .	What is the ccomp of liked ?	that a girl draws a cookie in the room	cogs_qa	( ( ( Noah ) ) ( ( ( liked ) ( ( that ) ( ( ( a ) ( girl ) ) ( ( draws ) ( ( a ) ( cookie ) ( ( in ) ( ( the ) ( room ) ) ) ) ) ) ) ) ( and ) ( ( laughed ) ) ) )
A creature hoped that Benjamin floats a boy in the house and knew .	What is the ccomp of hoped ?	that Benjamin floats a boy in the house	cogs_qa	( ( ( A ) ( creature ) ) ( ( ( hoped ) ( ( that ) ( ( ( Benjamin ) ) ( ( floats ) ( ( a ) ( boy ) ( ( in ) ( ( the ) ( house ) ) ) ) ) ) ) ) ( and ) ( ( knew ) ) ) )
A teacher appreciated that the cat studies a drink and ate the donut beside a stage .	What is the ccomp of appreciated ?	that the cat studies a drink	cogs_qa	( ( ( A ) ( teacher ) ) ( ( ( appreciated ) ( ( that ) ( ( ( the ) ( cat ) ) ( ( studies ) ( ( a ) ( drink ) ) ) ) ) ) ( and ) ( ( ate ) ( ( the ) ( donut ) ( ( beside ) ( ( a ) ( stage ) ) ) ) ) ) )
A cat tolerated that Logan shortens the fly and found a dog beside a speaker .	What is the ccomp of tolerated ?	that Logan shortens the fly	cogs_qa	( ( ( A ) ( cat ) ) ( ( ( tolerated ) ( ( that ) ( ( ( Logan ) ) ( ( shortens ) ( ( the ) ( fly ) ) ) ) ) ) ( and ) ( ( found ) ( ( a ) ( dog ) ( ( beside ) ( ( a ) ( speaker ) ) ) ) ) ) )
A host hoped that Emma loves a donut on the table and noticed .	What is the ccomp of hoped ?	that Emma loves a donut on the table	cogs_qa	( ( ( A ) ( host ) ) ( ( ( hoped ) ( ( that ) ( ( ( Emma ) ) ( ( loves ) ( ( a ) ( donut ) ( ( on ) ( ( the ) ( table ) ) ) ) ) ) ) ) ( and ) ( ( noticed ) ) ) )
The girl appreciated that Noah draws a cake on a table and packed the hamburger in a cup .	What is the ccomp of appreciated ?	that Noah draws a cake on a table	cogs_qa	( ( ( The ) ( girl ) ) ( ( ( appreciated ) ( ( that ) ( ( ( Noah ) ) ( ( draws ) ( ( a ) ( cake ) ( ( on ) ( ( a ) ( table ) ) ) ) ) ) ) ) ( and ) ( ( packed ) ( ( the ) ( hamburger ) ( ( in ) ( ( a ) ( cup ) ) ) ) ) ) )
A teacher liked that Noah inflates the boy and cried .	What is the ccomp of liked ?	that Noah inflates the boy	cogs_qa	( ( ( A ) ( teacher ) ) ( ( ( liked ) ( ( that ) ( ( ( Noah ) ) ( ( inflates ) ( ( the ) ( boy ) ) ) ) ) ) ( and ) ( ( cried ) ) ) )
Oliver hoped that the child sketches and painted Emma .	What is the ccomp of hoped ?	that the child sketches	cogs_qa	( ( ( Oliver ) ) ( ( ( hoped ) ( ( that ) ( ( ( the ) ( child ) ) ( ( sketches ) ) ) ) ) ( and ) ( ( painted ) ( ( Emma ) ) ) ) )
The baby tolerated that Emma finds a donut and ate a raisin on a chair .	What is the ccomp of tolerated ?	that Emma finds a donut	cogs_qa	( ( ( The ) ( baby ) ) ( ( ( tolerated ) ( ( that ) ( ( ( Emma ) ) ( ( finds ) ( ( a ) ( donut ) ) ) ) ) ) ( and ) ( ( ate ) ( ( a ) ( raisin ) ( ( on ) ( ( a ) ( chair ) ) ) ) ) ) )
Emma hoped that the penguin hears and dusted .	What is the ccomp of hoped ?	that the penguin hears	cogs_qa	( ( ( Emma ) ) ( ( ( hoped ) ( ( that ) ( ( ( the ) ( penguin ) ) ( ( hears ) ) ) ) ) ( and ) ( ( dusted ) ) ) )
Emma noticed that Noah nurses the chalk and snoozed .	What is the ccomp of noticed ?	that Noah nurses the chalk	cogs_qa	( ( ( Emma ) ) ( ( ( noticed ) ( ( that ) ( ( ( Noah ) ) ( ( nurses ) ( ( the ) ( chalk ) ) ) ) ) ) ( and ) ( ( snoozed ) ) ) )
The boy appreciated that Olivia cries and loved the cake beside the machine .	What is the ccomp of appreciated ?	that Olivia cries	cogs_qa	( ( ( The ) ( boy ) ) ( ( ( appreciated ) ( ( that ) ( ( ( Olivia ) ) ( ( cries ) ) ) ) ) ( and ) ( ( loved ) ( ( the ) ( cake ) ( ( beside ) ( ( the ) ( machine ) ) ) ) ) ) )
The girl liked that the boy eats and called Penelope .	What is the ccomp of liked ?	that the boy eats	cogs_qa	( ( ( The ) ( girl ) ) ( ( ( liked ) ( ( that ) ( ( ( the ) ( boy ) ) ( ( eats ) ) ) ) ) ( and ) ( ( called ) ( ( Penelope ) ) ) ) )
A bunny liked that Emma rolls the girl and observed .	What is the ccomp of liked ?	that Emma rolls the girl	cogs_qa	( ( ( A ) ( bunny ) ) ( ( ( liked ) ( ( that ) ( ( ( Emma ) ) ( ( rolls ) ( ( the ) ( girl ) ) ) ) ) ) ( and ) ( ( observed ) ) ) )
The boy liked that Liam slides the glue beside a seat and painted a bag in the hole .	What is the ccomp of liked ?	that Liam slides the glue beside a seat	cogs_qa	( ( ( The ) ( boy ) ) ( ( ( liked ) ( ( that ) ( ( ( Liam ) ) ( ( slides ) ( ( the ) ( glue ) ( ( beside ) ( ( a ) ( seat ) ) ) ) ) ) ) ) ( and ) ( ( painted ) ( ( a ) ( bag ) ( ( in ) ( ( the ) ( hole ) ) ) ) ) ) )
Henry hoped that Noah inflates the cookie and cleaned a muffin in the house in a cup .	What is the ccomp of hoped ?	that Noah inflates the cookie	cogs_qa	( ( ( Henry ) ) ( ( ( hoped ) ( ( that ) ( ( ( Noah ) ) ( ( inflates ) ( ( the ) ( cookie ) ) ) ) ) ) ( and ) ( ( cleaned ) ( ( a ) ( muffin ) ( ( in ) ( ( the ) ( house ) ( ( in ) ( ( a ) ( cup ) ) ) ) ) ) ) ) )
Emma appreciated that the girl sleeps and cleaned Elijah .	What is the ccomp of appreciated ?	that the girl sleeps	cogs_qa	( ( ( Emma ) ) ( ( ( appreciated ) ( ( that ) ( ( ( the ) ( girl ) ) ( ( sleeps ) ) ) ) ) ( and ) ( ( cleaned ) ( ( Elijah ) ) ) ) )
A dog liked that Liam paints Emma and investigated .	What is the ccomp of liked ?	that Liam paints Emma	cogs_qa	( ( ( A ) ( dog ) ) ( ( ( liked ) ( ( that ) ( ( ( Liam ) ) ( ( paints ) ( ( Emma ) ) ) ) ) ) ( and ) ( ( investigated ) ) ) )
Harper expected that a boy loves a cat and smiled .	What is the ccomp of expected ?	that a boy loves a cat	cogs_qa	( ( ( Harper ) ) ( ( ( expected ) ( ( that ) ( ( ( a ) ( boy ) ) ( ( loves ) ( ( a ) ( cat ) ) ) ) ) ) ( and ) ( ( smiled ) ) ) )
A dog hoped that Emma cleans and painted the rose in a car .	What is the ccomp of hoped ?	that Emma cleans	cogs_qa	( ( ( A ) ( dog ) ) ( ( ( hoped ) ( ( that ) ( ( ( Emma ) ) ( ( cleans ) ) ) ) ) ( and ) ( ( painted ) ( ( the ) ( rose ) ( ( in ) ( ( a ) ( car ) ) ) ) ) ) )
The dog hoped that Theodore laughs and slept .	What is the ccomp of hoped ?	that Theodore laughs	cogs_qa	( ( ( The ) ( dog ) ) ( ( ( hoped ) ( ( that ) ( ( ( Theodore ) ) ( ( laughs ) ) ) ) ) ( and ) ( ( slept ) ) ) )
Andrew proved that the monkey freezes the child and painted .	What is the ccomp of proved ?	that the monkey freezes the child	cogs_qa	( ( ( Andrew ) ) ( ( ( proved ) ( ( that ) ( ( ( the ) ( monkey ) ) ( ( freezes ) ( ( the ) ( child ) ) ) ) ) ) ( and ) ( ( painted ) ) ) )
Anthony liked that a doctor stabs Emma and cried .	What is the ccomp of liked ?	that a doctor stabs Emma	cogs_qa	( ( ( Anthony ) ) ( ( ( liked ) ( ( that ) ( ( ( a ) ( doctor ) ) ( ( stabs ) ( ( Emma ) ) ) ) ) ) ( and ) ( ( cried ) ) ) )
Oliver wished that the girl splits a muffin and jogged .	What is the ccomp of wished ?	that the girl splits a muffin	cogs_qa	( ( ( Oliver ) ) ( ( ( wished ) ( ( that ) ( ( ( the ) ( girl ) ) ( ( splits ) ( ( a ) ( muffin ) ) ) ) ) ) ( and ) ( ( jogged ) ) ) )
The cat appreciated that the girl rolls John and split the bird on a stage .	What is the ccomp of appreciated ?	that the girl rolls John	cogs_qa	( ( ( The ) ( cat ) ) ( ( ( appreciated ) ( ( that ) ( ( ( the ) ( girl ) ) ( ( rolls ) ( ( John ) ) ) ) ) ) ( and ) ( ( split ) ( ( the ) ( bird ) ( ( on ) ( ( a ) ( stage ) ) ) ) ) ) )
The girl confessed that Emma rolls a cake on the ball and laughed .	What is the ccomp of confessed ?	that Emma rolls a cake on the ball	cogs_qa	( ( ( The ) ( girl ) ) ( ( ( confessed ) ( ( that ) ( ( ( Emma ) ) ( ( rolls ) ( ( a ) ( cake ) ( ( on ) ( ( the ) ( ball ) ) ) ) ) ) ) ) ( and ) ( ( laughed ) ) ) )
The boy meant that Noah likes a monkey and investigated the girl .	What is the ccomp of meant ?	that Noah likes a monkey	cogs_qa	( ( ( The ) ( boy ) ) ( ( ( meant ) ( ( that ) ( ( ( Noah ) ) ( ( likes ) ( ( a ) ( monkey ) ) ) ) ) ) ( and ) ( ( investigated ) ( ( the ) ( girl ) ) ) ) )
William liked that Sophia cleans Oliver and dusted the balloon beside the tree .	What is the ccomp of liked ?	that Sophia cleans Oliver	cogs_qa	( ( ( William ) ) ( ( ( liked ) ( ( that ) ( ( ( Sophia ) ) ( ( cleans ) ( ( Oliver ) ) ) ) ) ) ( and ) ( ( dusted ) ( ( the ) ( balloon ) ( ( beside ) ( ( the ) ( tree ) ) ) ) ) ) )
The baby imagined that Liam cleans and slept .	What is the ccomp of imagined ?	that Liam cleans	cogs_qa	( ( ( The ) ( baby ) ) ( ( ( imagined ) ( ( that ) ( ( ( Liam ) ) ( ( cleans ) ) ) ) ) ( and ) ( ( slept ) ) ) )
The cat noticed that James draws a dog beside a road and floated a cookie .	What is the ccomp of noticed ?	that James draws a dog beside a road	cogs_qa	( ( ( The ) ( cat ) ) ( ( ( noticed ) ( ( that ) ( ( ( James ) ) ( ( draws ) ( ( a ) ( dog ) ( ( beside ) ( ( a ) ( road ) ) ) ) ) ) ) ) ( and ) ( ( floated ) ( ( a ) ( cookie ) ) ) ) )
Ava believed that Aiden worships the cake and slept .	What is the ccomp of believed ?	that Aiden worships the cake	cogs_qa	( ( ( Ava ) ) ( ( ( believed ) ( ( that ) ( ( ( Aiden ) ) ( ( worships ) ( ( the ) ( cake ) ) ) ) ) ) ( and ) ( ( slept ) ) ) )
A girl hoped that Liam shortens Emma and laughed .	What is the ccomp of hoped ?	that Liam shortens Emma	cogs_qa	( ( ( A ) ( girl ) ) ( ( ( hoped ) ( ( that ) ( ( ( Liam ) ) ( ( shortens ) ( ( Emma ) ) ) ) ) ) ( and ) ( ( laughed ) ) ) )
Zoe liked that the crocodile sleeps and smiled .	What is the ccomp of liked ?	that the crocodile sleeps	cogs_qa	( ( ( Zoe ) ) ( ( ( liked ) ( ( that ) ( ( ( the ) ( crocodile ) ) ( ( sleeps ) ) ) ) ) ( and ) ( ( smiled ) ) ) )
Theodore liked that the girl finds a cake on a table and ate .	What is the ccomp of liked ?	that the girl finds a cake on a table	cogs_qa	( ( ( Theodore ) ) ( ( ( liked ) ( ( that ) ( ( ( the ) ( girl ) ) ( ( finds ) ( ( a ) ( cake ) ( ( on ) ( ( a ) ( table ) ) ) ) ) ) ) ) ( and ) ( ( ate ) ) ) )
Logan admired that Liam laughs and ate .	What is the ccomp of admired ?	that Liam laughs	cogs_qa	( ( ( Logan ) ) ( ( ( admired ) ( ( that ) ( ( ( Liam ) ) ( ( laughs ) ) ) ) ) ( and ) ( ( ate ) ) ) )
Olivia hoped that a captain paints the biscuit in the house and saw a cake beside a painting .	What is the ccomp of hoped ?	that a captain paints the biscuit in the house	cogs_qa	( ( ( Olivia ) ) ( ( ( hoped ) ( ( that ) ( ( ( a ) ( captain ) ) ( ( paints ) ( ( the ) ( biscuit ) ( ( in ) ( ( the ) ( house ) ) ) ) ) ) ) ) ( and ) ( ( saw ) ( ( a ) ( cake ) ( ( beside ) ( ( a ) ( painting ) ) ) ) ) ) )
A chicken imagined that the girl cooks a boy and examined .	What is the ccomp of imagined ?	that the girl cooks a boy	cogs_qa	( ( ( A ) ( chicken ) ) ( ( ( imagined ) ( ( that ) ( ( ( the ) ( girl ) ) ( ( cooks ) ( ( a ) ( boy ) ) ) ) ) ) ( and ) ( ( examined ) ) ) )
A cat liked that a duck adores a crown in a room and jogged .	What is the ccomp of liked ?	that a duck adores a crown in a room	cogs_qa	( ( ( A ) ( cat ) ) ( ( ( liked ) ( ( that ) ( ( ( a ) ( duck ) ) ( ( adores ) ( ( a ) ( crown ) ( ( in ) ( ( a ) ( room ) ) ) ) ) ) ) ) ( and ) ( ( jogged ) ) ) )
A baby valued that a pupil rolls Sofia and stuttered .	What is the ccomp of valued ?	that a pupil rolls Sofia	cogs_qa	( ( ( A ) ( baby ) ) ( ( ( valued ) ( ( that ) ( ( ( a ) ( pupil ) ) ( ( rolls ) ( ( Sofia ) ) ) ) ) ) ( and ) ( ( stuttered ) ) ) )
Luna proved that Emma packs and sneezed .	What is the ccomp of proved ?	that Emma packs	cogs_qa	( ( ( Luna ) ) ( ( ( proved ) ( ( that ) ( ( ( Emma ) ) ( ( packs ) ) ) ) ) ( and ) ( ( sneezed ) ) ) )
A patient hoped that a girl adores the chalk and cleaned .	What is the ccomp of hoped ?	that a girl adores the chalk	cogs_qa	( ( ( A ) ( patient ) ) ( ( ( hoped ) ( ( that ) ( ( ( a ) ( girl ) ) ( ( adores ) ( ( the ) ( chalk ) ) ) ) ) ) ( and ) ( ( cleaned ) ) ) )
Emma expected that a customer eats and found the girl beside a chair .	What is the ccomp of expected ?	that a customer eats	cogs_qa	( ( ( Emma ) ) ( ( ( expected ) ( ( that ) ( ( ( a ) ( customer ) ) ( ( eats ) ) ) ) ) ( and ) ( ( found ) ( ( the ) ( girl ) ( ( beside ) ( ( a ) ( chair ) ) ) ) ) ) )
The teacher noticed that Camila cleans a bat and enlarged Olivia .	What is the ccomp of noticed ?	that Camila cleans a bat	cogs_qa	( ( ( The ) ( teacher ) ) ( ( ( noticed ) ( ( that ) ( ( ( Camila ) ) ( ( cleans ) ( ( a ) ( bat ) ) ) ) ) ) ( and ) ( ( enlarged ) ( ( Olivia ) ) ) ) )
Emma liked that Abigail freezes Liam and dusted the teacher .	What is the ccomp of liked ?	that Abigail freezes Liam	cogs_qa	( ( ( Emma ) ) ( ( ( liked ) ( ( that ) ( ( ( Abigail ) ) ( ( freezes ) ( ( Liam ) ) ) ) ) ) ( and ) ( ( dusted ) ( ( the ) ( teacher ) ) ) ) )
William hoped that Liam cleans the cookie in the house and rolled the baby .	What is the ccomp of hoped ?	that Liam cleans the cookie in the house	cogs_qa	( ( ( William ) ) ( ( ( hoped ) ( ( that ) ( ( ( Liam ) ) ( ( cleans ) ( ( the ) ( cookie ) ( ( in ) ( ( the ) ( house ) ) ) ) ) ) ) ) ( and ) ( ( rolled ) ( ( the ) ( baby ) ) ) ) )
The girl liked that Emma sleeps and dusted .	What is the ccomp of liked ?	that Emma sleeps	cogs_qa	( ( ( The ) ( girl ) ) ( ( ( liked ) ( ( that ) ( ( ( Emma ) ) ( ( sleeps ) ) ) ) ) ( and ) ( ( dusted ) ) ) )
Ava hoped that Olivia tosses the book on a table and admired the driver beside a speaker .	What is the ccomp of hoped ?	that Olivia tosses the book on a table	cogs_qa	( ( ( Ava ) ) ( ( ( hoped ) ( ( that ) ( ( ( Olivia ) ) ( ( tosses ) ( ( the ) ( book ) ( ( on ) ( ( a ) ( table ) ) ) ) ) ) ) ) ( and ) ( ( admired ) ( ( the ) ( driver ) ( ( beside ) ( ( a ) ( speaker ) ) ) ) ) ) )
The father liked that the girl pokes Isabella and slept .	What is the ccomp of liked ?	that the girl pokes Isabella	cogs_qa	( ( ( The ) ( father ) ) ( ( ( liked ) ( ( that ) ( ( ( the ) ( girl ) ) ( ( pokes ) ( ( Isabella ) ) ) ) ) ) ( and ) ( ( slept ) ) ) )
Liam liked that Olivia rolls a donut in the house and tossed the girl on a bench on a table .	What is the ccomp of liked ?	that Olivia rolls a donut in the house	cogs_qa	( ( ( Liam ) ) ( ( ( liked ) ( ( that ) ( ( ( Olivia ) ) ( ( rolls ) ( ( a ) ( donut ) ( ( in ) ( ( the ) ( house ) ) ) ) ) ) ) ) ( and ) ( ( tossed ) ( ( the ) ( girl ) ( ( on ) ( ( a ) ( bench ) ( ( on ) ( ( a ) ( table ) ) ) ) ) ) ) ) )
A customer liked that the mouse respects the book and ate .	What is the ccomp of liked ?	that the mouse respects the book	cogs_qa	( ( ( A ) ( customer ) ) ( ( ( liked ) ( ( that ) ( ( ( the ) ( mouse ) ) ( ( respects ) ( ( the ) ( book ) ) ) ) ) ) ( and ) ( ( ate ) ) ) )
A mouse liked that Emma helps the squirrel and rolled a bag .	What is the ccomp of liked ?	that Emma helps the squirrel	cogs_qa	( ( ( A ) ( mouse ) ) ( ( ( liked ) ( ( that ) ( ( ( Emma ) ) ( ( helps ) ( ( the ) ( squirrel ) ) ) ) ) ) ( and ) ( ( rolled ) ( ( a ) ( bag ) ) ) ) )
Olivia confessed that Ava floats the cat on the bible on the blanket and ate a girl .	What is the ccomp of confessed ?	that Ava floats the cat on the bible on the blanket	cogs_qa	( ( ( Olivia ) ) ( ( ( confessed ) ( ( that ) ( ( ( Ava ) ) ( ( floats ) ( ( the ) ( cat ) ( ( on ) ( ( the ) ( bible ) ( ( on ) ( ( the ) ( blanket ) ) ) ) ) ) ) ) ) ) ( and ) ( ( ate ) ( ( a ) ( girl ) ) ) ) )
William respected that a girl sleeps and noticed .	What is the ccomp of respected ?	that a girl sleeps	cogs_qa	( ( ( William ) ) ( ( ( respected ) ( ( that ) ( ( ( a ) ( girl ) ) ( ( sleeps ) ) ) ) ) ( and ) ( ( noticed ) ) ) )
The girl thought that Harper eats and slept .	What is the ccomp of thought ?	that Harper eats	cogs_qa	( ( ( The ) ( girl ) ) ( ( ( thought ) ( ( that ) ( ( ( Harper ) ) ( ( eats ) ) ) ) ) ( and ) ( ( slept ) ) ) )
Emma admired that a chicken hunts and touched the girl in the coffin .	What is the ccomp of admired ?	that a chicken hunts	cogs_qa	( ( ( Emma ) ) ( ( ( admired ) ( ( that ) ( ( ( a ) ( chicken ) ) ( ( hunts ) ) ) ) ) ( and ) ( ( touched ) ( ( the ) ( girl ) ( ( in ) ( ( the ) ( coffin ) ) ) ) ) ) )
Noah tolerated that the penguin paints a girl beside the tree and ate .	What is the ccomp of tolerated ?	that the penguin paints a girl beside the tree	cogs_qa	( ( ( Noah ) ) ( ( ( tolerated ) ( ( that ) ( ( ( the ) ( penguin ) ) ( ( paints ) ( ( a ) ( girl ) ( ( beside ) ( ( the ) ( tree ) ) ) ) ) ) ) ) ( and ) ( ( ate ) ) ) )
A boy supported that Liam sketches Charlotte and found Emma .	What is the ccomp of supported ?	that Liam sketches Charlotte	cogs_qa	( ( ( A ) ( boy ) ) ( ( ( supported ) ( ( that ) ( ( ( Liam ) ) ( ( sketches ) ( ( Charlotte ) ) ) ) ) ) ( and ) ( ( found ) ( ( Emma ) ) ) ) )
The boy liked that Aiden jogs and slept .	What is the ccomp of liked ?	that Aiden jogs	cogs_qa	( ( ( The ) ( boy ) ) ( ( ( liked ) ( ( that ) ( ( ( Aiden ) ) ( ( jogs ) ) ) ) ) ( and ) ( ( slept ) ) ) )
A girl admired that Isaac smiles and drew .	What is the ccomp of admired ?	that Isaac smiles	cogs_qa	( ( ( A ) ( girl ) ) ( ( ( admired ) ( ( that ) ( ( ( Isaac ) ) ( ( smiles ) ) ) ) ) ( and ) ( ( drew ) ) ) )
Oliver liked that the dog helps Liam and heard .	What is the ccomp of liked ?	that the dog helps Liam	cogs_qa	( ( ( Oliver ) ) ( ( ( liked ) ( ( that ) ( ( ( the ) ( dog ) ) ( ( helps ) ( ( Liam ) ) ) ) ) ) ( and ) ( ( heard ) ) ) )
Liam imagined that Harper smiles and slept .	What is the ccomp of imagined ?	that Harper smiles	cogs_qa	( ( ( Liam ) ) ( ( ( imagined ) ( ( that ) ( ( ( Harper ) ) ( ( smiles ) ) ) ) ) ( and ) ( ( slept ) ) ) )
A boy liked that Ethan rolls the girl and helped William .	What is the ccomp of liked ?	that Ethan rolls the girl	cogs_qa	( ( ( A ) ( boy ) ) ( ( ( liked ) ( ( that ) ( ( ( Ethan ) ) ( ( rolls ) ( ( the ) ( girl ) ) ) ) ) ) ( and ) ( ( helped ) ( ( William ) ) ) ) )
A cat thought that a chicken helps a girl and ate the donut .	What is the ccomp of thought ?	that a chicken helps a girl	cogs_qa	( ( ( A ) ( cat ) ) ( ( ( thought ) ( ( that ) ( ( ( a ) ( chicken ) ) ( ( helps ) ( ( a ) ( girl ) ) ) ) ) ) ( and ) ( ( ate ) ( ( the ) ( donut ) ) ) ) )
The girl wished that Oliver likes a cat and giggled .	What is the ccomp of wished ?	that Oliver likes a cat	cogs_qa	( ( ( The ) ( girl ) ) ( ( ( wished ) ( ( that ) ( ( ( Oliver ) ) ( ( likes ) ( ( a ) ( cat ) ) ) ) ) ) ( and ) ( ( giggled ) ) ) )
The girl declared that the boy sleeps and froze the cake in a cafe .	What is the ccomp of declared ?	that the boy sleeps	cogs_qa	( ( ( The ) ( girl ) ) ( ( ( declared ) ( ( that ) ( ( ( the ) ( boy ) ) ( ( sleeps ) ) ) ) ) ( and ) ( ( froze ) ( ( the ) ( cake ) ( ( in ) ( ( a ) ( cafe ) ) ) ) ) ) )
Emma liked that Olivia investigates the fig and smiled .	What is the ccomp of liked ?	that Olivia investigates the fig	cogs_qa	( ( ( Emma ) ) ( ( ( liked ) ( ( that ) ( ( ( Olivia ) ) ( ( investigates ) ( ( the ) ( fig ) ) ) ) ) ) ( and ) ( ( smiled ) ) ) )
Joseph liked that Amelia laughs and froze a dealer .	What is the ccomp of liked ?	that Amelia laughs	cogs_qa	( ( ( Joseph ) ) ( ( ( liked ) ( ( that ) ( ( ( Amelia ) ) ( ( laughs ) ) ) ) ) ( and ) ( ( froze ) ( ( a ) ( dealer ) ) ) ) )
A girl tolerated that a baby likes Noah and slept .	What is the ccomp of tolerated ?	that a baby likes Noah	cogs_qa	( ( ( A ) ( girl ) ) ( ( ( tolerated ) ( ( that ) ( ( ( a ) ( baby ) ) ( ( likes ) ( ( Noah ) ) ) ) ) ) ( and ) ( ( slept ) ) ) )
The writer admired that Matthew cooks a drink and doubled a cake on the table .	What is the ccomp of admired ?	that Matthew cooks a drink	cogs_qa	( ( ( The ) ( writer ) ) ( ( ( admired ) ( ( that ) ( ( ( Matthew ) ) ( ( cooks ) ( ( a ) ( drink ) ) ) ) ) ) ( and ) ( ( doubled ) ( ( a ) ( cake ) ( ( on ) ( ( the ) ( table ) ) ) ) ) ) )
Hazel liked that a cat sneezes and snoozed .	What is the ccomp of liked ?	that a cat sneezes	cogs_qa	( ( ( Hazel ) ) ( ( ( liked ) ( ( that ) ( ( ( a ) ( cat ) ) ( ( sneezes ) ) ) ) ) ( and ) ( ( snoozed ) ) ) )
